{
  "appid": "me.hackerchick.sharetoinputstick",
  "tags": {
    "v3.6.1": [
      {
        "appid": "me.hackerchick.sharetoinputstick",
        "version_code": 22,
        "version_name": "3.6.1",
        "tag": "v3.6.1",
        "commit": "9d0f11603a1fd3ba4f74009cc1d9a639cfe13a5a",
        "recipe": {
          "repository": "https://github.com/TheLastProject/ShareToInputStick.git",
          "tag": "v3.6.1",
          "apk_pattern": "app-release\\.apk",
          "apk_url": "https://github.com/TheLastProject/ShareToInputStick/releases/download/v3.6.1/app-release.apk",
          "build": "DEX_FILE=app/build/intermediates/dex/release/mergeDexRelease/classes.dex\nDEX_SHA1=1f5efb891ceff9afcba7b9609abcc580b30eaff3\nfor _ in {1..10}; do\n./gradlew clean assembleRelease --no-build-cache --no-configuration-cache --no-daemon\ntest -e \"$DEX_FILE\"\nif [ \"$( sha1sum \"$DEX_FILE\" | cut -d' ' -f1 )\" = \"$DEX_SHA1\" ]; then\nbreak\nfi\ndone\nmv app/build/outputs/apk/release/app-release-unsigned.apk /outputs/unsigned.apk\n",
          "build_home_dir": "/build",
          "build_repo_dir": "/build/repo",
          "build_timeout": null,
          "build_user": "build",
          "provisioning": {
            "android_home": "/opt/sdk",
            "build_tools": null,
            "cmake": null,
            "cmdline_tools": {
              "version": "12.0",
              "url": "https://dl.google.com/android/repository/commandlinetools-linux-11076708_latest.zip",
              "sha256": "2d2d50857e4eb553af5a6dc3ad507a17adf43d115264b1afc116f95c92e5e258"
            },
            "extra_packages": [],
            "image": "debian:bookworm-slim",
            "jdk": "openjdk-17-jdk-headless",
            "ndk": null,
            "platform": null,
            "platform_tools": null,
            "tools": null,
            "verify_gradle_wrapper": true,
            "windows_like": false
          }
        },
        "timestamp": 1726180707,
        "reproducible": false,
        "error": null,
        "build_log": "RUN COMMAND podman pull -- debian:bookworm-slim\nResolved \"debian\" as an alias (/etc/containers/registries.conf.d/shortnames.conf)\nTrying to pull docker.io/library/debian:bookworm-slim...\nGetting image source signatures\nCopying blob sha256:a2318d6c47ec9cac5acc500c47c79602bcf953cec711a18bc898911a0984365b\nCopying blob sha256:a2318d6c47ec9cac5acc500c47c79602bcf953cec711a18bc898911a0984365b\nCopying config sha256:96d8cccd8a539589c2fd0d5a7a4009618d9a72051cf85eb05a5aae4f6ef55044\nWriting manifest to image destination\nStoring signatures\n96d8cccd8a539589c2fd0d5a7a4009618d9a72051cf85eb05a5aae4f6ef55044\nRUN COMMAND podman run --rm --volume /tmp/tmp4ravzbwl/outputs:/outputs --volume /tmp/tmp4ravzbwl/scripts:/scripts:ro --env ANDROID_HOME=/opt/sdk --env APP_REPOSITORY=https://github.com/TheLastProject/ShareToInputStick.git --env APP_TAG=v3.6.1 --env APP_COMMIT=9d0f11603a1fd3ba4f74009cc1d9a639cfe13a5a --env BUILD_USER=build --env BUILD_HOME_DIR=/build --env BUILD_REPO_DIR=/build/repo --env PROVISIONING_BUILD_TOOLS= --env PROVISIONING_CMAKE= --env PROVISIONING_CMDLINE_TOOLS_VERSION=12.0 --env PROVISIONING_CMDLINE_TOOLS_URL=https://dl.google.com/android/repository/commandlinetools-linux-11076708_latest.zip --env PROVISIONING_CMDLINE_TOOLS_SHA256=2d2d50857e4eb553af5a6dc3ad507a17adf43d115264b1afc116f95c92e5e258 --env PROVISIONING_EXTRA_PACKAGES= --env PROVISIONING_JDK=openjdk-17-jdk-headless --env PROVISIONING_NDK= --env PROVISIONING_PLATFORM= --env PROVISIONING_PLATFORM_TOOLS= --env PROVISIONING_TOOLS= --env VERIFY_GRADLE_WRAPPER=yes --env WINDOWS_LIKE=no -- debian:bookworm-slim bash -c timeout 10m /scripts/provision-root.sh && cd /build && timeout 10m su build /scripts/provision.sh && cd /build/repo && timeout 20m su build /scripts/build.sh\n+ export DEBIAN_FRONTEND=noninteractive\n+ DEBIAN_FRONTEND=noninteractive\n+ '[' -n '' ']'\n+ '[' -n '' ']'\n+ apt-get update\nGet:1 http://deb.debian.org/debian bookworm InRelease [151 kB]\nGet:2 http://deb.debian.org/debian bookworm-updates InRelease [55.4 kB]\nGet:3 http://deb.debian.org/debian-security bookworm-security InRelease [48.0 kB]\nGet:4 http://deb.debian.org/debian bookworm/main amd64 Packages [8787 kB]\nGet:5 http://deb.debian.org/debian bookworm-updates/main amd64 Packages [2468 B]\nGet:6 http://deb.debian.org/debian-security bookworm-security/main amd64 Packages [179 kB]\nFetched 9223 kB in 1s (10.6 MB/s)\nReading package lists...\n+ apt-get upgrade -y\nReading package lists...\nBuilding dependency tree...\nReading state information...\nCalculating upgrade...\n0 upgraded, 0 newly installed, 0 to remove and 0 not upgraded.\n+ apt-get install --no-install-recommends -y git wget unzip openjdk-17-jdk-headless\nReading package lists...\nBuilding dependency tree...\nReading state information...\nThe following additional packages will be installed:\n  ca-certificates ca-certificates-java fontconfig-config fonts-dejavu-core\n  git-man java-common libasound2 libasound2-data libavahi-client3\n  libavahi-common-data libavahi-common3 libbrotli1 libcups2 libcurl3-gnutls\n  libdbus-1-3 liberror-perl libexpat1 libfontconfig1 libfreetype6\n  libgdbm-compat4 libgdbm6 libglib2.0-0 libgraphite2-3 libgssapi-krb5-2\n  libharfbuzz0b libjpeg62-turbo libk5crypto3 libkeyutils1 libkrb5-3\n  libkrb5support0 liblcms2-2 libldap-2.5-0 libnghttp2-14 libnspr4 libnss3\n  libpcsclite1 libperl5.36 libpng16-16 libpsl5 librtmp1 libsasl2-2\n  libsasl2-modules-db libsqlite3-0 libssh2-1 libssl3 openjdk-17-jre-headless\n  openssl perl perl-modules-5.36\nSuggested packages:\n  gettext-base git-daemon-run | git-daemon-sysvinit git-doc git-email git-gui\n  gitk gitweb git-cvs git-mediawiki git-svn default-jre libasound2-plugins\n  alsa-utils cups-common gdbm-l10n low-memory-monitor krb5-doc krb5-user\n  liblcms2-utils pcscd sensible-utils openjdk-17-demo openjdk-17-source\n  libnss-mdns fonts-dejavu-extra fonts-ipafont-gothic fonts-ipafont-mincho\n  fonts-wqy-microhei | fonts-wqy-zenhei fonts-indic perl-doc\n  libterm-readline-gnu-perl | libterm-readline-perl-perl make\n  libtap-harness-archive-perl zip\nRecommended packages:\n  patch less ssh-client alsa-ucm-conf alsa-topology-conf dbus libglib2.0-data\n  shared-mime-info xdg-user-dirs krb5-locales libldap-common publicsuffix\n  libsasl2-modules netbase\nThe following NEW packages will be installed:\n  ca-certificates ca-certificates-java fontconfig-config fonts-dejavu-core git\n  git-man java-common libasound2 libasound2-data libavahi-client3\n  libavahi-common-data libavahi-common3 libbrotli1 libcups2 libcurl3-gnutls\n  libdbus-1-3 liberror-perl libexpat1 libfontconfig1 libfreetype6\n  libgdbm-compat4 libgdbm6 libglib2.0-0 libgraphite2-3 libgssapi-krb5-2\n  libharfbuzz0b libjpeg62-turbo libk5crypto3 libkeyutils1 libkrb5-3\n  libkrb5support0 liblcms2-2 libldap-2.5-0 libnghttp2-14 libnspr4 libnss3\n  libpcsclite1 libperl5.36 libpng16-16 libpsl5 librtmp1 libsasl2-2\n  libsasl2-modules-db libsqlite3-0 libssh2-1 libssl3 openjdk-17-jdk-headless\n  openjdk-17-jre-headless openssl perl perl-modules-5.36 unzip wget\n0 upgraded, 53 newly installed, 0 to remove and 0 not upgraded.\nNeed to get 148 MB of archives.\nAfter this operation, 410 MB of additional disk space will be used.\nGet:1 http://deb.debian.org/debian bookworm/main amd64 perl-modules-5.36 all 5.36.0-7+deb12u1 [2815 kB]\nGet:2 http://deb.debian.org/debian bookworm/main amd64 libgdbm6 amd64 1.23-3 [72.2 kB]\nGet:3 http://deb.debian.org/debian bookworm/main amd64 libgdbm-compat4 amd64 1.23-3 [48.2 kB]\nGet:4 http://deb.debian.org/debian bookworm/main amd64 libperl5.36 amd64 5.36.0-7+deb12u1 [4218 kB]\nGet:5 http://deb.debian.org/debian bookworm/main amd64 perl amd64 5.36.0-7+deb12u1 [239 kB]\nGet:6 http://deb.debian.org/debian-security bookworm-security/main amd64 libssl3 amd64 3.0.14-1~deb12u2 [2024 kB]\nGet:7 http://deb.debian.org/debian-security bookworm-security/main amd64 openssl amd64 3.0.14-1~deb12u2 [1423 kB]\nGet:8 http://deb.debian.org/debian bookworm/main amd64 ca-certificates all 20230311 [153 kB]\nGet:9 http://deb.debian.org/debian bookworm/main amd64 libpsl5 amd64 0.21.2-1 [58.7 kB]\nGet:10 http://deb.debian.org/debian bookworm/main amd64 wget amd64 1.21.3-1+b2 [984 kB]\nGet:11 http://deb.debian.org/debian bookworm/main amd64 ca-certificates-java all 20230710~deb12u1 [11.9 kB]\nGet:12 http://deb.debian.org/debian bookworm/main amd64 fonts-dejavu-core all 2.37-6 [1068 kB]\nGet:13 http://deb.debian.org/debian bookworm/main amd64 fontconfig-config amd64 2.14.1-4 [315 kB]\nGet:14 http://deb.debian.org/debian bookworm/main amd64 libbrotli1 amd64 1.0.9-2+b6 [275 kB]\nGet:15 http://deb.debian.org/debian bookworm/main amd64 libkrb5support0 amd64 1.20.1-2+deb12u2 [32.6 kB]\nGet:16 http://deb.debian.org/debian bookworm/main amd64 libk5crypto3 amd64 1.20.1-2+deb12u2 [78.7 kB]\nGet:17 http://deb.debian.org/debian bookworm/main amd64 libkeyutils1 amd64 1.6.3-2 [8808 B]\nGet:18 http://deb.debian.org/debian bookworm/main amd64 libkrb5-3 amd64 1.20.1-2+deb12u2 [332 kB]\nGet:19 http://deb.debian.org/debian bookworm/main amd64 libgssapi-krb5-2 amd64 1.20.1-2+deb12u2 [135 kB]\nGet:20 http://deb.debian.org/debian bookworm/main amd64 libsasl2-modules-db amd64 2.1.28+dfsg-10 [20.3 kB]\nGet:21 http://deb.debian.org/debian bookworm/main amd64 libsasl2-2 amd64 2.1.28+dfsg-10 [59.7 kB]\nGet:22 http://deb.debian.org/debian bookworm/main amd64 libldap-2.5-0 amd64 2.5.13+dfsg-5 [183 kB]\nGet:23 http://deb.debian.org/debian bookworm/main amd64 libnghttp2-14 amd64 1.52.0-1+deb12u1 [72.4 kB]\nGet:24 http://deb.debian.org/debian bookworm/main amd64 librtmp1 amd64 2.4+20151223.gitfa8646d.1-2+b2 [60.8 kB]\nGet:25 http://deb.debian.org/debian bookworm/main amd64 libssh2-1 amd64 1.10.0-3+b1 [179 kB]\nGet:26 http://deb.debian.org/debian bookworm/main amd64 libcurl3-gnutls amd64 7.88.1-10+deb12u7 [385 kB]\nGet:27 http://deb.debian.org/debian bookworm/main amd64 libexpat1 amd64 2.5.0-1 [99.3 kB]\nGet:28 http://deb.debian.org/debian bookworm/main amd64 liberror-perl all 0.17029-2 [29.0 kB]\nGet:29 http://deb.debian.org/debian bookworm/main amd64 git-man all 1:2.39.2-1.1 [2049 kB]\nGet:30 http://deb.debian.org/debian bookworm/main amd64 git amd64 1:2.39.2-1.1 [7171 kB]\nGet:31 http://deb.debian.org/debian bookworm/main amd64 java-common all 0.74 [6388 B]\nGet:32 http://deb.debian.org/debian bookworm/main amd64 libasound2-data all 1.2.8-1 [20.5 kB]\nGet:33 http://deb.debian.org/debian bookworm/main amd64 libasound2 amd64 1.2.8-1+b1 [362 kB]\nGet:34 http://deb.debian.org/debian bookworm/main amd64 libavahi-common-data amd64 0.8-10 [107 kB]\nGet:35 http://deb.debian.org/debian bookworm/main amd64 libavahi-common3 amd64 0.8-10 [41.6 kB]\nGet:36 http://deb.debian.org/debian bookworm/main amd64 libdbus-1-3 amd64 1.14.10-1~deb12u1 [201 kB]\nGet:37 http://deb.debian.org/debian bookworm/main amd64 libavahi-client3 amd64 0.8-10 [45.5 kB]\nGet:38 http://deb.debian.org/debian bookworm/main amd64 libcups2 amd64 2.4.2-3+deb12u7 [245 kB]\nGet:39 http://deb.debian.org/debian bookworm/main amd64 libpng16-16 amd64 1.6.39-2 [276 kB]\nGet:40 http://deb.debian.org/debian bookworm/main amd64 libfreetype6 amd64 2.12.1+dfsg-5+deb12u3 [398 kB]\nGet:41 http://deb.debian.org/debian bookworm/main amd64 libfontconfig1 amd64 2.14.1-4 [386 kB]\nGet:42 http://deb.debian.org/debian bookworm/main amd64 libglib2.0-0 amd64 2.74.6-2+deb12u3 [1400 kB]\nGet:43 http://deb.debian.org/debian bookworm/main amd64 libgraphite2-3 amd64 1.3.14-1 [81.2 kB]\nGet:44 http://deb.debian.org/debian bookworm/main amd64 libharfbuzz0b amd64 6.0.0+dfsg-3 [1945 kB]\nGet:45 http://deb.debian.org/debian bookworm/main amd64 libjpeg62-turbo amd64 1:2.1.5-2 [166 kB]\nGet:46 http://deb.debian.org/debian bookworm/main amd64 liblcms2-2 amd64 2.14-2 [154 kB]\nGet:47 http://deb.debian.org/debian bookworm/main amd64 libnspr4 amd64 2:4.35-1 [113 kB]\nGet:48 http://deb.debian.org/debian bookworm/main amd64 libsqlite3-0 amd64 3.40.1-2 [837 kB]\nGet:49 http://deb.debian.org/debian bookworm/main amd64 libnss3 amd64 2:3.87.1-1 [1331 kB]\nGet:50 http://deb.debian.org/debian bookworm/main amd64 libpcsclite1 amd64 1.9.9-2 [49.7 kB]\nGet:51 http://deb.debian.org/debian bookworm/main amd64 openjdk-17-jre-headless amd64 17.0.12+7-2~deb12u1 [43.7 MB]\nGet:52 http://deb.debian.org/debian bookworm/main amd64 openjdk-17-jdk-headless amd64 17.0.12+7-2~deb12u1 [71.4 MB]\nGet:53 http://deb.debian.org/debian bookworm/main amd64 unzip amd64 6.0-28 [166 kB]\ndebconf: delaying package configuration, since apt-utils is not installed\nFetched 148 MB in 1s (239 MB/s)\nSelecting previously unselected package perl-modules-5.36.\r\n(Reading database ... \r(Reading database ... 5%\r(Reading database ... 10%\r(Reading database ... 15%\r(Reading database ... 20%\r(Reading database ... 25%\r(Reading database ... 30%\r(Reading database ... 35%\r(Reading database ... 40%\r(Reading database ... 45%\r(Reading database ... 50%\r(Reading database ... 55%\r(Reading database ... 60%\r(Reading database ... 65%\r(Reading database ... 70%\r(Reading database ... 75%\r(Reading database ... 80%\r(Reading database ... 85%\r(Reading database ... 90%\r(Reading database ... 95%\r(Reading database ... 100%\r(Reading database ... 6089 files and directories currently installed.)\r\nPreparing to unpack .../00-perl-modules-5.36_5.36.0-7+deb12u1_all.deb ...\r\nUnpacking perl-modules-5.36 (5.36.0-7+deb12u1) ...\r\nSelecting previously unselected package libgdbm6:amd64.\r\nPreparing to unpack .../01-libgdbm6_1.23-3_amd64.deb ...\r\nUnpacking libgdbm6:amd64 (1.23-3) ...\r\nSelecting previously unselected package libgdbm-compat4:amd64.\r\nPreparing to unpack .../02-libgdbm-compat4_1.23-3_amd64.deb ...\r\nUnpacking libgdbm-compat4:amd64 (1.23-3) ...\r\nSelecting previously unselected package libperl5.36:amd64.\r\nPreparing to unpack .../03-libperl5.36_5.36.0-7+deb12u1_amd64.deb ...\r\nUnpacking libperl5.36:amd64 (5.36.0-7+deb12u1) ...\r\nSelecting previously unselected package perl.\r\nPreparing to unpack .../04-perl_5.36.0-7+deb12u1_amd64.deb ...\r\nUnpacking perl (5.36.0-7+deb12u1) ...\r\nSelecting previously unselected package libssl3:amd64.\r\nPreparing to unpack .../05-libssl3_3.0.14-1~deb12u2_amd64.deb ...\r\nUnpacking libssl3:amd64 (3.0.14-1~deb12u2) ...\r\nSelecting previously unselected package openssl.\r\nPreparing to unpack .../06-openssl_3.0.14-1~deb12u2_amd64.deb ...\r\nUnpacking openssl (3.0.14-1~deb12u2) ...\r\nSelecting previously unselected package ca-certificates.\r\nPreparing to unpack .../07-ca-certificates_20230311_all.deb ...\r\nUnpacking ca-certificates (20230311) ...\r\nSelecting previously unselected package libpsl5:amd64.\r\nPreparing to unpack .../08-libpsl5_0.21.2-1_amd64.deb ...\r\nUnpacking libpsl5:amd64 (0.21.2-1) ...\r\nSelecting previously unselected package wget.\r\nPreparing to unpack .../09-wget_1.21.3-1+b2_amd64.deb ...\r\nUnpacking wget (1.21.3-1+b2) ...\r\nSelecting previously unselected package ca-certificates-java.\r\nPreparing to unpack .../10-ca-certificates-java_20230710~deb12u1_all.deb ...\r\nUnpacking ca-certificates-java (20230710~deb12u1) ...\r\nSelecting previously unselected package fonts-dejavu-core.\r\nPreparing to unpack .../11-fonts-dejavu-core_2.37-6_all.deb ...\r\nUnpacking fonts-dejavu-core (2.37-6) ...\r\nSelecting previously unselected package fontconfig-config.\r\nPreparing to unpack .../12-fontconfig-config_2.14.1-4_amd64.deb ...\r\nUnpacking fontconfig-config (2.14.1-4) ...\r\nSelecting previously unselected package libbrotli1:amd64.\r\nPreparing to unpack .../13-libbrotli1_1.0.9-2+b6_amd64.deb ...\r\nUnpacking libbrotli1:amd64 (1.0.9-2+b6) ...\r\nSelecting previously unselected package libkrb5support0:amd64.\r\nPreparing to unpack .../14-libkrb5support0_1.20.1-2+deb12u2_amd64.deb ...\r\nUnpacking libkrb5support0:amd64 (1.20.1-2+deb12u2) ...\r\nSelecting previously unselected package libk5crypto3:amd64.\r\nPreparing to unpack .../15-libk5crypto3_1.20.1-2+deb12u2_amd64.deb ...\r\nUnpacking libk5crypto3:amd64 (1.20.1-2+deb12u2) ...\r\nSelecting previously unselected package libkeyutils1:amd64.\r\nPreparing to unpack .../16-libkeyutils1_1.6.3-2_amd64.deb ...\r\nUnpacking libkeyutils1:amd64 (1.6.3-2) ...\r\nSelecting previously unselected package libkrb5-3:amd64.\r\nPreparing to unpack .../17-libkrb5-3_1.20.1-2+deb12u2_amd64.deb ...\r\nUnpacking libkrb5-3:amd64 (1.20.1-2+deb12u2) ...\r\nSelecting previously unselected package libgssapi-krb5-2:amd64.\r\nPreparing to unpack .../18-libgssapi-krb5-2_1.20.1-2+deb12u2_amd64.deb ...\r\nUnpacking libgssapi-krb5-2:amd64 (1.20.1-2+deb12u2) ...\r\nSelecting previously unselected package libsasl2-modules-db:amd64.\r\nPreparing to unpack .../19-libsasl2-modules-db_2.1.28+dfsg-10_amd64.deb ...\r\nUnpacking libsasl2-modules-db:amd64 (2.1.28+dfsg-10) ...\r\nSelecting previously unselected package libsasl2-2:amd64.\r\nPreparing to unpack .../20-libsasl2-2_2.1.28+dfsg-10_amd64.deb ...\r\nUnpacking libsasl2-2:amd64 (2.1.28+dfsg-10) ...\r\nSelecting previously unselected package libldap-2.5-0:amd64.\r\nPreparing to unpack .../21-libldap-2.5-0_2.5.13+dfsg-5_amd64.deb ...\r\nUnpacking libldap-2.5-0:amd64 (2.5.13+dfsg-5) ...\r\nSelecting previously unselected package libnghttp2-14:amd64.\r\nPreparing to unpack .../22-libnghttp2-14_1.52.0-1+deb12u1_amd64.deb ...\r\nUnpacking libnghttp2-14:amd64 (1.52.0-1+deb12u1) ...\r\nSelecting previously unselected package librtmp1:amd64.\r\nPreparing to unpack .../23-librtmp1_2.4+20151223.gitfa8646d.1-2+b2_amd64.deb ...\r\nUnpacking librtmp1:amd64 (2.4+20151223.gitfa8646d.1-2+b2) ...\r\nSelecting previously unselected package libssh2-1:amd64.\r\nPreparing to unpack .../24-libssh2-1_1.10.0-3+b1_amd64.deb ...\r\nUnpacking libssh2-1:amd64 (1.10.0-3+b1) ...\r\nSelecting previously unselected package libcurl3-gnutls:amd64.\r\nPreparing to unpack .../25-libcurl3-gnutls_7.88.1-10+deb12u7_amd64.deb ...\r\nUnpacking libcurl3-gnutls:amd64 (7.88.1-10+deb12u7) ...\r\nSelecting previously unselected package libexpat1:amd64.\r\nPreparing to unpack .../26-libexpat1_2.5.0-1_amd64.deb ...\r\nUnpacking libexpat1:amd64 (2.5.0-1) ...\r\nSelecting previously unselected package liberror-perl.\r\nPreparing to unpack .../27-liberror-perl_0.17029-2_all.deb ...\r\nUnpacking liberror-perl (0.17029-2) ...\r\nSelecting previously unselected package git-man.\r\nPreparing to unpack .../28-git-man_1%3a2.39.2-1.1_all.deb ...\r\nUnpacking git-man (1:2.39.2-1.1) ...\r\nSelecting previously unselected package git.\r\nPreparing to unpack .../29-git_1%3a2.39.2-1.1_amd64.deb ...\r\nUnpacking git (1:2.39.2-1.1) ...\r\nSelecting previously unselected package java-common.\r\nPreparing to unpack .../30-java-common_0.74_all.deb ...\r\nUnpacking java-common (0.74) ...\r\nSelecting previously unselected package libasound2-data.\r\nPreparing to unpack .../31-libasound2-data_1.2.8-1_all.deb ...\r\nUnpacking libasound2-data (1.2.8-1) ...\r\nSelecting previously unselected package libasound2:amd64.\r\nPreparing to unpack .../32-libasound2_1.2.8-1+b1_amd64.deb ...\r\nUnpacking libasound2:amd64 (1.2.8-1+b1) ...\r\nSelecting previously unselected package libavahi-common-data:amd64.\r\nPreparing to unpack .../33-libavahi-common-data_0.8-10_amd64.deb ...\r\nUnpacking libavahi-common-data:amd64 (0.8-10) ...\r\nSelecting previously unselected package libavahi-common3:amd64.\r\nPreparing to unpack .../34-libavahi-common3_0.8-10_amd64.deb ...\r\nUnpacking libavahi-common3:amd64 (0.8-10) ...\r\nSelecting previously unselected package libdbus-1-3:amd64.\r\nPreparing to unpack .../35-libdbus-1-3_1.14.10-1~deb12u1_amd64.deb ...\r\nUnpacking libdbus-1-3:amd64 (1.14.10-1~deb12u1) ...\r\nSelecting previously unselected package libavahi-client3:amd64.\r\nPreparing to unpack .../36-libavahi-client3_0.8-10_amd64.deb ...\r\nUnpacking libavahi-client3:amd64 (0.8-10) ...\r\nSelecting previously unselected package libcups2:amd64.\r\nPreparing to unpack .../37-libcups2_2.4.2-3+deb12u7_amd64.deb ...\r\nUnpacking libcups2:amd64 (2.4.2-3+deb12u7) ...\r\nSelecting previously unselected package libpng16-16:amd64.\r\nPreparing to unpack .../38-libpng16-16_1.6.39-2_amd64.deb ...\r\nUnpacking libpng16-16:amd64 (1.6.39-2) ...\r\nSelecting previously unselected package libfreetype6:amd64.\r\nPreparing to unpack .../39-libfreetype6_2.12.1+dfsg-5+deb12u3_amd64.deb ...\r\nUnpacking libfreetype6:amd64 (2.12.1+dfsg-5+deb12u3) ...\r\nSelecting previously unselected package libfontconfig1:amd64.\r\nPreparing to unpack .../40-libfontconfig1_2.14.1-4_amd64.deb ...\r\nUnpacking libfontconfig1:amd64 (2.14.1-4) ...\r\nSelecting previously unselected package libglib2.0-0:amd64.\r\nPreparing to unpack .../41-libglib2.0-0_2.74.6-2+deb12u3_amd64.deb ...\r\nUnpacking libglib2.0-0:amd64 (2.74.6-2+deb12u3) ...\r\nSelecting previously unselected package libgraphite2-3:amd64.\r\nPreparing to unpack .../42-libgraphite2-3_1.3.14-1_amd64.deb ...\r\nUnpacking libgraphite2-3:amd64 (1.3.14-1) ...\r\nSelecting previously unselected package libharfbuzz0b:amd64.\r\nPreparing to unpack .../43-libharfbuzz0b_6.0.0+dfsg-3_amd64.deb ...\r\nUnpacking libharfbuzz0b:amd64 (6.0.0+dfsg-3) ...\r\nSelecting previously unselected package libjpeg62-turbo:amd64.\r\nPreparing to unpack .../44-libjpeg62-turbo_1%3a2.1.5-2_amd64.deb ...\r\nUnpacking libjpeg62-turbo:amd64 (1:2.1.5-2) ...\r\nSelecting previously unselected package liblcms2-2:amd64.\r\nPreparing to unpack .../45-liblcms2-2_2.14-2_amd64.deb ...\r\nUnpacking liblcms2-2:amd64 (2.14-2) ...\r\nSelecting previously unselected package libnspr4:amd64.\r\nPreparing to unpack .../46-libnspr4_2%3a4.35-1_amd64.deb ...\r\nUnpacking libnspr4:amd64 (2:4.35-1) ...\r\nSelecting previously unselected package libsqlite3-0:amd64.\r\nPreparing to unpack .../47-libsqlite3-0_3.40.1-2_amd64.deb ...\r\nUnpacking libsqlite3-0:amd64 (3.40.1-2) ...\r\nSelecting previously unselected package libnss3:amd64.\r\nPreparing to unpack .../48-libnss3_2%3a3.87.1-1_amd64.deb ...\r\nUnpacking libnss3:amd64 (2:3.87.1-1) ...\r\nSelecting previously unselected package libpcsclite1:amd64.\r\nPreparing to unpack .../49-libpcsclite1_1.9.9-2_amd64.deb ...\r\nUnpacking libpcsclite1:amd64 (1.9.9-2) ...\r\nSelecting previously unselected package openjdk-17-jre-headless:amd64.\r\nPreparing to unpack .../50-openjdk-17-jre-headless_17.0.12+7-2~deb12u1_amd64.deb ...\r\nUnpacking openjdk-17-jre-headless:amd64 (17.0.12+7-2~deb12u1) ...\r\nSelecting previously unselected package openjdk-17-jdk-headless:amd64.\r\nPreparing to unpack .../51-openjdk-17-jdk-headless_17.0.12+7-2~deb12u1_amd64.deb ...\r\nUnpacking openjdk-17-jdk-headless:amd64 (17.0.12+7-2~deb12u1) ...\r\nSelecting previously unselected package unzip.\r\nPreparing to unpack .../52-unzip_6.0-28_amd64.deb ...\r\nUnpacking unzip (6.0-28) ...\r\nSetting up libexpat1:amd64 (2.5.0-1) ...\r\nSetting up libgraphite2-3:amd64 (1.3.14-1) ...\r\nSetting up liblcms2-2:amd64 (2.14-2) ...\r\nSetting up libkeyutils1:amd64 (1.6.3-2) ...\r\nSetting up libpsl5:amd64 (0.21.2-1) ...\r\nSetting up wget (1.21.3-1+b2) ...\r\nSetting up java-common (0.74) ...\r\nSetting up libglib2.0-0:amd64 (2.74.6-2+deb12u3) ...\r\nNo schema files found: doing nothing.\r\nSetting up unzip (6.0-28) ...\r\nSetting up libbrotli1:amd64 (1.0.9-2+b6) ...\r\nSetting up libsqlite3-0:amd64 (3.40.1-2) ...\r\nSetting up libssl3:amd64 (3.0.14-1~deb12u2) ...\r\nSetting up libnghttp2-14:amd64 (1.52.0-1+deb12u1) ...\r\nSetting up libkrb5support0:amd64 (1.20.1-2+deb12u2) ...\r\nSetting up libsasl2-modules-db:amd64 (2.1.28+dfsg-10) ...\r\nSetting up libasound2-data (1.2.8-1) ...\r\nSetting up perl-modules-5.36 (5.36.0-7+deb12u1) ...\r\nSetting up libjpeg62-turbo:amd64 (1:2.1.5-2) ...\r\nSetting up libnspr4:amd64 (2:4.35-1) ...\r\nSetting up librtmp1:amd64 (2.4+20151223.gitfa8646d.1-2+b2) ...\r\nSetting up libavahi-common-data:amd64 (0.8-10) ...\r\nSetting up libdbus-1-3:amd64 (1.14.10-1~deb12u1) ...\r\nSetting up libpng16-16:amd64 (1.6.39-2) ...\r\nSetting up fonts-dejavu-core (2.37-6) ...\r\nSetting up libpcsclite1:amd64 (1.9.9-2) ...\r\nSetting up libk5crypto3:amd64 (1.20.1-2+deb12u2) ...\r\nSetting up libsasl2-2:amd64 (2.1.28+dfsg-10) ...\r\nSetting up libasound2:amd64 (1.2.8-1+b1) ...\r\nSetting up git-man (1:2.39.2-1.1) ...\r\nSetting up libssh2-1:amd64 (1.10.0-3+b1) ...\r\nSetting up libkrb5-3:amd64 (1.20.1-2+deb12u2) ...\r\nSetting up openssl (3.0.14-1~deb12u2) ...\r\nSetting up libgdbm6:amd64 (1.23-3) ...\r\nSetting up fontconfig-config (2.14.1-4) ...\r\nSetting up libavahi-common3:amd64 (0.8-10) ...\r\nSetting up libnss3:amd64 (2:3.87.1-1) ...\r\nSetting up libldap-2.5-0:amd64 (2.5.13+dfsg-5) ...\r\nSetting up ca-certificates (20230311) ...\r\nUpdating certificates in /etc/ssl/certs...\r\n140 added, 0 removed; done.\r\nSetting up libfreetype6:amd64 (2.12.1+dfsg-5+deb12u3) ...\r\nSetting up libgssapi-krb5-2:amd64 (1.20.1-2+deb12u2) ...\r\nSetting up libgdbm-compat4:amd64 (1.23-3) ...\r\nSetting up libharfbuzz0b:amd64 (6.0.0+dfsg-3) ...\r\nSetting up libfontconfig1:amd64 (2.14.1-4) ...\r\nSetting up ca-certificates-java (20230710~deb12u1) ...\r\nNo JRE found. Skipping Java certificates setup.\r\nSetting up libavahi-client3:amd64 (0.8-10) ...\r\nSetting up libperl5.36:amd64 (5.36.0-7+deb12u1) ...\r\nSetting up libcurl3-gnutls:amd64 (7.88.1-10+deb12u7) ...\r\nSetting up perl (5.36.0-7+deb12u1) ...\r\nSetting up libcups2:amd64 (2.4.2-3+deb12u7) ...\r\nSetting up liberror-perl (0.17029-2) ...\r\nSetting up git (1:2.39.2-1.1) ...\r\nSetting up openjdk-17-jre-headless:amd64 (17.0.12+7-2~deb12u1) ...\r\nupdate-alternatives: using /usr/lib/jvm/java-17-openjdk-amd64/bin/java to provide /usr/bin/java (java) in auto mode\r\nupdate-alternatives: using /usr/lib/jvm/java-17-openjdk-amd64/bin/jpackage to provide /usr/bin/jpackage (jpackage) in auto mode\r\nupdate-alternatives: using /usr/lib/jvm/java-17-openjdk-amd64/bin/keytool to provide /usr/bin/keytool (keytool) in auto mode\r\nupdate-alternatives: using /usr/lib/jvm/java-17-openjdk-amd64/bin/rmiregistry to provide /usr/bin/rmiregistry (rmiregistry) in auto mode\r\nupdate-alternatives: using /usr/lib/jvm/java-17-openjdk-amd64/lib/jexec to provide /usr/bin/jexec (jexec) in auto mode\r\nProcessing triggers for libc-bin (2.36-9+deb12u8) ...\r\nProcessing triggers for ca-certificates-java (20230710~deb12u1) ...\r\nAdding debian:ACCVRAIZ1.pem\r\nAdding debian:AC_RAIZ_FNMT-RCM.pem\r\nAdding debian:AC_RAIZ_FNMT-RCM_SERVIDORES_SEGUROS.pem\r\nAdding debian:ANF_Secure_Server_Root_CA.pem\r\nAdding debian:Actalis_Authentication_Root_CA.pem\r\nAdding debian:AffirmTrust_Commercial.pem\r\nAdding debian:AffirmTrust_Networking.pem\r\nAdding debian:AffirmTrust_Premium.pem\r\nAdding debian:AffirmTrust_Premium_ECC.pem\r\nAdding debian:Amazon_Root_CA_1.pem\r\nAdding debian:Amazon_Root_CA_2.pem\r\nAdding debian:Amazon_Root_CA_3.pem\r\nAdding debian:Amazon_Root_CA_4.pem\r\nAdding debian:Atos_TrustedRoot_2011.pem\r\nAdding debian:Autoridad_de_Certificacion_Firmaprofesional_CIF_A62634068.pem\r\nAdding debian:Autoridad_de_Certificacion_Firmaprofesional_CIF_A62634068_2.pem\r\nAdding debian:Baltimore_CyberTrust_Root.pem\r\nAdding debian:Buypass_Class_2_Root_CA.pem\r\nAdding debian:Buypass_Class_3_Root_CA.pem\r\nAdding debian:CA_Disig_Root_R2.pem\r\nAdding debian:CFCA_EV_ROOT.pem\r\nAdding debian:COMODO_Certification_Authority.pem\r\nAdding debian:COMODO_ECC_Certification_Authority.pem\r\nAdding debian:COMODO_RSA_Certification_Authority.pem\r\nAdding debian:Certainly_Root_E1.pem\r\nAdding debian:Certainly_Root_R1.pem\r\nAdding debian:Certigna.pem\r\nAdding debian:Certigna_Root_CA.pem\r\nAdding debian:Certum_EC-384_CA.pem\r\nAdding debian:Certum_Trusted_Network_CA.pem\r\nAdding debian:Certum_Trusted_Network_CA_2.pem\r\nAdding debian:Certum_Trusted_Root_CA.pem\r\nAdding debian:Comodo_AAA_Services_root.pem\r\nAdding debian:D-TRUST_BR_Root_CA_1_2020.pem\r\nAdding debian:D-TRUST_EV_Root_CA_1_2020.pem\r\nAdding debian:D-TRUST_Root_Class_3_CA_2_2009.pem\r\nAdding debian:D-TRUST_Root_Class_3_CA_2_EV_2009.pem\r\nAdding debian:DigiCert_Assured_ID_Root_CA.pem\r\nAdding debian:DigiCert_Assured_ID_Root_G2.pem\r\nAdding debian:DigiCert_Assured_ID_Root_G3.pem\r\nAdding debian:DigiCert_Global_Root_CA.pem\r\nAdding debian:DigiCert_Global_Root_G2.pem\r\nAdding debian:DigiCert_Global_Root_G3.pem\r\nAdding debian:DigiCert_High_Assurance_EV_Root_CA.pem\r\nAdding debian:DigiCert_TLS_ECC_P384_Root_G5.pem\r\nAdding debian:DigiCert_TLS_RSA4096_Root_G5.pem\r\nAdding debian:DigiCert_Trusted_Root_G4.pem\r\nAdding debian:E-Tugra_Certification_Authority.pem\r\nAdding debian:E-Tugra_Global_Root_CA_ECC_v3.pem\r\nAdding debian:E-Tugra_Global_Root_CA_RSA_v3.pem\r\nAdding debian:Entrust.net_Premium_2048_Secure_Server_CA.pem\r\nAdding debian:Entrust_Root_Certification_Authority.pem\r\nAdding debian:Entrust_Root_Certification_Authority_-_EC1.pem\r\nAdding debian:Entrust_Root_Certification_Authority_-_G2.pem\r\nAdding debian:Entrust_Root_Certification_Authority_-_G4.pem\r\nAdding debian:GDCA_TrustAUTH_R5_ROOT.pem\r\nAdding debian:GLOBALTRUST_2020.pem\r\nAdding debian:GTS_Root_R1.pem\r\nAdding debian:GTS_Root_R2.pem\r\nAdding debian:GTS_Root_R3.pem\r\nAdding debian:GTS_Root_R4.pem\r\nAdding debian:GlobalSign_ECC_Root_CA_-_R4.pem\r\nAdding debian:GlobalSign_ECC_Root_CA_-_R5.pem\r\nAdding debian:GlobalSign_Root_CA.pem\r\nAdding debian:GlobalSign_Root_CA_-_R3.pem\r\nAdding debian:GlobalSign_Root_CA_-_R6.pem\r\nAdding debian:GlobalSign_Root_E46.pem\r\nAdding debian:GlobalSign_Root_R46.pem\r\nAdding debian:Go_Daddy_Class_2_CA.pem\r\nAdding debian:Go_Daddy_Root_Certificate_Authority_-_G2.pem\r\nAdding debian:HARICA_TLS_ECC_Root_CA_2021.pem\r\nAdding debian:HARICA_TLS_RSA_Root_CA_2021.pem\r\nAdding debian:Hellenic_Academic_and_Research_Institutions_ECC_RootCA_2015.pem\r\nAdding debian:Hellenic_Academic_and_Research_Institutions_RootCA_2015.pem\r\nAdding debian:HiPKI_Root_CA_-_G1.pem\r\nAdding debian:Hongkong_Post_Root_CA_1.pem\r\nAdding debian:Hongkong_Post_Root_CA_3.pem\r\nAdding debian:ISRG_Root_X1.pem\r\nAdding debian:ISRG_Root_X2.pem\r\nAdding debian:IdenTrust_Commercial_Root_CA_1.pem\r\nAdding debian:IdenTrust_Public_Sector_Root_CA_1.pem\r\nAdding debian:Izenpe.com.pem\r\nAdding debian:Microsec_e-Szigno_Root_CA_2009.pem\r\nAdding debian:Microsoft_ECC_Root_Certificate_Authority_2017.pem\r\nAdding debian:Microsoft_RSA_Root_Certificate_Authority_2017.pem\r\nAdding debian:NAVER_Global_Root_Certification_Authority.pem\r\nAdding debian:NetLock_Arany_=Class_Gold=_F\u0151tan\u00fas\u00edtv\u00e1ny.pem\r\nAdding debian:OISTE_WISeKey_Global_Root_GB_CA.pem\r\nAdding debian:OISTE_WISeKey_Global_Root_GC_CA.pem\r\nAdding debian:QuoVadis_Root_CA_1_G3.pem\r\nAdding debian:QuoVadis_Root_CA_2.pem\r\nAdding debian:QuoVadis_Root_CA_2_G3.pem\r\nAdding debian:QuoVadis_Root_CA_3.pem\r\nAdding debian:QuoVadis_Root_CA_3_G3.pem\r\nAdding debian:SSL.com_EV_Root_Certification_Authority_ECC.pem\r\nAdding debian:SSL.com_EV_Root_Certification_Authority_RSA_R2.pem\r\nAdding debian:SSL.com_Root_Certification_Authority_ECC.pem\r\nAdding debian:SSL.com_Root_Certification_Authority_RSA.pem\r\nAdding debian:SZAFIR_ROOT_CA2.pem\r\nAdding debian:SecureSign_RootCA11.pem\r\nAdding debian:SecureTrust_CA.pem\r\nAdding debian:Secure_Global_CA.pem\r\nAdding debian:Security_Communication_ECC_RootCA1.pem\r\nAdding debian:Security_Communication_RootCA2.pem\r\nAdding debian:Security_Communication_RootCA3.pem\r\nAdding debian:Security_Communication_Root_CA.pem\r\nAdding debian:Starfield_Class_2_CA.pem\r\nAdding debian:Starfield_Root_Certificate_Authority_-_G2.pem\r\nAdding debian:Starfield_Services_Root_Certificate_Authority_-_G2.pem\r\nAdding debian:SwissSign_Gold_CA_-_G2.pem\r\nAdding debian:SwissSign_Silver_CA_-_G2.pem\r\nAdding debian:T-TeleSec_GlobalRoot_Class_2.pem\r\nAdding debian:T-TeleSec_GlobalRoot_Class_3.pem\r\nAdding debian:TUBITAK_Kamu_SM_SSL_Kok_Sertifikasi_-_Surum_1.pem\r\nAdding debian:TWCA_Global_Root_CA.pem\r\nAdding debian:TWCA_Root_Certification_Authority.pem\r\nAdding debian:TeliaSonera_Root_CA_v1.pem\r\nAdding debian:Telia_Root_CA_v2.pem\r\nAdding debian:TrustCor_ECA-1.pem\r\nAdding debian:TrustCor_RootCert_CA-1.pem\r\nAdding debian:TrustCor_RootCert_CA-2.pem\r\nAdding debian:Trustwave_Global_Certification_Authority.pem\r\nAdding debian:Trustwave_Global_ECC_P256_Certification_Authority.pem\r\nAdding debian:Trustwave_Global_ECC_P384_Certification_Authority.pem\r\nAdding debian:TunTrust_Root_CA.pem\r\nAdding debian:UCA_Extended_Validation_Root.pem\r\nAdding debian:UCA_Global_G2_Root.pem\r\nAdding debian:USERTrust_ECC_Certification_Authority.pem\r\nAdding debian:USERTrust_RSA_Certification_Authority.pem\r\nAdding debian:XRamp_Global_CA_Root.pem\r\nAdding debian:certSIGN_ROOT_CA.pem\r\nAdding debian:certSIGN_Root_CA_G2.pem\r\nAdding debian:e-Szigno_Root_CA_2017.pem\r\nAdding debian:ePKI_Root_Certification_Authority.pem\r\nAdding debian:emSign_ECC_Root_CA_-_C3.pem\r\nAdding debian:emSign_ECC_Root_CA_-_G3.pem\r\nAdding debian:emSign_Root_CA_-_C1.pem\r\nAdding debian:emSign_Root_CA_-_G1.pem\r\nAdding debian:vTrus_ECC_Root_CA.pem\r\nAdding debian:vTrus_Root_CA.pem\r\ndone.\r\nSetting up openjdk-17-jdk-headless:amd64 (17.0.12+7-2~deb12u1) ...\r\nupdate-alternatives: using /usr/lib/jvm/java-17-openjdk-amd64/bin/jar to provide /usr/bin/jar (jar) in auto mode\r\nupdate-alternatives: using /usr/lib/jvm/java-17-openjdk-amd64/bin/jarsigner to provide /usr/bin/jarsigner (jarsigner) in auto mode\r\nupdate-alternatives: using /usr/lib/jvm/java-17-openjdk-amd64/bin/javac to provide /usr/bin/javac (javac) in auto mode\r\nupdate-alternatives: using /usr/lib/jvm/java-17-openjdk-amd64/bin/javadoc to provide /usr/bin/javadoc (javadoc) in auto mode\r\nupdate-alternatives: using /usr/lib/jvm/java-17-openjdk-amd64/bin/javap to provide /usr/bin/javap (javap) in auto mode\r\nupdate-alternatives: using /usr/lib/jvm/java-17-openjdk-amd64/bin/jcmd to provide /usr/bin/jcmd (jcmd) in auto mode\r\nupdate-alternatives: using /usr/lib/jvm/java-17-openjdk-amd64/bin/jdb to provide /usr/bin/jdb (jdb) in auto mode\r\nupdate-alternatives: using /usr/lib/jvm/java-17-openjdk-amd64/bin/jdeprscan to provide /usr/bin/jdeprscan (jdeprscan) in auto mode\r\nupdate-alternatives: using /usr/lib/jvm/java-17-openjdk-amd64/bin/jdeps to provide /usr/bin/jdeps (jdeps) in auto mode\r\nupdate-alternatives: using /usr/lib/jvm/java-17-openjdk-amd64/bin/jfr to provide /usr/bin/jfr (jfr) in auto mode\r\nupdate-alternatives: using /usr/lib/jvm/java-17-openjdk-amd64/bin/jimage to provide /usr/bin/jimage (jimage) in auto mode\r\nupdate-alternatives: using /usr/lib/jvm/java-17-openjdk-amd64/bin/jinfo to provide /usr/bin/jinfo (jinfo) in auto mode\r\nupdate-alternatives: using /usr/lib/jvm/java-17-openjdk-amd64/bin/jlink to provide /usr/bin/jlink (jlink) in auto mode\r\nupdate-alternatives: using /usr/lib/jvm/java-17-openjdk-amd64/bin/jmap to provide /usr/bin/jmap (jmap) in auto mode\r\nupdate-alternatives: using /usr/lib/jvm/java-17-openjdk-amd64/bin/jmod to provide /usr/bin/jmod (jmod) in auto mode\r\nupdate-alternatives: using /usr/lib/jvm/java-17-openjdk-amd64/bin/jps to provide /usr/bin/jps (jps) in auto mode\r\nupdate-alternatives: using /usr/lib/jvm/java-17-openjdk-amd64/bin/jrunscript to provide /usr/bin/jrunscript (jrunscript) in auto mode\r\nupdate-alternatives: using /usr/lib/jvm/java-17-openjdk-amd64/bin/jshell to provide /usr/bin/jshell (jshell) in auto mode\r\nupdate-alternatives: using /usr/lib/jvm/java-17-openjdk-amd64/bin/jstack to provide /usr/bin/jstack (jstack) in auto mode\r\nupdate-alternatives: using /usr/lib/jvm/java-17-openjdk-amd64/bin/jstat to provide /usr/bin/jstat (jstat) in auto mode\r\nupdate-alternatives: using /usr/lib/jvm/java-17-openjdk-amd64/bin/jstatd to provide /usr/bin/jstatd (jstatd) in auto mode\r\nupdate-alternatives: using /usr/lib/jvm/java-17-openjdk-amd64/bin/serialver to provide /usr/bin/serialver (serialver) in auto mode\r\nupdate-alternatives: using /usr/lib/jvm/java-17-openjdk-amd64/bin/jhsdb to provide /usr/bin/jhsdb (jhsdb) in auto mode\r\nProcessing triggers for ca-certificates (20230311) ...\r\nUpdating certificates in /etc/ssl/certs...\r\n0 added, 0 removed; done.\r\nRunning hooks in /etc/ca-certificates/update.d...\r\ndone.\r\nProcessing triggers for ca-certificates-java (20230710~deb12u1) ...\r\ndone.\r\n+ '[' -n '' ']'\n+ update-alternatives --auto java\n+ adduser --help\n+ grep -q -- --gecos\n+ adduser --disabled-password --comment '' build --home /build\nAdding user `build' ...\nAdding new group `build' (1000) ...\nAdding new user `build' (1000) with group `build (1000)' ...\nCreating home directory `/build' ...\nCopying files from `/etc/skel' ...\nAdding new user `build' to supplemental / extra groups `users' ...\nAdding user `build' to group `users' ...\n+ mkdir -p /opt /opt/sdk\n+ chown build:build /opt /opt/sdk\n+ mkdir -p /opt/sdk/cmdline-tools\n+ wget -q -O /tmp/tools.zip -- https://dl.google.com/android/repository/commandlinetools-linux-11076708_latest.zip\n+ sha256sum -c\n/tmp/tools.zip: OK\n+ unzip -q -d /opt/sdk/cmdline-tools /tmp/tools.zip\n+ mv /opt/sdk/cmdline-tools/cmdline-tools /opt/sdk/cmdline-tools/12.0\n+ rm /tmp/tools.zip\n+ export PATH=/usr/local/sbin:/usr/local/bin:/usr/sbin:/usr/bin:/sbin:/bin:/opt/sdk/cmdline-tools/12.0/bin\n+ PATH=/usr/local/sbin:/usr/local/bin:/usr/sbin:/usr/bin:/sbin:/bin:/opt/sdk/cmdline-tools/12.0/bin\n+ yes\n+ sdkmanager --sdk_root=/opt/sdk --licenses\n+ true\n+ '[' -n '' ']'\n+ '[' -n '' ']'\n+ '[' -n '' ']'\n+ '[' -n '' ']'\n+ '[' -n '' ']'\n+ '[' -n '' ']'\n+ '[' no = yes ']'\n+ clone_opts=()\n+ '[' v3.6.1 '!=' :commit: ']'\n+ clone_opts+=(-b \"${APP_TAG}\")\n+ retry 5 git clone -b v3.6.1 -- https://github.com/TheLastProject/ShareToInputStick.git /build/repo\n+ local i n=5\n+ shift\n+ (( i = 1 ))\n+ (( i <= n ))\n+ git clone -b v3.6.1 -- https://github.com/TheLastProject/ShareToInputStick.git /build/repo\nCloning into '/build/repo'...\nNote: switching to '9d0f11603a1fd3ba4f74009cc1d9a639cfe13a5a'.\n\nYou are in 'detached HEAD' state. You can look around, make experimental\nchanges and commit them, and you can discard any commits you make in this\nstate without impacting any branches by switching back to a branch.\n\nIf you want to create a new branch to retain commits you create, you may\ndo so (now or later) by using -c with the switch command. Example:\n\n  git switch -c <new-branch-name>\n\nOr undo this operation with:\n\n  git switch -\n\nTurn off this advice by setting config variable advice.detachedHead to false\n\n+ return 0\n+ cd /build/repo\n+ '[' v3.6.1 = :commit: ']'\n+ git checkout refs/tags/v3.6.1\nHEAD is now at 9d0f116 Release 3.6.1\n++ git rev-parse HEAD\n+ test 9d0f11603a1fd3ba4f74009cc1d9a639cfe13a5a = 9d0f11603a1fd3ba4f74009cc1d9a639cfe13a5a\n+ '[' -e .gitmodules ']'\n+ sed -r 's!url = git@([a-z.]+):!url = https://\\1/!' -i .gitmodules\n+ retry 5 git submodule update --init --recursive\n+ local i n=5\n+ shift\n+ (( i = 1 ))\n+ (( i <= n ))\n+ git submodule update --init --recursive\nSubmodule 'InputStickAPI-Android' (https://github.com/inputstick/InputStickAPI-Android) registered for path 'InputStickAPI-Android'\nCloning into '/build/repo/InputStickAPI-Android'...\nSubmodule path 'InputStickAPI-Android': checked out '6f2056be0f091b900e621c0222452a908f0fc9e7'\n+ return 0\n+ '[' yes = yes ']'\n+ retry 5 git clone https://github.com/obfusk/gradle-wrapper-verify /opt/gradle-wrapper-verify\n+ local i n=5\n+ shift\n+ (( i = 1 ))\n+ (( i <= n ))\n+ git clone https://github.com/obfusk/gradle-wrapper-verify /opt/gradle-wrapper-verify\nCloning into '/opt/gradle-wrapper-verify'...\n+ return 0\n+ shopt -s globstar\n+ /opt/gradle-wrapper-verify/gradle-wrapper-verify ./gradle/wrapper/gradle-wrapper.jar\nchecking ./gradle/wrapper/gradle-wrapper.jar ...\nOK\n+ find . -iname '*.jar' -o -iname '*.aar'\n+ sort\n./gradle/wrapper/gradle-wrapper.jar\n+ export PATH=/usr/local/sbin:/usr/local/bin:/usr/sbin:/usr/bin:/sbin:/bin:/opt/sdk/cmdline-tools/12.0/bin\n+ PATH=/usr/local/sbin:/usr/local/bin:/usr/sbin:/usr/bin:/sbin:/bin:/opt/sdk/cmdline-tools/12.0/bin\n+ DEX_FILE=app/build/intermediates/dex/release/mergeDexRelease/classes.dex\n+ DEX_SHA1=1f5efb891ceff9afcba7b9609abcc580b30eaff3\n+ for _ in {1..10}\n+ ./gradlew clean assembleRelease --no-build-cache --no-configuration-cache --no-daemon\nDownloading https://services.gradle.org/distributions/gradle-8.7-bin.zip\n...............................................................................................................................\n\nWelcome to Gradle 8.7!\n\nHere are the highlights of this release:\n - Compiling and testing with Java 22\n - Cacheable Groovy script compilation\n - New methods in lazy collection properties\n\nFor more details see https://docs.gradle.org/8.7/release-notes.html\n\nTo honour the JVM settings for this build a single-use Daemon process will be forked. For more on this, please refer to https://docs.gradle.org/8.7/userguide/gradle_daemon.html#sec:disabling_the_daemon in the Gradle documentation.\nDaemon will be stopped at the end of the build \n\n> Configure project :app\nWARNING: The option setting 'android.defaults.buildfeatures.buildconfig=true' is deprecated.\nThe current default is 'false'.\nIt will be removed in version 9.0 of the Android Gradle plugin.\nTo keep using this feature, add the following to your module-level build.gradle files:\n    android.buildFeatures.buildConfig = true\nor from Android Studio, click: `Refactor` > `Migrate BuildConfig to Gradle Build Files`.\nChecking the license for package Android SDK Build-Tools 34 in /opt/sdk/licenses\nLicense for package Android SDK Build-Tools 34 accepted.\nPreparing \"Install Android SDK Build-Tools 34 v.34.0.0\".\n\"Install Android SDK Build-Tools 34 v.34.0.0\" ready.\nInstalling Android SDK Build-Tools 34 in /opt/sdk/build-tools/34.0.0\n\"Install Android SDK Build-Tools 34 v.34.0.0\" complete.\n\"Install Android SDK Build-Tools 34 v.34.0.0\" finished.\nChecking the license for package Android SDK Platform 34 in /opt/sdk/licenses\nLicense for package Android SDK Platform 34 accepted.\nPreparing \"Install Android SDK Platform 34 (revision 3)\".\n\"Install Android SDK Platform 34 (revision 3)\" ready.\nInstalling Android SDK Platform 34 in /opt/sdk/platforms/android-34\n\"Install Android SDK Platform 34 (revision 3)\" complete.\n\"Install Android SDK Platform 34 (revision 3)\" finished.\nChecking the license for package Android SDK Platform-Tools in /opt/sdk/licenses\nLicense for package Android SDK Platform-Tools accepted.\nPreparing \"Install Android SDK Platform-Tools v.35.0.2\".\n\"Install Android SDK Platform-Tools v.35.0.2\" ready.\nInstalling Android SDK Platform-Tools in /opt/sdk/platform-tools\n\"Install Android SDK Platform-Tools v.35.0.2\" complete.\n\"Install Android SDK Platform-Tools v.35.0.2\" finished.\n\n> Task :clean UP-TO-DATE\n> Task :app:clean UP-TO-DATE\n> Task :app:checkKotlinGradlePluginConfigurationErrors SKIPPED\n> Task :app:preBuild UP-TO-DATE\n> Task :app:preReleaseBuild UP-TO-DATE\n> Task :app:dataBindingMergeDependencyArtifactsRelease\n> Task :app:generateReleaseResValues\n> Task :app:generateReleaseResources\n> Task :app:generateReleaseBuildConfig\n> Task :app:mapReleaseSourceSetPaths\n> Task :app:checkReleaseAarMetadata\n> Task :app:mergeReleaseResources\n> Task :app:createReleaseCompatibleScreenManifests\n> Task :app:dataBindingGenBaseClassesRelease\n> Task :app:extractDeepLinksRelease\n> Task :app:processReleaseMainManifest\n> Task :app:processReleaseManifest\n> Task :app:buildKotlinToolingMetadata\n> Task :app:javaPreCompileRelease\n> Task :app:extractProguardFiles\n> Task :app:mergeReleaseJniLibFolders\n> Task :app:mergeReleaseNativeLibs NO-SOURCE\n> Task :app:stripReleaseDebugSymbols NO-SOURCE\n> Task :app:extractReleaseNativeSymbolTables NO-SOURCE\n> Task :app:mergeReleaseNativeDebugMetadata NO-SOURCE\n> Task :app:checkReleaseDuplicateClasses\n> Task :app:desugarReleaseFileDependencies\n> Task :app:mergeReleaseStartupProfile\n> Task :app:processReleaseManifestForPackage\n> Task :app:mergeReleaseArtProfile\n> Task :app:mergeReleaseShaders\n> Task :app:compileReleaseShaders NO-SOURCE\n> Task :app:generateReleaseAssets UP-TO-DATE\n> Task :app:mergeReleaseAssets\n> Task :app:compressReleaseAssets\n> Task :app:extractReleaseVersionControlInfo\n> Task :app:collectReleaseDependencies\n> Task :app:sdkReleaseDependencyData\n> Task :app:writeReleaseAppMetadata\n> Task :app:writeReleaseSigningConfigVersions\n> Task :app:processReleaseResources\n> Task :app:mergeExtDexRelease\n> Task :app:optimizeReleaseResources\n\n> Task :app:kaptGenerateStubsReleaseKotlin\nw: Kapt currently doesn't support language version 2.0+. Falling back to 1.9.\n\n> Task :app:kaptReleaseKotlin\n> Task :app:compileReleaseKotlin\n\n> Task :app:compileReleaseJavaWithJavac\nNote: Some input files use or override a deprecated API.\nNote: Recompile with -Xlint:deprecation for details.\n\n> Task :app:generateReleaseLintVitalReportModel\n> Task :app:dexBuilderRelease\n> Task :app:mergeReleaseGlobalSynthetics\n> Task :app:processReleaseJavaRes\n> Task :app:mergeReleaseJavaResource\n> Task :app:mergeDexRelease\n> Task :app:compileReleaseArtProfile\n> Task :app:packageRelease\n> Task :app:createReleaseApkListingFileRedirect\n> Task :app:lintVitalAnalyzeRelease\n> Task :app:lintVitalReportRelease\n> Task :app:lintVitalRelease\n> Task :app:assembleRelease\n\nDeprecated Gradle features were used in this build, making it incompatible with Gradle 9.0.\n\nYou can use '--warning-mode all' to show the individual deprecation warnings and determine if they come from your own scripts or plugins.\n\nFor more on this, please refer to https://docs.gradle.org/8.7/userguide/command_line_interface.html#sec:command_line_warnings in the Gradle documentation.\n\nBUILD SUCCESSFUL in 2m 45s\n50 actionable tasks: 48 executed, 2 up-to-date\n+ test -e app/build/intermediates/dex/release/mergeDexRelease/classes.dex\n++ sha1sum app/build/intermediates/dex/release/mergeDexRelease/classes.dex\n++ cut '-d ' -f1\n+ '[' 42b2c7086e3d911d2074b13241876c5c2034b73c = 1f5efb891ceff9afcba7b9609abcc580b30eaff3 ']'\n+ for _ in {1..10}\n+ ./gradlew clean assembleRelease --no-build-cache --no-configuration-cache --no-daemon\nTo honour the JVM settings for this build a single-use Daemon process will be forked. For more on this, please refer to https://docs.gradle.org/8.7/userguide/gradle_daemon.html#sec:disabling_the_daemon in the Gradle documentation.\nDaemon will be stopped at the end of the build \n\n> Configure project :app\nWARNING: The option setting 'android.defaults.buildfeatures.buildconfig=true' is deprecated.\nThe current default is 'false'.\nIt will be removed in version 9.0 of the Android Gradle plugin.\nTo keep using this feature, add the following to your module-level build.gradle files:\n    android.buildFeatures.buildConfig = true\nor from Android Studio, click: `Refactor` > `Migrate BuildConfig to Gradle Build Files`.\n\n> Task :clean UP-TO-DATE\n> Task :app:clean\n> Task :app:checkKotlinGradlePluginConfigurationErrors SKIPPED\n> Task :app:preBuild UP-TO-DATE\n> Task :app:preReleaseBuild UP-TO-DATE\n> Task :app:generateReleaseResValues\n> Task :app:dataBindingMergeDependencyArtifactsRelease\n> Task :app:generateReleaseResources\n> Task :app:generateReleaseBuildConfig\n> Task :app:mapReleaseSourceSetPaths\n> Task :app:checkReleaseAarMetadata\n> Task :app:createReleaseCompatibleScreenManifests\n> Task :app:extractDeepLinksRelease\n> Task :app:processReleaseMainManifest\n> Task :app:mergeReleaseResources\n> Task :app:dataBindingGenBaseClassesRelease\n> Task :app:processReleaseManifest\n> Task :app:buildKotlinToolingMetadata\n> Task :app:javaPreCompileRelease\n> Task :app:extractProguardFiles\n> Task :app:mergeReleaseJniLibFolders\n> Task :app:processReleaseManifestForPackage\n> Task :app:mergeReleaseNativeLibs NO-SOURCE\n> Task :app:stripReleaseDebugSymbols NO-SOURCE\n> Task :app:extractReleaseNativeSymbolTables NO-SOURCE\n> Task :app:mergeReleaseNativeDebugMetadata NO-SOURCE\n> Task :app:checkReleaseDuplicateClasses\n> Task :app:desugarReleaseFileDependencies\n> Task :app:mergeReleaseStartupProfile UP-TO-DATE\n> Task :app:mergeReleaseShaders\n> Task :app:mergeReleaseArtProfile\n> Task :app:compileReleaseShaders NO-SOURCE\n> Task :app:generateReleaseAssets UP-TO-DATE\n> Task :app:mergeReleaseAssets\n> Task :app:compressReleaseAssets\n> Task :app:extractReleaseVersionControlInfo\n> Task :app:collectReleaseDependencies\n> Task :app:sdkReleaseDependencyData\n> Task :app:writeReleaseAppMetadata\n> Task :app:writeReleaseSigningConfigVersions\n> Task :app:processReleaseResources\n> Task :app:optimizeReleaseResources\n> Task :app:mergeExtDexRelease\n\n> Task :app:kaptGenerateStubsReleaseKotlin\nw: Kapt currently doesn't support language version 2.0+. Falling back to 1.9.\n\n> Task :app:kaptReleaseKotlin\n> Task :app:compileReleaseKotlin\n\n> Task :app:compileReleaseJavaWithJavac\nNote: Some input files use or override a deprecated API.\nNote: Recompile with -Xlint:deprecation for details.\n\n> Task :app:generateReleaseLintVitalReportModel\n> Task :app:dexBuilderRelease\n> Task :app:mergeReleaseGlobalSynthetics\n> Task :app:processReleaseJavaRes\n> Task :app:mergeReleaseJavaResource\n> Task :app:mergeDexRelease\n> Task :app:compileReleaseArtProfile\n> Task :app:packageRelease\n> Task :app:createReleaseApkListingFileRedirect\n> Task :app:lintVitalAnalyzeRelease\n> Task :app:lintVitalReportRelease\n> Task :app:lintVitalRelease\n> Task :app:assembleRelease\n\nDeprecated Gradle features were used in this build, making it incompatible with Gradle 9.0.\n\nYou can use '--warning-mode all' to show the individual deprecation warnings and determine if they come from your own scripts or plugins.\n\nFor more on this, please refer to https://docs.gradle.org/8.7/userguide/command_line_interface.html#sec:command_line_warnings in the Gradle documentation.\n\nBUILD SUCCESSFUL in 52s\n50 actionable tasks: 48 executed, 2 up-to-date\n+ test -e app/build/intermediates/dex/release/mergeDexRelease/classes.dex\n++ sha1sum app/build/intermediates/dex/release/mergeDexRelease/classes.dex\n++ cut '-d ' -f1\n+ '[' 42b2c7086e3d911d2074b13241876c5c2034b73c = 1f5efb891ceff9afcba7b9609abcc580b30eaff3 ']'\n+ for _ in {1..10}\n+ ./gradlew clean assembleRelease --no-build-cache --no-configuration-cache --no-daemon\nTo honour the JVM settings for this build a single-use Daemon process will be forked. For more on this, please refer to https://docs.gradle.org/8.7/userguide/gradle_daemon.html#sec:disabling_the_daemon in the Gradle documentation.\nDaemon will be stopped at the end of the build \n\n> Configure project :app\nWARNING: The option setting 'android.defaults.buildfeatures.buildconfig=true' is deprecated.\nThe current default is 'false'.\nIt will be removed in version 9.0 of the Android Gradle plugin.\nTo keep using this feature, add the following to your module-level build.gradle files:\n    android.buildFeatures.buildConfig = true\nor from Android Studio, click: `Refactor` > `Migrate BuildConfig to Gradle Build Files`.\n\n> Task :clean UP-TO-DATE\n> Task :app:clean\n> Task :app:checkKotlinGradlePluginConfigurationErrors SKIPPED\n> Task :app:preBuild UP-TO-DATE\n> Task :app:preReleaseBuild UP-TO-DATE\n> Task :app:dataBindingMergeDependencyArtifactsRelease\n> Task :app:generateReleaseResValues\n> Task :app:generateReleaseResources\n> Task :app:generateReleaseBuildConfig\n> Task :app:mapReleaseSourceSetPaths\n> Task :app:createReleaseCompatibleScreenManifests\n> Task :app:checkReleaseAarMetadata\n> Task :app:extractDeepLinksRelease\n> Task :app:processReleaseMainManifest\n> Task :app:processReleaseManifest\n> Task :app:mergeReleaseResources\n> Task :app:buildKotlinToolingMetadata\n> Task :app:dataBindingGenBaseClassesRelease\n> Task :app:processReleaseManifestForPackage\n> Task :app:javaPreCompileRelease\n> Task :app:extractProguardFiles\n> Task :app:mergeReleaseJniLibFolders\n> Task :app:mergeReleaseNativeLibs NO-SOURCE\n> Task :app:stripReleaseDebugSymbols NO-SOURCE\n> Task :app:extractReleaseNativeSymbolTables NO-SOURCE\n> Task :app:mergeReleaseNativeDebugMetadata NO-SOURCE\n> Task :app:checkReleaseDuplicateClasses\n> Task :app:desugarReleaseFileDependencies\n> Task :app:mergeReleaseStartupProfile UP-TO-DATE\n> Task :app:mergeReleaseArtProfile\n> Task :app:mergeReleaseShaders\n> Task :app:compileReleaseShaders NO-SOURCE\n> Task :app:generateReleaseAssets UP-TO-DATE\n> Task :app:mergeReleaseAssets\n> Task :app:compressReleaseAssets\n> Task :app:extractReleaseVersionControlInfo\n> Task :app:collectReleaseDependencies\n> Task :app:sdkReleaseDependencyData\n> Task :app:writeReleaseAppMetadata\n> Task :app:writeReleaseSigningConfigVersions\n> Task :app:processReleaseResources\n> Task :app:optimizeReleaseResources\n> Task :app:mergeExtDexRelease\n\n> Task :app:kaptGenerateStubsReleaseKotlin\nw: Kapt currently doesn't support language version 2.0+. Falling back to 1.9.\n\n> Task :app:kaptReleaseKotlin\n> Task :app:compileReleaseKotlin\n\n> Task :app:compileReleaseJavaWithJavac\nNote: Some input files use or override a deprecated API.\nNote: Recompile with -Xlint:deprecation for details.\n\n> Task :app:generateReleaseLintVitalReportModel\n> Task :app:dexBuilderRelease\n> Task :app:mergeReleaseGlobalSynthetics\n> Task :app:processReleaseJavaRes\n> Task :app:mergeReleaseJavaResource\n> Task :app:mergeDexRelease\n> Task :app:compileReleaseArtProfile\n> Task :app:packageRelease\n> Task :app:createReleaseApkListingFileRedirect\n> Task :app:lintVitalAnalyzeRelease\n> Task :app:lintVitalReportRelease\n> Task :app:lintVitalRelease\n> Task :app:assembleRelease\n\nDeprecated Gradle features were used in this build, making it incompatible with Gradle 9.0.\n\nYou can use '--warning-mode all' to show the individual deprecation warnings and determine if they come from your own scripts or plugins.\n\nFor more on this, please refer to https://docs.gradle.org/8.7/userguide/command_line_interface.html#sec:command_line_warnings in the Gradle documentation.\n\nBUILD SUCCESSFUL in 52s\n50 actionable tasks: 48 executed, 2 up-to-date\n+ test -e app/build/intermediates/dex/release/mergeDexRelease/classes.dex\n++ sha1sum app/build/intermediates/dex/release/mergeDexRelease/classes.dex\n++ cut '-d ' -f1\n+ '[' 42b2c7086e3d911d2074b13241876c5c2034b73c = 1f5efb891ceff9afcba7b9609abcc580b30eaff3 ']'\n+ for _ in {1..10}\n+ ./gradlew clean assembleRelease --no-build-cache --no-configuration-cache --no-daemon\nTo honour the JVM settings for this build a single-use Daemon process will be forked. For more on this, please refer to https://docs.gradle.org/8.7/userguide/gradle_daemon.html#sec:disabling_the_daemon in the Gradle documentation.\nDaemon will be stopped at the end of the build \n\n> Configure project :app\nWARNING: The option setting 'android.defaults.buildfeatures.buildconfig=true' is deprecated.\nThe current default is 'false'.\nIt will be removed in version 9.0 of the Android Gradle plugin.\nTo keep using this feature, add the following to your module-level build.gradle files:\n    android.buildFeatures.buildConfig = true\nor from Android Studio, click: `Refactor` > `Migrate BuildConfig to Gradle Build Files`.\n\n> Task :clean UP-TO-DATE\n> Task :app:clean\n> Task :app:checkKotlinGradlePluginConfigurationErrors SKIPPED\n> Task :app:preBuild UP-TO-DATE\n> Task :app:preReleaseBuild UP-TO-DATE\n> Task :app:generateReleaseResValues\n> Task :app:dataBindingMergeDependencyArtifactsRelease\n> Task :app:generateReleaseResources\n> Task :app:generateReleaseBuildConfig\n> Task :app:mapReleaseSourceSetPaths\n> Task :app:createReleaseCompatibleScreenManifests\n> Task :app:checkReleaseAarMetadata\n> Task :app:extractDeepLinksRelease\n> Task :app:processReleaseMainManifest\n> Task :app:mergeReleaseResources\n> Task :app:processReleaseManifest\n> Task :app:dataBindingGenBaseClassesRelease\n> Task :app:processReleaseManifestForPackage\n> Task :app:buildKotlinToolingMetadata\n> Task :app:javaPreCompileRelease\n> Task :app:extractProguardFiles\n> Task :app:mergeReleaseJniLibFolders\n> Task :app:mergeReleaseNativeLibs NO-SOURCE\n> Task :app:stripReleaseDebugSymbols NO-SOURCE\n> Task :app:extractReleaseNativeSymbolTables NO-SOURCE\n> Task :app:mergeReleaseNativeDebugMetadata NO-SOURCE\n> Task :app:checkReleaseDuplicateClasses\n> Task :app:desugarReleaseFileDependencies\n> Task :app:mergeReleaseStartupProfile UP-TO-DATE\n> Task :app:mergeReleaseArtProfile\n> Task :app:mergeReleaseShaders\n> Task :app:compileReleaseShaders NO-SOURCE\n> Task :app:generateReleaseAssets UP-TO-DATE\n> Task :app:mergeReleaseAssets\n> Task :app:compressReleaseAssets\n> Task :app:extractReleaseVersionControlInfo\n> Task :app:collectReleaseDependencies\n> Task :app:sdkReleaseDependencyData\n> Task :app:writeReleaseAppMetadata\n> Task :app:writeReleaseSigningConfigVersions\n> Task :app:processReleaseResources\n> Task :app:optimizeReleaseResources\n> Task :app:mergeExtDexRelease\n\n> Task :app:kaptGenerateStubsReleaseKotlin\nw: Kapt currently doesn't support language version 2.0+. Falling back to 1.9.\n\n> Task :app:kaptReleaseKotlin\n> Task :app:compileReleaseKotlin\n\n> Task :app:compileReleaseJavaWithJavac\nNote: Some input files use or override a deprecated API.\nNote: Recompile with -Xlint:deprecation for details.\n\n> Task :app:generateReleaseLintVitalReportModel\n> Task :app:dexBuilderRelease\n> Task :app:mergeReleaseGlobalSynthetics\n> Task :app:processReleaseJavaRes\n> Task :app:mergeReleaseJavaResource\n> Task :app:mergeDexRelease\n> Task :app:compileReleaseArtProfile\n> Task :app:packageRelease\n> Task :app:createReleaseApkListingFileRedirect\n> Task :app:lintVitalAnalyzeRelease\n> Task :app:lintVitalReportRelease\n> Task :app:lintVitalRelease\n> Task :app:assembleRelease\n\nDeprecated Gradle features were used in this build, making it incompatible with Gradle 9.0.\n\nYou can use '--warning-mode all' to show the individual deprecation warnings and determine if they come from your own scripts or plugins.\n\nFor more on this, please refer to https://docs.gradle.org/8.7/userguide/command_line_interface.html#sec:command_line_warnings in the Gradle documentation.\n\nBUILD SUCCESSFUL in 53s\n50 actionable tasks: 48 executed, 2 up-to-date\n+ test -e app/build/intermediates/dex/release/mergeDexRelease/classes.dex\n++ sha1sum app/build/intermediates/dex/release/mergeDexRelease/classes.dex\n++ cut '-d ' -f1\n+ '[' 42b2c7086e3d911d2074b13241876c5c2034b73c = 1f5efb891ceff9afcba7b9609abcc580b30eaff3 ']'\n+ for _ in {1..10}\n+ ./gradlew clean assembleRelease --no-build-cache --no-configuration-cache --no-daemon\nTo honour the JVM settings for this build a single-use Daemon process will be forked. For more on this, please refer to https://docs.gradle.org/8.7/userguide/gradle_daemon.html#sec:disabling_the_daemon in the Gradle documentation.\nDaemon will be stopped at the end of the build \n\n> Configure project :app\nWARNING: The option setting 'android.defaults.buildfeatures.buildconfig=true' is deprecated.\nThe current default is 'false'.\nIt will be removed in version 9.0 of the Android Gradle plugin.\nTo keep using this feature, add the following to your module-level build.gradle files:\n    android.buildFeatures.buildConfig = true\nor from Android Studio, click: `Refactor` > `Migrate BuildConfig to Gradle Build Files`.\n\n> Task :clean UP-TO-DATE\n> Task :app:clean\n> Task :app:checkKotlinGradlePluginConfigurationErrors SKIPPED\n> Task :app:preBuild UP-TO-DATE\n> Task :app:preReleaseBuild UP-TO-DATE\n> Task :app:dataBindingMergeDependencyArtifactsRelease\n> Task :app:generateReleaseResValues\n> Task :app:generateReleaseResources\n> Task :app:generateReleaseBuildConfig\n> Task :app:mapReleaseSourceSetPaths\n> Task :app:createReleaseCompatibleScreenManifests\n> Task :app:extractDeepLinksRelease\n> Task :app:checkReleaseAarMetadata\n> Task :app:processReleaseMainManifest\n> Task :app:mergeReleaseResources\n> Task :app:processReleaseManifest\n> Task :app:dataBindingGenBaseClassesRelease\n> Task :app:buildKotlinToolingMetadata\n> Task :app:javaPreCompileRelease\n> Task :app:extractProguardFiles\n> Task :app:mergeReleaseJniLibFolders\n> Task :app:mergeReleaseNativeLibs NO-SOURCE\n> Task :app:stripReleaseDebugSymbols NO-SOURCE\n> Task :app:extractReleaseNativeSymbolTables NO-SOURCE\n> Task :app:mergeReleaseNativeDebugMetadata NO-SOURCE\n> Task :app:checkReleaseDuplicateClasses\n> Task :app:desugarReleaseFileDependencies\n> Task :app:mergeReleaseStartupProfile UP-TO-DATE\n> Task :app:processReleaseManifestForPackage\n> Task :app:mergeReleaseShaders\n> Task :app:compileReleaseShaders NO-SOURCE\n> Task :app:generateReleaseAssets UP-TO-DATE\n> Task :app:mergeReleaseArtProfile\n> Task :app:mergeReleaseAssets\n> Task :app:compressReleaseAssets\n> Task :app:extractReleaseVersionControlInfo\n> Task :app:collectReleaseDependencies\n> Task :app:sdkReleaseDependencyData\n> Task :app:writeReleaseAppMetadata\n> Task :app:writeReleaseSigningConfigVersions\n> Task :app:processReleaseResources\n> Task :app:optimizeReleaseResources\n> Task :app:mergeExtDexRelease\n\n> Task :app:kaptGenerateStubsReleaseKotlin\nw: Kapt currently doesn't support language version 2.0+. Falling back to 1.9.\n\n> Task :app:kaptReleaseKotlin\n> Task :app:compileReleaseKotlin\n\n> Task :app:compileReleaseJavaWithJavac\nNote: Some input files use or override a deprecated API.\nNote: Recompile with -Xlint:deprecation for details.\n\n> Task :app:generateReleaseLintVitalReportModel\n> Task :app:dexBuilderRelease\n> Task :app:mergeReleaseGlobalSynthetics\n> Task :app:processReleaseJavaRes\n> Task :app:mergeReleaseJavaResource\n> Task :app:mergeDexRelease\n> Task :app:compileReleaseArtProfile\n> Task :app:packageRelease\n> Task :app:createReleaseApkListingFileRedirect\n> Task :app:lintVitalAnalyzeRelease\n> Task :app:lintVitalReportRelease\n> Task :app:lintVitalRelease\n> Task :app:assembleRelease\n\nDeprecated Gradle features were used in this build, making it incompatible with Gradle 9.0.\n\nYou can use '--warning-mode all' to show the individual deprecation warnings and determine if they come from your own scripts or plugins.\n\nFor more on this, please refer to https://docs.gradle.org/8.7/userguide/command_line_interface.html#sec:command_line_warnings in the Gradle documentation.\n\nBUILD SUCCESSFUL in 53s\n50 actionable tasks: 48 executed, 2 up-to-date\n+ test -e app/build/intermediates/dex/release/mergeDexRelease/classes.dex\n++ sha1sum app/build/intermediates/dex/release/mergeDexRelease/classes.dex\n++ cut '-d ' -f1\n+ '[' 42b2c7086e3d911d2074b13241876c5c2034b73c = 1f5efb891ceff9afcba7b9609abcc580b30eaff3 ']'\n+ for _ in {1..10}\n+ ./gradlew clean assembleRelease --no-build-cache --no-configuration-cache --no-daemon\nTo honour the JVM settings for this build a single-use Daemon process will be forked. For more on this, please refer to https://docs.gradle.org/8.7/userguide/gradle_daemon.html#sec:disabling_the_daemon in the Gradle documentation.\nDaemon will be stopped at the end of the build \n\n> Configure project :app\nWARNING: The option setting 'android.defaults.buildfeatures.buildconfig=true' is deprecated.\nThe current default is 'false'.\nIt will be removed in version 9.0 of the Android Gradle plugin.\nTo keep using this feature, add the following to your module-level build.gradle files:\n    android.buildFeatures.buildConfig = true\nor from Android Studio, click: `Refactor` > `Migrate BuildConfig to Gradle Build Files`.\n\n> Task :clean UP-TO-DATE\n> Task :app:clean\n> Task :app:checkKotlinGradlePluginConfigurationErrors SKIPPED\n> Task :app:preBuild UP-TO-DATE\n> Task :app:preReleaseBuild UP-TO-DATE\n> Task :app:dataBindingMergeDependencyArtifactsRelease\n> Task :app:generateReleaseResValues\n> Task :app:generateReleaseResources\n> Task :app:generateReleaseBuildConfig\n> Task :app:mapReleaseSourceSetPaths\n> Task :app:createReleaseCompatibleScreenManifests\n> Task :app:extractDeepLinksRelease\n> Task :app:checkReleaseAarMetadata\n> Task :app:processReleaseMainManifest\n> Task :app:mergeReleaseResources\n> Task :app:processReleaseManifest\n> Task :app:dataBindingGenBaseClassesRelease\n> Task :app:buildKotlinToolingMetadata\n> Task :app:javaPreCompileRelease\n> Task :app:extractProguardFiles\n> Task :app:mergeReleaseJniLibFolders\n> Task :app:mergeReleaseNativeLibs NO-SOURCE\n> Task :app:processReleaseManifestForPackage\n> Task :app:stripReleaseDebugSymbols NO-SOURCE\n> Task :app:extractReleaseNativeSymbolTables NO-SOURCE\n> Task :app:mergeReleaseNativeDebugMetadata NO-SOURCE\n> Task :app:checkReleaseDuplicateClasses\n> Task :app:desugarReleaseFileDependencies\n> Task :app:mergeReleaseStartupProfile UP-TO-DATE\n> Task :app:mergeReleaseShaders\n> Task :app:mergeReleaseArtProfile\n> Task :app:compileReleaseShaders NO-SOURCE\n> Task :app:generateReleaseAssets UP-TO-DATE\n> Task :app:mergeReleaseAssets\n> Task :app:compressReleaseAssets\n> Task :app:extractReleaseVersionControlInfo\n> Task :app:collectReleaseDependencies\n> Task :app:sdkReleaseDependencyData\n> Task :app:writeReleaseAppMetadata\n> Task :app:writeReleaseSigningConfigVersions\n> Task :app:processReleaseResources\n> Task :app:optimizeReleaseResources\n> Task :app:mergeExtDexRelease\n\n> Task :app:kaptGenerateStubsReleaseKotlin\nw: Kapt currently doesn't support language version 2.0+. Falling back to 1.9.\n\n> Task :app:kaptReleaseKotlin\n> Task :app:compileReleaseKotlin\n\n> Task :app:compileReleaseJavaWithJavac\nNote: Some input files use or override a deprecated API.\nNote: Recompile with -Xlint:deprecation for details.\n\n> Task :app:generateReleaseLintVitalReportModel\n> Task :app:dexBuilderRelease\n> Task :app:mergeReleaseGlobalSynthetics\n> Task :app:processReleaseJavaRes\n> Task :app:mergeReleaseJavaResource\n> Task :app:mergeDexRelease\n> Task :app:compileReleaseArtProfile\n> Task :app:packageRelease\n> Task :app:createReleaseApkListingFileRedirect\n> Task :app:lintVitalAnalyzeRelease\n> Task :app:lintVitalReportRelease\n> Task :app:lintVitalRelease\n> Task :app:assembleRelease\n\nDeprecated Gradle features were used in this build, making it incompatible with Gradle 9.0.\n\nYou can use '--warning-mode all' to show the individual deprecation warnings and determine if they come from your own scripts or plugins.\n\nFor more on this, please refer to https://docs.gradle.org/8.7/userguide/command_line_interface.html#sec:command_line_warnings in the Gradle documentation.\n\nBUILD SUCCESSFUL in 53s\n50 actionable tasks: 48 executed, 2 up-to-date\n+ test -e app/build/intermediates/dex/release/mergeDexRelease/classes.dex\n++ sha1sum app/build/intermediates/dex/release/mergeDexRelease/classes.dex\n++ cut '-d ' -f1\n+ '[' 42b2c7086e3d911d2074b13241876c5c2034b73c = 1f5efb891ceff9afcba7b9609abcc580b30eaff3 ']'\n+ for _ in {1..10}\n+ ./gradlew clean assembleRelease --no-build-cache --no-configuration-cache --no-daemon\nTo honour the JVM settings for this build a single-use Daemon process will be forked. For more on this, please refer to https://docs.gradle.org/8.7/userguide/gradle_daemon.html#sec:disabling_the_daemon in the Gradle documentation.\nDaemon will be stopped at the end of the build \n\n> Configure project :app\nWARNING: The option setting 'android.defaults.buildfeatures.buildconfig=true' is deprecated.\nThe current default is 'false'.\nIt will be removed in version 9.0 of the Android Gradle plugin.\nTo keep using this feature, add the following to your module-level build.gradle files:\n    android.buildFeatures.buildConfig = true\nor from Android Studio, click: `Refactor` > `Migrate BuildConfig to Gradle Build Files`.\n\n> Task :clean UP-TO-DATE\n> Task :app:clean\n> Task :app:checkKotlinGradlePluginConfigurationErrors SKIPPED\n> Task :app:preBuild UP-TO-DATE\n> Task :app:preReleaseBuild UP-TO-DATE\n> Task :app:generateReleaseResValues\n> Task :app:dataBindingMergeDependencyArtifactsRelease\n> Task :app:generateReleaseResources\n> Task :app:generateReleaseBuildConfig\n> Task :app:mapReleaseSourceSetPaths\n> Task :app:createReleaseCompatibleScreenManifests\n> Task :app:extractDeepLinksRelease\n> Task :app:checkReleaseAarMetadata\n> Task :app:processReleaseMainManifest\n> Task :app:mergeReleaseResources\n> Task :app:processReleaseManifest\n> Task :app:dataBindingGenBaseClassesRelease\n> Task :app:buildKotlinToolingMetadata\n> Task :app:javaPreCompileRelease\n> Task :app:extractProguardFiles\n> Task :app:mergeReleaseJniLibFolders\n> Task :app:mergeReleaseNativeLibs NO-SOURCE\n> Task :app:stripReleaseDebugSymbols NO-SOURCE\n> Task :app:extractReleaseNativeSymbolTables NO-SOURCE\n> Task :app:mergeReleaseNativeDebugMetadata NO-SOURCE\n> Task :app:checkReleaseDuplicateClasses\n> Task :app:desugarReleaseFileDependencies\n> Task :app:mergeReleaseStartupProfile UP-TO-DATE\n> Task :app:mergeReleaseArtProfile\n> Task :app:mergeReleaseShaders\n> Task :app:compileReleaseShaders NO-SOURCE\n> Task :app:generateReleaseAssets UP-TO-DATE\n> Task :app:mergeReleaseAssets\n> Task :app:compressReleaseAssets\n> Task :app:extractReleaseVersionControlInfo\n> Task :app:collectReleaseDependencies\n> Task :app:sdkReleaseDependencyData\n> Task :app:writeReleaseAppMetadata\n> Task :app:writeReleaseSigningConfigVersions\n> Task :app:processReleaseManifestForPackage\n> Task :app:processReleaseResources\n> Task :app:optimizeReleaseResources\n> Task :app:mergeExtDexRelease\n\n> Task :app:kaptGenerateStubsReleaseKotlin\nw: Kapt currently doesn't support language version 2.0+. Falling back to 1.9.\n\n> Task :app:kaptReleaseKotlin\n> Task :app:compileReleaseKotlin\n\n> Task :app:compileReleaseJavaWithJavac\nNote: Some input files use or override a deprecated API.\nNote: Recompile with -Xlint:deprecation for details.\n\n> Task :app:generateReleaseLintVitalReportModel\n> Task :app:dexBuilderRelease\n> Task :app:mergeReleaseGlobalSynthetics\n> Task :app:processReleaseJavaRes\n> Task :app:mergeReleaseJavaResource\n> Task :app:mergeDexRelease\n> Task :app:compileReleaseArtProfile\n> Task :app:packageRelease\n> Task :app:createReleaseApkListingFileRedirect\n> Task :app:lintVitalAnalyzeRelease\n> Task :app:lintVitalReportRelease\n> Task :app:lintVitalRelease\n> Task :app:assembleRelease\n\nDeprecated Gradle features were used in this build, making it incompatible with Gradle 9.0.\n\nYou can use '--warning-mode all' to show the individual deprecation warnings and determine if they come from your own scripts or plugins.\n\nFor more on this, please refer to https://docs.gradle.org/8.7/userguide/command_line_interface.html#sec:command_line_warnings in the Gradle documentation.\n\nBUILD SUCCESSFUL in 52s\n50 actionable tasks: 48 executed, 2 up-to-date\n+ test -e app/build/intermediates/dex/release/mergeDexRelease/classes.dex\n++ sha1sum app/build/intermediates/dex/release/mergeDexRelease/classes.dex\n++ cut '-d ' -f1\n+ '[' 42b2c7086e3d911d2074b13241876c5c2034b73c = 1f5efb891ceff9afcba7b9609abcc580b30eaff3 ']'\n+ for _ in {1..10}\n+ ./gradlew clean assembleRelease --no-build-cache --no-configuration-cache --no-daemon\nTo honour the JVM settings for this build a single-use Daemon process will be forked. For more on this, please refer to https://docs.gradle.org/8.7/userguide/gradle_daemon.html#sec:disabling_the_daemon in the Gradle documentation.\nDaemon will be stopped at the end of the build \n\n> Configure project :app\nWARNING: The option setting 'android.defaults.buildfeatures.buildconfig=true' is deprecated.\nThe current default is 'false'.\nIt will be removed in version 9.0 of the Android Gradle plugin.\nTo keep using this feature, add the following to your module-level build.gradle files:\n    android.buildFeatures.buildConfig = true\nor from Android Studio, click: `Refactor` > `Migrate BuildConfig to Gradle Build Files`.\n\n> Task :clean UP-TO-DATE\n> Task :app:clean\n> Task :app:checkKotlinGradlePluginConfigurationErrors SKIPPED\n> Task :app:preBuild UP-TO-DATE\n> Task :app:preReleaseBuild UP-TO-DATE\n> Task :app:generateReleaseResValues\n> Task :app:dataBindingMergeDependencyArtifactsRelease\n> Task :app:generateReleaseResources\n> Task :app:generateReleaseBuildConfig\n> Task :app:checkReleaseAarMetadata\n> Task :app:mapReleaseSourceSetPaths\n> Task :app:createReleaseCompatibleScreenManifests\n> Task :app:extractDeepLinksRelease\n> Task :app:processReleaseMainManifest\n> Task :app:mergeReleaseResources\n> Task :app:processReleaseManifest\n> Task :app:dataBindingGenBaseClassesRelease\n> Task :app:buildKotlinToolingMetadata\n> Task :app:javaPreCompileRelease\n> Task :app:extractProguardFiles\n> Task :app:mergeReleaseJniLibFolders\n> Task :app:mergeReleaseNativeLibs NO-SOURCE\n> Task :app:stripReleaseDebugSymbols NO-SOURCE\n> Task :app:extractReleaseNativeSymbolTables NO-SOURCE\n> Task :app:mergeReleaseNativeDebugMetadata NO-SOURCE\n> Task :app:checkReleaseDuplicateClasses\n> Task :app:desugarReleaseFileDependencies\n> Task :app:mergeReleaseStartupProfile UP-TO-DATE\n> Task :app:mergeReleaseArtProfile\n> Task :app:mergeReleaseShaders\n> Task :app:compileReleaseShaders NO-SOURCE\n> Task :app:processReleaseManifestForPackage\n> Task :app:generateReleaseAssets UP-TO-DATE\n> Task :app:mergeReleaseAssets\n> Task :app:compressReleaseAssets\n> Task :app:extractReleaseVersionControlInfo\n> Task :app:collectReleaseDependencies\n> Task :app:sdkReleaseDependencyData\n> Task :app:writeReleaseAppMetadata\n> Task :app:writeReleaseSigningConfigVersions\n> Task :app:processReleaseResources\n> Task :app:optimizeReleaseResources\n> Task :app:mergeExtDexRelease\n\n> Task :app:kaptGenerateStubsReleaseKotlin\nw: Kapt currently doesn't support language version 2.0+. Falling back to 1.9.\n\n> Task :app:kaptReleaseKotlin\n> Task :app:compileReleaseKotlin\n\n> Task :app:compileReleaseJavaWithJavac\nNote: Some input files use or override a deprecated API.\nNote: Recompile with -Xlint:deprecation for details.\n\n> Task :app:generateReleaseLintVitalReportModel\n> Task :app:dexBuilderRelease\n> Task :app:mergeReleaseGlobalSynthetics\n> Task :app:processReleaseJavaRes\n> Task :app:mergeReleaseJavaResource\n> Task :app:mergeDexRelease\n> Task :app:compileReleaseArtProfile\n> Task :app:packageRelease\n> Task :app:createReleaseApkListingFileRedirect\n> Task :app:lintVitalAnalyzeRelease\n> Task :app:lintVitalReportRelease\n> Task :app:lintVitalRelease\n> Task :app:assembleRelease\n\nDeprecated Gradle features were used in this build, making it incompatible with Gradle 9.0.\n\nYou can use '--warning-mode all' to show the individual deprecation warnings and determine if they come from your own scripts or plugins.\n\nFor more on this, please refer to https://docs.gradle.org/8.7/userguide/command_line_interface.html#sec:command_line_warnings in the Gradle documentation.\n\nBUILD SUCCESSFUL in 51s\n50 actionable tasks: 48 executed, 2 up-to-date\n+ test -e app/build/intermediates/dex/release/mergeDexRelease/classes.dex\n++ sha1sum app/build/intermediates/dex/release/mergeDexRelease/classes.dex\n++ cut '-d ' -f1\n+ '[' 42b2c7086e3d911d2074b13241876c5c2034b73c = 1f5efb891ceff9afcba7b9609abcc580b30eaff3 ']'\n+ for _ in {1..10}\n+ ./gradlew clean assembleRelease --no-build-cache --no-configuration-cache --no-daemon\nTo honour the JVM settings for this build a single-use Daemon process will be forked. For more on this, please refer to https://docs.gradle.org/8.7/userguide/gradle_daemon.html#sec:disabling_the_daemon in the Gradle documentation.\nDaemon will be stopped at the end of the build \n\n> Configure project :app\nWARNING: The option setting 'android.defaults.buildfeatures.buildconfig=true' is deprecated.\nThe current default is 'false'.\nIt will be removed in version 9.0 of the Android Gradle plugin.\nTo keep using this feature, add the following to your module-level build.gradle files:\n    android.buildFeatures.buildConfig = true\nor from Android Studio, click: `Refactor` > `Migrate BuildConfig to Gradle Build Files`.\n\n> Task :clean UP-TO-DATE\n> Task :app:clean\n> Task :app:checkKotlinGradlePluginConfigurationErrors SKIPPED\n> Task :app:preBuild UP-TO-DATE\n> Task :app:preReleaseBuild UP-TO-DATE\n> Task :app:dataBindingMergeDependencyArtifactsRelease\n> Task :app:generateReleaseResValues\n> Task :app:generateReleaseResources\n> Task :app:generateReleaseBuildConfig\n> Task :app:mapReleaseSourceSetPaths\n> Task :app:checkReleaseAarMetadata\n> Task :app:createReleaseCompatibleScreenManifests\n> Task :app:extractDeepLinksRelease\n> Task :app:processReleaseMainManifest\n> Task :app:mergeReleaseResources\n> Task :app:processReleaseManifest\n> Task :app:dataBindingGenBaseClassesRelease\n> Task :app:buildKotlinToolingMetadata\n> Task :app:javaPreCompileRelease\n> Task :app:extractProguardFiles\n> Task :app:mergeReleaseJniLibFolders\n> Task :app:mergeReleaseNativeLibs NO-SOURCE\n> Task :app:stripReleaseDebugSymbols NO-SOURCE\n> Task :app:extractReleaseNativeSymbolTables NO-SOURCE\n> Task :app:mergeReleaseNativeDebugMetadata NO-SOURCE\n> Task :app:processReleaseManifestForPackage\n> Task :app:checkReleaseDuplicateClasses\n> Task :app:desugarReleaseFileDependencies\n> Task :app:mergeReleaseStartupProfile UP-TO-DATE\n> Task :app:mergeReleaseArtProfile\n> Task :app:mergeReleaseShaders\n> Task :app:compileReleaseShaders NO-SOURCE\n> Task :app:generateReleaseAssets UP-TO-DATE\n> Task :app:mergeReleaseAssets\n> Task :app:compressReleaseAssets\n> Task :app:extractReleaseVersionControlInfo\n> Task :app:collectReleaseDependencies\n> Task :app:sdkReleaseDependencyData\n> Task :app:writeReleaseAppMetadata\n> Task :app:writeReleaseSigningConfigVersions\n> Task :app:processReleaseResources\n> Task :app:optimizeReleaseResources\n> Task :app:mergeExtDexRelease\n\n> Task :app:kaptGenerateStubsReleaseKotlin\nw: Kapt currently doesn't support language version 2.0+. Falling back to 1.9.\n\n> Task :app:kaptReleaseKotlin\n> Task :app:compileReleaseKotlin\n\n> Task :app:compileReleaseJavaWithJavac\nNote: Some input files use or override a deprecated API.\nNote: Recompile with -Xlint:deprecation for details.\n\n> Task :app:generateReleaseLintVitalReportModel\n> Task :app:dexBuilderRelease\n> Task :app:mergeReleaseGlobalSynthetics\n> Task :app:processReleaseJavaRes\n> Task :app:mergeReleaseJavaResource\n> Task :app:mergeDexRelease\n> Task :app:compileReleaseArtProfile\n> Task :app:packageRelease\n> Task :app:createReleaseApkListingFileRedirect\n> Task :app:lintVitalAnalyzeRelease\n> Task :app:lintVitalReportRelease\n> Task :app:lintVitalRelease\n> Task :app:assembleRelease\n\nDeprecated Gradle features were used in this build, making it incompatible with Gradle 9.0.\n\nYou can use '--warning-mode all' to show the individual deprecation warnings and determine if they come from your own scripts or plugins.\n\nFor more on this, please refer to https://docs.gradle.org/8.7/userguide/command_line_interface.html#sec:command_line_warnings in the Gradle documentation.\n\nBUILD SUCCESSFUL in 52s\n50 actionable tasks: 48 executed, 2 up-to-date\n+ test -e app/build/intermediates/dex/release/mergeDexRelease/classes.dex\n++ sha1sum app/build/intermediates/dex/release/mergeDexRelease/classes.dex\n++ cut '-d ' -f1\n+ '[' 42b2c7086e3d911d2074b13241876c5c2034b73c = 1f5efb891ceff9afcba7b9609abcc580b30eaff3 ']'\n+ for _ in {1..10}\n+ ./gradlew clean assembleRelease --no-build-cache --no-configuration-cache --no-daemon\nTo honour the JVM settings for this build a single-use Daemon process will be forked. For more on this, please refer to https://docs.gradle.org/8.7/userguide/gradle_daemon.html#sec:disabling_the_daemon in the Gradle documentation.\nDaemon will be stopped at the end of the build \n\n> Configure project :app\nWARNING: The option setting 'android.defaults.buildfeatures.buildconfig=true' is deprecated.\nThe current default is 'false'.\nIt will be removed in version 9.0 of the Android Gradle plugin.\nTo keep using this feature, add the following to your module-level build.gradle files:\n    android.buildFeatures.buildConfig = true\nor from Android Studio, click: `Refactor` > `Migrate BuildConfig to Gradle Build Files`.\n\n> Task :clean UP-TO-DATE\n> Task :app:clean\n> Task :app:checkKotlinGradlePluginConfigurationErrors SKIPPED\n> Task :app:preBuild UP-TO-DATE\n> Task :app:preReleaseBuild UP-TO-DATE\n> Task :app:generateReleaseResValues\n> Task :app:dataBindingMergeDependencyArtifactsRelease\n> Task :app:generateReleaseResources\n> Task :app:generateReleaseBuildConfig\n> Task :app:mapReleaseSourceSetPaths\n> Task :app:checkReleaseAarMetadata\n> Task :app:createReleaseCompatibleScreenManifests\n> Task :app:extractDeepLinksRelease\n> Task :app:processReleaseMainManifest\n> Task :app:mergeReleaseResources\n> Task :app:processReleaseManifest\n> Task :app:dataBindingGenBaseClassesRelease\n> Task :app:buildKotlinToolingMetadata\n> Task :app:javaPreCompileRelease\n> Task :app:extractProguardFiles\n> Task :app:mergeReleaseJniLibFolders\n> Task :app:mergeReleaseNativeLibs NO-SOURCE\n> Task :app:stripReleaseDebugSymbols NO-SOURCE\n> Task :app:extractReleaseNativeSymbolTables NO-SOURCE\n> Task :app:mergeReleaseNativeDebugMetadata NO-SOURCE\n> Task :app:checkReleaseDuplicateClasses\n> Task :app:desugarReleaseFileDependencies\n> Task :app:mergeReleaseStartupProfile UP-TO-DATE\n> Task :app:processReleaseManifestForPackage\n> Task :app:mergeReleaseShaders\n> Task :app:compileReleaseShaders NO-SOURCE\n> Task :app:generateReleaseAssets UP-TO-DATE\n> Task :app:mergeReleaseArtProfile\n> Task :app:mergeReleaseAssets\n> Task :app:compressReleaseAssets\n> Task :app:extractReleaseVersionControlInfo\n> Task :app:collectReleaseDependencies\n> Task :app:sdkReleaseDependencyData\n> Task :app:writeReleaseAppMetadata\n> Task :app:writeReleaseSigningConfigVersions\n> Task :app:processReleaseResources\n> Task :app:optimizeReleaseResources\n> Task :app:mergeExtDexRelease\n\n> Task :app:kaptGenerateStubsReleaseKotlin\nw: Kapt currently doesn't support language version 2.0+. Falling back to 1.9.\n\n> Task :app:kaptReleaseKotlin\n> Task :app:compileReleaseKotlin\n\n> Task :app:compileReleaseJavaWithJavac\nNote: Some input files use or override a deprecated API.\nNote: Recompile with -Xlint:deprecation for details.\n\n> Task :app:generateReleaseLintVitalReportModel\n> Task :app:dexBuilderRelease\n> Task :app:mergeReleaseGlobalSynthetics\n> Task :app:processReleaseJavaRes\n> Task :app:mergeReleaseJavaResource\n> Task :app:mergeDexRelease\n> Task :app:compileReleaseArtProfile\n> Task :app:packageRelease\n> Task :app:createReleaseApkListingFileRedirect\n> Task :app:lintVitalAnalyzeRelease\n> Task :app:lintVitalReportRelease\n> Task :app:lintVitalRelease\n> Task :app:assembleRelease\n\nDeprecated Gradle features were used in this build, making it incompatible with Gradle 9.0.\n\nYou can use '--warning-mode all' to show the individual deprecation warnings and determine if they come from your own scripts or plugins.\n\nFor more on this, please refer to https://docs.gradle.org/8.7/userguide/command_line_interface.html#sec:command_line_warnings in the Gradle documentation.\n\nBUILD SUCCESSFUL in 52s\n50 actionable tasks: 48 executed, 2 up-to-date\n+ test -e app/build/intermediates/dex/release/mergeDexRelease/classes.dex\n++ sha1sum app/build/intermediates/dex/release/mergeDexRelease/classes.dex\n++ cut '-d ' -f1\n+ '[' 42b2c7086e3d911d2074b13241876c5c2034b73c = 1f5efb891ceff9afcba7b9609abcc580b30eaff3 ']'\n+ mv app/build/outputs/apk/release/app-release-unsigned.apk /outputs/unsigned.apk\n",
        "upstream_signed_apk_sha256": "6b0de01e36a287685805b8f55d0f4b33bfe00ca8e54279c92b4d3976128ecc15",
        "built_unsigned_apk_sha256": "14763d682c9286ef65323d9eb947240ac62941938ac6f9048bdf880019fb3ee9",
        "signature_copied_apk_sha256": "c9ba073b97199501a52030b95eb147e70458af252031c2648525a0ca987a36b3"
      }
    ]
  },
  "version_codes": {
    "22": [
      "v3.6.1"
    ]
  },
  "sha256": {
    "6b0de01e36a287685805b8f55d0f4b33bfe00ca8e54279c92b4d3976128ecc15": [
      "v3.6.1"
    ]
  }
}
