{
  "appid": "org.fossify.filemanager",
  "tags": {
    "1.0.0": [
      {
        "appid": "org.fossify.filemanager",
        "version_code": 1,
        "version_name": "1.0.0",
        "tag": "1.0.0",
        "commit": "feef6998a0fc79aa859f54699d783df4f0a0c147",
        "recipe": {
          "repository": "https://github.com/FossifyOrg/File-Manager.git",
          "tag": "1.0.0",
          "apk_pattern": "file-manager-\\d+-foss-release\\.apk",
          "apk_url": "https://github.com/FossifyOrg/File-Manager/releases/download/1.0.0/file-manager-1-foss-release.apk",
          "build": "./gradlew assembleRelease\nmv app/build/outputs/apk/foss/release/file-manager-*-foss-release-unsigned.apk /outputs/unsigned.apk\n",
          "build_home_dir": "/build",
          "build_repo_dir": "/build/repo",
          "build_user": "build",
          "provisioning": {
            "android_home": "/opt/sdk",
            "build_tools": null,
            "cmake": null,
            "cmdline_tools": {
              "version": "12.0",
              "url": "https://dl.google.com/android/repository/commandlinetools-linux-11076708_latest.zip",
              "sha256": "2d2d50857e4eb553af5a6dc3ad507a17adf43d115264b1afc116f95c92e5e258"
            },
            "extra_packages": [],
            "image": "debian:bookworm-slim",
            "jdk": "openjdk-17-jdk-headless",
            "ndk": null,
            "platform": null,
            "platform_tools": null,
            "tools": null
          }
        },
        "timestamp": 1708151274,
        "reproducible": true,
        "error": null,
        "build_log": "RUN COMMAND podman pull -- debian:bookworm-slim\nTrying to pull docker.io/library/debian:bookworm-slim...\nGetting image source signatures\nCopying blob sha256:e1caac4eb9d2ec24aa3618e5992208321a92492aef5fef5eb9e470895f771c56\nCopying config sha256:711de258f0e0a9171cb8908c86676f859d2cc74cbe738c8e124965036a37cfb1\nWriting manifest to image destination\nStoring signatures\n711de258f0e0a9171cb8908c86676f859d2cc74cbe738c8e124965036a37cfb1\nRUN COMMAND podman run --rm --volume /tmp/tmp56mi7h19/outputs:/outputs --volume /tmp/tmp56mi7h19/scripts:/scripts --env ANDROID_HOME=/opt/sdk --env APP_REPOSITORY=https://github.com/FossifyOrg/File-Manager.git --env APP_TAG=1.0.0 --env APP_COMMIT=feef6998a0fc79aa859f54699d783df4f0a0c147 --env BUILD_USER=build --env BUILD_HOME_DIR=/build --env BUILD_REPO_DIR=/build/repo --env PROVISIONING_BUILD_TOOLS= --env PROVISIONING_CMAKE= --env PROVISIONING_CMDLINE_TOOLS_VERSION=12.0 --env PROVISIONING_CMDLINE_TOOLS_URL=https://dl.google.com/android/repository/commandlinetools-linux-11076708_latest.zip --env PROVISIONING_CMDLINE_TOOLS_SHA256=2d2d50857e4eb553af5a6dc3ad507a17adf43d115264b1afc116f95c92e5e258 --env PROVISIONING_EXTRA_PACKAGES= --env PROVISIONING_JDK=openjdk-17-jdk-headless --env PROVISIONING_NDK= --env PROVISIONING_PLATFORM= --env PROVISIONING_PLATFORM_TOOLS= --env PROVISIONING_TOOLS= -- debian:bookworm-slim bash -c timeout 10m /scripts/provision-root.sh && cd /build && timeout 10m su build /scripts/provision.sh && cd /build/repo && timeout 20m su build /scripts/build.sh\n+ apt-get update\nGet:1 http://deb.debian.org/debian bookworm InRelease [151 kB]\nGet:2 http://deb.debian.org/debian bookworm-updates InRelease [55.4 kB]\nGet:3 http://deb.debian.org/debian-security bookworm-security InRelease [48.0 kB]\nGet:4 http://deb.debian.org/debian bookworm/main amd64 Packages [8786 kB]\nGet:5 http://deb.debian.org/debian bookworm-updates/main amd64 Packages [12.7 kB]\nGet:6 http://deb.debian.org/debian-security bookworm-security/main amd64 Packages [139 kB]\nFetched 9192 kB in 1s (9803 kB/s)\nReading package lists...\n+ apt-get upgrade -y\nReading package lists...\nBuilding dependency tree...\nReading state information...\nCalculating upgrade...\n0 upgraded, 0 newly installed, 0 to remove and 0 not upgraded.\n+ readarray -d , -t extra_packages\n++ printf %s ''\n+ apt-get install --no-install-recommends -y git wget unzip openjdk-17-jdk-headless\nReading package lists...\nBuilding dependency tree...\nReading state information...\nThe following additional packages will be installed:\n  ca-certificates ca-certificates-java fontconfig-config fonts-dejavu-core\n  git-man java-common libasound2 libasound2-data libavahi-client3\n  libavahi-common-data libavahi-common3 libbrotli1 libcups2 libcurl3-gnutls\n  libdbus-1-3 liberror-perl libexpat1 libfontconfig1 libfreetype6\n  libgdbm-compat4 libgdbm6 libglib2.0-0 libgraphite2-3 libgssapi-krb5-2\n  libharfbuzz0b libjpeg62-turbo libk5crypto3 libkeyutils1 libkrb5-3\n  libkrb5support0 liblcms2-2 libldap-2.5-0 libnghttp2-14 libnspr4 libnss3\n  libpcsclite1 libperl5.36 libpng16-16 libpsl5 librtmp1 libsasl2-2\n  libsasl2-modules-db libsqlite3-0 libssh2-1 libssl3 openjdk-17-jre-headless\n  openssl perl perl-modules-5.36\nSuggested packages:\n  gettext-base git-daemon-run | git-daemon-sysvinit git-doc git-email git-gui\n  gitk gitweb git-cvs git-mediawiki git-svn default-jre libasound2-plugins\n  alsa-utils cups-common gdbm-l10n low-memory-monitor krb5-doc krb5-user\n  liblcms2-utils pcscd sensible-utils openjdk-17-demo openjdk-17-source\n  libnss-mdns fonts-dejavu-extra fonts-ipafont-gothic fonts-ipafont-mincho\n  fonts-wqy-microhei | fonts-wqy-zenhei fonts-indic perl-doc\n  libterm-readline-gnu-perl | libterm-readline-perl-perl make\n  libtap-harness-archive-perl zip\nRecommended packages:\n  patch less ssh-client alsa-ucm-conf alsa-topology-conf dbus libglib2.0-data\n  shared-mime-info xdg-user-dirs krb5-locales libldap-common publicsuffix\n  libsasl2-modules netbase\nThe following NEW packages will be installed:\n  ca-certificates ca-certificates-java fontconfig-config fonts-dejavu-core git\n  git-man java-common libasound2 libasound2-data libavahi-client3\n  libavahi-common-data libavahi-common3 libbrotli1 libcups2 libcurl3-gnutls\n  libdbus-1-3 liberror-perl libexpat1 libfontconfig1 libfreetype6\n  libgdbm-compat4 libgdbm6 libglib2.0-0 libgraphite2-3 libgssapi-krb5-2\n  libharfbuzz0b libjpeg62-turbo libk5crypto3 libkeyutils1 libkrb5-3\n  libkrb5support0 liblcms2-2 libldap-2.5-0 libnghttp2-14 libnspr4 libnss3\n  libpcsclite1 libperl5.36 libpng16-16 libpsl5 librtmp1 libsasl2-2\n  libsasl2-modules-db libsqlite3-0 libssh2-1 libssl3 openjdk-17-jdk-headless\n  openjdk-17-jre-headless openssl perl perl-modules-5.36 unzip wget\n0 upgraded, 53 newly installed, 0 to remove and 0 not upgraded.\nNeed to get 148 MB of archives.\nAfter this operation, 409 MB of additional disk space will be used.\nGet:1 http://deb.debian.org/debian bookworm/main amd64 perl-modules-5.36 all 5.36.0-7+deb12u1 [2815 kB]\nGet:2 http://deb.debian.org/debian bookworm/main amd64 libgdbm6 amd64 1.23-3 [72.2 kB]\nGet:3 http://deb.debian.org/debian bookworm/main amd64 libgdbm-compat4 amd64 1.23-3 [48.2 kB]\nGet:4 http://deb.debian.org/debian bookworm/main amd64 libperl5.36 amd64 5.36.0-7+deb12u1 [4218 kB]\nGet:5 http://deb.debian.org/debian bookworm/main amd64 perl amd64 5.36.0-7+deb12u1 [239 kB]\nGet:6 http://deb.debian.org/debian bookworm/main amd64 libssl3 amd64 3.0.11-1~deb12u2 [2019 kB]\nGet:7 http://deb.debian.org/debian bookworm/main amd64 openssl amd64 3.0.11-1~deb12u2 [1419 kB]\nGet:8 http://deb.debian.org/debian bookworm/main amd64 ca-certificates all 20230311 [153 kB]\nGet:9 http://deb.debian.org/debian bookworm/main amd64 libpsl5 amd64 0.21.2-1 [58.7 kB]\nGet:10 http://deb.debian.org/debian bookworm/main amd64 wget amd64 1.21.3-1+b2 [984 kB]\nGet:11 http://deb.debian.org/debian bookworm/main amd64 ca-certificates-java all 20230710~deb12u1 [11.9 kB]\nGet:12 http://deb.debian.org/debian bookworm/main amd64 fonts-dejavu-core all 2.37-6 [1068 kB]\nGet:13 http://deb.debian.org/debian bookworm/main amd64 fontconfig-config amd64 2.14.1-4 [315 kB]\nGet:14 http://deb.debian.org/debian bookworm/main amd64 libbrotli1 amd64 1.0.9-2+b6 [275 kB]\nGet:15 http://deb.debian.org/debian bookworm/main amd64 libkrb5support0 amd64 1.20.1-2+deb12u1 [32.4 kB]\nGet:16 http://deb.debian.org/debian bookworm/main amd64 libk5crypto3 amd64 1.20.1-2+deb12u1 [78.9 kB]\nGet:17 http://deb.debian.org/debian bookworm/main amd64 libkeyutils1 amd64 1.6.3-2 [8808 B]\nGet:18 http://deb.debian.org/debian bookworm/main amd64 libkrb5-3 amd64 1.20.1-2+deb12u1 [332 kB]\nGet:19 http://deb.debian.org/debian bookworm/main amd64 libgssapi-krb5-2 amd64 1.20.1-2+deb12u1 [134 kB]\nGet:20 http://deb.debian.org/debian bookworm/main amd64 libsasl2-modules-db amd64 2.1.28+dfsg-10 [20.3 kB]\nGet:21 http://deb.debian.org/debian bookworm/main amd64 libsasl2-2 amd64 2.1.28+dfsg-10 [59.7 kB]\nGet:22 http://deb.debian.org/debian bookworm/main amd64 libldap-2.5-0 amd64 2.5.13+dfsg-5 [183 kB]\nGet:23 http://deb.debian.org/debian bookworm/main amd64 libnghttp2-14 amd64 1.52.0-1+deb12u1 [72.4 kB]\nGet:24 http://deb.debian.org/debian bookworm/main amd64 librtmp1 amd64 2.4+20151223.gitfa8646d.1-2+b2 [60.8 kB]\nGet:25 http://deb.debian.org/debian bookworm/main amd64 libssh2-1 amd64 1.10.0-3+b1 [179 kB]\nGet:26 http://deb.debian.org/debian bookworm/main amd64 libcurl3-gnutls amd64 7.88.1-10+deb12u5 [385 kB]\nGet:27 http://deb.debian.org/debian bookworm/main amd64 libexpat1 amd64 2.5.0-1 [99.3 kB]\nGet:28 http://deb.debian.org/debian bookworm/main amd64 liberror-perl all 0.17029-2 [29.0 kB]\nGet:29 http://deb.debian.org/debian bookworm/main amd64 git-man all 1:2.39.2-1.1 [2049 kB]\nGet:30 http://deb.debian.org/debian bookworm/main amd64 git amd64 1:2.39.2-1.1 [7171 kB]\nGet:31 http://deb.debian.org/debian bookworm/main amd64 java-common all 0.74 [6388 B]\nGet:32 http://deb.debian.org/debian bookworm/main amd64 libasound2-data all 1.2.8-1 [20.5 kB]\nGet:33 http://deb.debian.org/debian bookworm/main amd64 libasound2 amd64 1.2.8-1+b1 [362 kB]\nGet:34 http://deb.debian.org/debian bookworm/main amd64 libavahi-common-data amd64 0.8-10 [107 kB]\nGet:35 http://deb.debian.org/debian bookworm/main amd64 libavahi-common3 amd64 0.8-10 [41.6 kB]\nGet:36 http://deb.debian.org/debian bookworm/main amd64 libdbus-1-3 amd64 1.14.10-1~deb12u1 [201 kB]\nGet:37 http://deb.debian.org/debian bookworm/main amd64 libavahi-client3 amd64 0.8-10 [45.5 kB]\nGet:38 http://deb.debian.org/debian bookworm/main amd64 libcups2 amd64 2.4.2-3+deb12u5 [245 kB]\nGet:39 http://deb.debian.org/debian bookworm/main amd64 libpng16-16 amd64 1.6.39-2 [276 kB]\nGet:40 http://deb.debian.org/debian bookworm/main amd64 libfreetype6 amd64 2.12.1+dfsg-5 [399 kB]\nGet:41 http://deb.debian.org/debian bookworm/main amd64 libfontconfig1 amd64 2.14.1-4 [386 kB]\nGet:42 http://deb.debian.org/debian bookworm/main amd64 libglib2.0-0 amd64 2.74.6-2 [1398 kB]\nGet:43 http://deb.debian.org/debian bookworm/main amd64 libgraphite2-3 amd64 1.3.14-1 [81.2 kB]\nGet:44 http://deb.debian.org/debian bookworm/main amd64 libharfbuzz0b amd64 6.0.0+dfsg-3 [1945 kB]\nGet:45 http://deb.debian.org/debian bookworm/main amd64 libjpeg62-turbo amd64 1:2.1.5-2 [166 kB]\nGet:46 http://deb.debian.org/debian bookworm/main amd64 liblcms2-2 amd64 2.14-2 [154 kB]\nGet:47 http://deb.debian.org/debian bookworm/main amd64 libnspr4 amd64 2:4.35-1 [113 kB]\nGet:48 http://deb.debian.org/debian bookworm/main amd64 libsqlite3-0 amd64 3.40.1-2 [837 kB]\nGet:49 http://deb.debian.org/debian bookworm/main amd64 libnss3 amd64 2:3.87.1-1 [1331 kB]\nGet:50 http://deb.debian.org/debian bookworm/main amd64 libpcsclite1 amd64 1.9.9-2 [49.7 kB]\nGet:51 http://deb.debian.org/debian bookworm/main amd64 openjdk-17-jre-headless amd64 17.0.10+7-1~deb12u1 [43.7 MB]\nGet:52 http://deb.debian.org/debian bookworm/main amd64 openjdk-17-jdk-headless amd64 17.0.10+7-1~deb12u1 [71.3 MB]\nGet:53 http://deb.debian.org/debian bookworm/main amd64 unzip amd64 6.0-28 [166 kB]\ndebconf: delaying package configuration, since apt-utils is not installed\nFetched 148 MB in 1s (201 MB/s)\nSelecting previously unselected package perl-modules-5.36.\r\n(Reading database ... \r(Reading database ... 5%\r(Reading database ... 10%\r(Reading database ... 15%\r(Reading database ... 20%\r(Reading database ... 25%\r(Reading database ... 30%\r(Reading database ... 35%\r(Reading database ... 40%\r(Reading database ... 45%\r(Reading database ... 50%\r(Reading database ... 55%\r(Reading database ... 60%\r(Reading database ... 65%\r(Reading database ... 70%\r(Reading database ... 75%\r(Reading database ... 80%\r(Reading database ... 85%\r(Reading database ... 90%\r(Reading database ... 95%\r(Reading database ... 100%\r(Reading database ... 6098 files and directories currently installed.)\r\nPreparing to unpack .../00-perl-modules-5.36_5.36.0-7+deb12u1_all.deb ...\r\nUnpacking perl-modules-5.36 (5.36.0-7+deb12u1) ...\r\nSelecting previously unselected package libgdbm6:amd64.\r\nPreparing to unpack .../01-libgdbm6_1.23-3_amd64.deb ...\r\nUnpacking libgdbm6:amd64 (1.23-3) ...\r\nSelecting previously unselected package libgdbm-compat4:amd64.\r\nPreparing to unpack .../02-libgdbm-compat4_1.23-3_amd64.deb ...\r\nUnpacking libgdbm-compat4:amd64 (1.23-3) ...\r\nSelecting previously unselected package libperl5.36:amd64.\r\nPreparing to unpack .../03-libperl5.36_5.36.0-7+deb12u1_amd64.deb ...\r\nUnpacking libperl5.36:amd64 (5.36.0-7+deb12u1) ...\r\nSelecting previously unselected package perl.\r\nPreparing to unpack .../04-perl_5.36.0-7+deb12u1_amd64.deb ...\r\nUnpacking perl (5.36.0-7+deb12u1) ...\r\nSelecting previously unselected package libssl3:amd64.\r\nPreparing to unpack .../05-libssl3_3.0.11-1~deb12u2_amd64.deb ...\r\nUnpacking libssl3:amd64 (3.0.11-1~deb12u2) ...\r\nSelecting previously unselected package openssl.\r\nPreparing to unpack .../06-openssl_3.0.11-1~deb12u2_amd64.deb ...\r\nUnpacking openssl (3.0.11-1~deb12u2) ...\r\nSelecting previously unselected package ca-certificates.\r\nPreparing to unpack .../07-ca-certificates_20230311_all.deb ...\r\nUnpacking ca-certificates (20230311) ...\r\nSelecting previously unselected package libpsl5:amd64.\r\nPreparing to unpack .../08-libpsl5_0.21.2-1_amd64.deb ...\r\nUnpacking libpsl5:amd64 (0.21.2-1) ...\r\nSelecting previously unselected package wget.\r\nPreparing to unpack .../09-wget_1.21.3-1+b2_amd64.deb ...\r\nUnpacking wget (1.21.3-1+b2) ...\r\nSelecting previously unselected package ca-certificates-java.\r\nPreparing to unpack .../10-ca-certificates-java_20230710~deb12u1_all.deb ...\r\nUnpacking ca-certificates-java (20230710~deb12u1) ...\r\nSelecting previously unselected package fonts-dejavu-core.\r\nPreparing to unpack .../11-fonts-dejavu-core_2.37-6_all.deb ...\r\nUnpacking fonts-dejavu-core (2.37-6) ...\r\nSelecting previously unselected package fontconfig-config.\r\nPreparing to unpack .../12-fontconfig-config_2.14.1-4_amd64.deb ...\r\nUnpacking fontconfig-config (2.14.1-4) ...\r\nSelecting previously unselected package libbrotli1:amd64.\r\nPreparing to unpack .../13-libbrotli1_1.0.9-2+b6_amd64.deb ...\r\nUnpacking libbrotli1:amd64 (1.0.9-2+b6) ...\r\nSelecting previously unselected package libkrb5support0:amd64.\r\nPreparing to unpack .../14-libkrb5support0_1.20.1-2+deb12u1_amd64.deb ...\r\nUnpacking libkrb5support0:amd64 (1.20.1-2+deb12u1) ...\r\nSelecting previously unselected package libk5crypto3:amd64.\r\nPreparing to unpack .../15-libk5crypto3_1.20.1-2+deb12u1_amd64.deb ...\r\nUnpacking libk5crypto3:amd64 (1.20.1-2+deb12u1) ...\r\nSelecting previously unselected package libkeyutils1:amd64.\r\nPreparing to unpack .../16-libkeyutils1_1.6.3-2_amd64.deb ...\r\nUnpacking libkeyutils1:amd64 (1.6.3-2) ...\r\nSelecting previously unselected package libkrb5-3:amd64.\r\nPreparing to unpack .../17-libkrb5-3_1.20.1-2+deb12u1_amd64.deb ...\r\nUnpacking libkrb5-3:amd64 (1.20.1-2+deb12u1) ...\r\nSelecting previously unselected package libgssapi-krb5-2:amd64.\r\nPreparing to unpack .../18-libgssapi-krb5-2_1.20.1-2+deb12u1_amd64.deb ...\r\nUnpacking libgssapi-krb5-2:amd64 (1.20.1-2+deb12u1) ...\r\nSelecting previously unselected package libsasl2-modules-db:amd64.\r\nPreparing to unpack .../19-libsasl2-modules-db_2.1.28+dfsg-10_amd64.deb ...\r\nUnpacking libsasl2-modules-db:amd64 (2.1.28+dfsg-10) ...\r\nSelecting previously unselected package libsasl2-2:amd64.\r\nPreparing to unpack .../20-libsasl2-2_2.1.28+dfsg-10_amd64.deb ...\r\nUnpacking libsasl2-2:amd64 (2.1.28+dfsg-10) ...\r\nSelecting previously unselected package libldap-2.5-0:amd64.\r\nPreparing to unpack .../21-libldap-2.5-0_2.5.13+dfsg-5_amd64.deb ...\r\nUnpacking libldap-2.5-0:amd64 (2.5.13+dfsg-5) ...\r\nSelecting previously unselected package libnghttp2-14:amd64.\r\nPreparing to unpack .../22-libnghttp2-14_1.52.0-1+deb12u1_amd64.deb ...\r\nUnpacking libnghttp2-14:amd64 (1.52.0-1+deb12u1) ...\r\nSelecting previously unselected package librtmp1:amd64.\r\nPreparing to unpack .../23-librtmp1_2.4+20151223.gitfa8646d.1-2+b2_amd64.deb ...\r\nUnpacking librtmp1:amd64 (2.4+20151223.gitfa8646d.1-2+b2) ...\r\nSelecting previously unselected package libssh2-1:amd64.\r\nPreparing to unpack .../24-libssh2-1_1.10.0-3+b1_amd64.deb ...\r\nUnpacking libssh2-1:amd64 (1.10.0-3+b1) ...\r\nSelecting previously unselected package libcurl3-gnutls:amd64.\r\nPreparing to unpack .../25-libcurl3-gnutls_7.88.1-10+deb12u5_amd64.deb ...\r\nUnpacking libcurl3-gnutls:amd64 (7.88.1-10+deb12u5) ...\r\nSelecting previously unselected package libexpat1:amd64.\r\nPreparing to unpack .../26-libexpat1_2.5.0-1_amd64.deb ...\r\nUnpacking libexpat1:amd64 (2.5.0-1) ...\r\nSelecting previously unselected package liberror-perl.\r\nPreparing to unpack .../27-liberror-perl_0.17029-2_all.deb ...\r\nUnpacking liberror-perl (0.17029-2) ...\r\nSelecting previously unselected package git-man.\r\nPreparing to unpack .../28-git-man_1%3a2.39.2-1.1_all.deb ...\r\nUnpacking git-man (1:2.39.2-1.1) ...\r\nSelecting previously unselected package git.\r\nPreparing to unpack .../29-git_1%3a2.39.2-1.1_amd64.deb ...\r\nUnpacking git (1:2.39.2-1.1) ...\r\nSelecting previously unselected package java-common.\r\nPreparing to unpack .../30-java-common_0.74_all.deb ...\r\nUnpacking java-common (0.74) ...\r\nSelecting previously unselected package libasound2-data.\r\nPreparing to unpack .../31-libasound2-data_1.2.8-1_all.deb ...\r\nUnpacking libasound2-data (1.2.8-1) ...\r\nSelecting previously unselected package libasound2:amd64.\r\nPreparing to unpack .../32-libasound2_1.2.8-1+b1_amd64.deb ...\r\nUnpacking libasound2:amd64 (1.2.8-1+b1) ...\r\nSelecting previously unselected package libavahi-common-data:amd64.\r\nPreparing to unpack .../33-libavahi-common-data_0.8-10_amd64.deb ...\r\nUnpacking libavahi-common-data:amd64 (0.8-10) ...\r\nSelecting previously unselected package libavahi-common3:amd64.\r\nPreparing to unpack .../34-libavahi-common3_0.8-10_amd64.deb ...\r\nUnpacking libavahi-common3:amd64 (0.8-10) ...\r\nSelecting previously unselected package libdbus-1-3:amd64.\r\nPreparing to unpack .../35-libdbus-1-3_1.14.10-1~deb12u1_amd64.deb ...\r\nUnpacking libdbus-1-3:amd64 (1.14.10-1~deb12u1) ...\r\nSelecting previously unselected package libavahi-client3:amd64.\r\nPreparing to unpack .../36-libavahi-client3_0.8-10_amd64.deb ...\r\nUnpacking libavahi-client3:amd64 (0.8-10) ...\r\nSelecting previously unselected package libcups2:amd64.\r\nPreparing to unpack .../37-libcups2_2.4.2-3+deb12u5_amd64.deb ...\r\nUnpacking libcups2:amd64 (2.4.2-3+deb12u5) ...\r\nSelecting previously unselected package libpng16-16:amd64.\r\nPreparing to unpack .../38-libpng16-16_1.6.39-2_amd64.deb ...\r\nUnpacking libpng16-16:amd64 (1.6.39-2) ...\r\nSelecting previously unselected package libfreetype6:amd64.\r\nPreparing to unpack .../39-libfreetype6_2.12.1+dfsg-5_amd64.deb ...\r\nUnpacking libfreetype6:amd64 (2.12.1+dfsg-5) ...\r\nSelecting previously unselected package libfontconfig1:amd64.\r\nPreparing to unpack .../40-libfontconfig1_2.14.1-4_amd64.deb ...\r\nUnpacking libfontconfig1:amd64 (2.14.1-4) ...\r\nSelecting previously unselected package libglib2.0-0:amd64.\r\nPreparing to unpack .../41-libglib2.0-0_2.74.6-2_amd64.deb ...\r\nUnpacking libglib2.0-0:amd64 (2.74.6-2) ...\r\nSelecting previously unselected package libgraphite2-3:amd64.\r\nPreparing to unpack .../42-libgraphite2-3_1.3.14-1_amd64.deb ...\r\nUnpacking libgraphite2-3:amd64 (1.3.14-1) ...\r\nSelecting previously unselected package libharfbuzz0b:amd64.\r\nPreparing to unpack .../43-libharfbuzz0b_6.0.0+dfsg-3_amd64.deb ...\r\nUnpacking libharfbuzz0b:amd64 (6.0.0+dfsg-3) ...\r\nSelecting previously unselected package libjpeg62-turbo:amd64.\r\nPreparing to unpack .../44-libjpeg62-turbo_1%3a2.1.5-2_amd64.deb ...\r\nUnpacking libjpeg62-turbo:amd64 (1:2.1.5-2) ...\r\nSelecting previously unselected package liblcms2-2:amd64.\r\nPreparing to unpack .../45-liblcms2-2_2.14-2_amd64.deb ...\r\nUnpacking liblcms2-2:amd64 (2.14-2) ...\r\nSelecting previously unselected package libnspr4:amd64.\r\nPreparing to unpack .../46-libnspr4_2%3a4.35-1_amd64.deb ...\r\nUnpacking libnspr4:amd64 (2:4.35-1) ...\r\nSelecting previously unselected package libsqlite3-0:amd64.\r\nPreparing to unpack .../47-libsqlite3-0_3.40.1-2_amd64.deb ...\r\nUnpacking libsqlite3-0:amd64 (3.40.1-2) ...\r\nSelecting previously unselected package libnss3:amd64.\r\nPreparing to unpack .../48-libnss3_2%3a3.87.1-1_amd64.deb ...\r\nUnpacking libnss3:amd64 (2:3.87.1-1) ...\r\nSelecting previously unselected package libpcsclite1:amd64.\r\nPreparing to unpack .../49-libpcsclite1_1.9.9-2_amd64.deb ...\r\nUnpacking libpcsclite1:amd64 (1.9.9-2) ...\r\nSelecting previously unselected package openjdk-17-jre-headless:amd64.\r\nPreparing to unpack .../50-openjdk-17-jre-headless_17.0.10+7-1~deb12u1_amd64.deb ...\r\nUnpacking openjdk-17-jre-headless:amd64 (17.0.10+7-1~deb12u1) ...\r\nSelecting previously unselected package openjdk-17-jdk-headless:amd64.\r\nPreparing to unpack .../51-openjdk-17-jdk-headless_17.0.10+7-1~deb12u1_amd64.deb ...\r\nUnpacking openjdk-17-jdk-headless:amd64 (17.0.10+7-1~deb12u1) ...\r\nSelecting previously unselected package unzip.\r\nPreparing to unpack .../52-unzip_6.0-28_amd64.deb ...\r\nUnpacking unzip (6.0-28) ...\r\nSetting up libexpat1:amd64 (2.5.0-1) ...\r\nSetting up libgraphite2-3:amd64 (1.3.14-1) ...\r\nSetting up liblcms2-2:amd64 (2.14-2) ...\r\nSetting up libkeyutils1:amd64 (1.6.3-2) ...\r\nSetting up libpsl5:amd64 (0.21.2-1) ...\r\nSetting up wget (1.21.3-1+b2) ...\r\nSetting up java-common (0.74) ...\r\nSetting up libglib2.0-0:amd64 (2.74.6-2) ...\r\nNo schema files found: doing nothing.\r\nSetting up unzip (6.0-28) ...\r\nSetting up libbrotli1:amd64 (1.0.9-2+b6) ...\r\nSetting up libsqlite3-0:amd64 (3.40.1-2) ...\r\nSetting up libssl3:amd64 (3.0.11-1~deb12u2) ...\r\nSetting up libnghttp2-14:amd64 (1.52.0-1+deb12u1) ...\r\nSetting up libkrb5support0:amd64 (1.20.1-2+deb12u1) ...\r\nSetting up libsasl2-modules-db:amd64 (2.1.28+dfsg-10) ...\r\nSetting up libasound2-data (1.2.8-1) ...\r\nSetting up perl-modules-5.36 (5.36.0-7+deb12u1) ...\r\nSetting up libjpeg62-turbo:amd64 (1:2.1.5-2) ...\r\nSetting up libnspr4:amd64 (2:4.35-1) ...\r\nSetting up librtmp1:amd64 (2.4+20151223.gitfa8646d.1-2+b2) ...\r\nSetting up libavahi-common-data:amd64 (0.8-10) ...\r\nSetting up libdbus-1-3:amd64 (1.14.10-1~deb12u1) ...\r\nSetting up libpng16-16:amd64 (1.6.39-2) ...\r\nSetting up fonts-dejavu-core (2.37-6) ...\r\nSetting up libpcsclite1:amd64 (1.9.9-2) ...\r\nSetting up libk5crypto3:amd64 (1.20.1-2+deb12u1) ...\r\nSetting up libsasl2-2:amd64 (2.1.28+dfsg-10) ...\r\nSetting up libasound2:amd64 (1.2.8-1+b1) ...\r\nSetting up git-man (1:2.39.2-1.1) ...\r\nSetting up libssh2-1:amd64 (1.10.0-3+b1) ...\r\nSetting up libkrb5-3:amd64 (1.20.1-2+deb12u1) ...\r\nSetting up openssl (3.0.11-1~deb12u2) ...\r\nSetting up libgdbm6:amd64 (1.23-3) ...\r\nSetting up fontconfig-config (2.14.1-4) ...\r\ndebconf: unable to initialize frontend: Dialog\r\ndebconf: (No usable dialog-like program is installed, so the dialog based frontend cannot be used. at /usr/share/perl5/Debconf/FrontEnd/Dialog.pm line 78.)\r\ndebconf: falling back to frontend: Readline\r\ndebconf: unable to initialize frontend: Readline\r\ndebconf: (This frontend requires a controlling tty.)\r\ndebconf: falling back to frontend: Teletype\r\nSetting up libavahi-common3:amd64 (0.8-10) ...\r\nSetting up libnss3:amd64 (2:3.87.1-1) ...\r\nSetting up libldap-2.5-0:amd64 (2.5.13+dfsg-5) ...\r\nSetting up ca-certificates (20230311) ...\r\ndebconf: unable to initialize frontend: Dialog\r\ndebconf: (No usable dialog-like program is installed, so the dialog based frontend cannot be used. at /usr/share/perl5/Debconf/FrontEnd/Dialog.pm line 78.)\r\ndebconf: falling back to frontend: Readline\r\ndebconf: unable to initialize frontend: Readline\r\ndebconf: (This frontend requires a controlling tty.)\r\ndebconf: falling back to frontend: Teletype\r\nUpdating certificates in /etc/ssl/certs...\r\n140 added, 0 removed; done.\r\nSetting up libfreetype6:amd64 (2.12.1+dfsg-5) ...\r\nSetting up libgssapi-krb5-2:amd64 (1.20.1-2+deb12u1) ...\r\nSetting up libgdbm-compat4:amd64 (1.23-3) ...\r\nSetting up libharfbuzz0b:amd64 (6.0.0+dfsg-3) ...\r\nSetting up libfontconfig1:amd64 (2.14.1-4) ...\r\nSetting up ca-certificates-java (20230710~deb12u1) ...\r\nNo JRE found. Skipping Java certificates setup.\r\nSetting up libavahi-client3:amd64 (0.8-10) ...\r\nSetting up libperl5.36:amd64 (5.36.0-7+deb12u1) ...\r\nSetting up libcurl3-gnutls:amd64 (7.88.1-10+deb12u5) ...\r\nSetting up perl (5.36.0-7+deb12u1) ...\r\nSetting up libcups2:amd64 (2.4.2-3+deb12u5) ...\r\nSetting up liberror-perl (0.17029-2) ...\r\nSetting up git (1:2.39.2-1.1) ...\r\nSetting up openjdk-17-jre-headless:amd64 (17.0.10+7-1~deb12u1) ...\r\nupdate-alternatives: using /usr/lib/jvm/java-17-openjdk-amd64/bin/java to provide /usr/bin/java (java) in auto mode\r\nupdate-alternatives: using /usr/lib/jvm/java-17-openjdk-amd64/bin/jpackage to provide /usr/bin/jpackage (jpackage) in auto mode\r\nupdate-alternatives: using /usr/lib/jvm/java-17-openjdk-amd64/bin/keytool to provide /usr/bin/keytool (keytool) in auto mode\r\nupdate-alternatives: using /usr/lib/jvm/java-17-openjdk-amd64/bin/rmiregistry to provide /usr/bin/rmiregistry (rmiregistry) in auto mode\r\nupdate-alternatives: using /usr/lib/jvm/java-17-openjdk-amd64/lib/jexec to provide /usr/bin/jexec (jexec) in auto mode\r\nProcessing triggers for libc-bin (2.36-9+deb12u4) ...\r\nProcessing triggers for ca-certificates-java (20230710~deb12u1) ...\r\nAdding debian:ACCVRAIZ1.pem\r\nAdding debian:AC_RAIZ_FNMT-RCM.pem\r\nAdding debian:AC_RAIZ_FNMT-RCM_SERVIDORES_SEGUROS.pem\r\nAdding debian:ANF_Secure_Server_Root_CA.pem\r\nAdding debian:Actalis_Authentication_Root_CA.pem\r\nAdding debian:AffirmTrust_Commercial.pem\r\nAdding debian:AffirmTrust_Networking.pem\r\nAdding debian:AffirmTrust_Premium.pem\r\nAdding debian:AffirmTrust_Premium_ECC.pem\r\nAdding debian:Amazon_Root_CA_1.pem\r\nAdding debian:Amazon_Root_CA_2.pem\r\nAdding debian:Amazon_Root_CA_3.pem\r\nAdding debian:Amazon_Root_CA_4.pem\r\nAdding debian:Atos_TrustedRoot_2011.pem\r\nAdding debian:Autoridad_de_Certificacion_Firmaprofesional_CIF_A62634068.pem\r\nAdding debian:Autoridad_de_Certificacion_Firmaprofesional_CIF_A62634068_2.pem\r\nAdding debian:Baltimore_CyberTrust_Root.pem\r\nAdding debian:Buypass_Class_2_Root_CA.pem\r\nAdding debian:Buypass_Class_3_Root_CA.pem\r\nAdding debian:CA_Disig_Root_R2.pem\r\nAdding debian:CFCA_EV_ROOT.pem\r\nAdding debian:COMODO_Certification_Authority.pem\r\nAdding debian:COMODO_ECC_Certification_Authority.pem\r\nAdding debian:COMODO_RSA_Certification_Authority.pem\r\nAdding debian:Certainly_Root_E1.pem\r\nAdding debian:Certainly_Root_R1.pem\r\nAdding debian:Certigna.pem\r\nAdding debian:Certigna_Root_CA.pem\r\nAdding debian:Certum_EC-384_CA.pem\r\nAdding debian:Certum_Trusted_Network_CA.pem\r\nAdding debian:Certum_Trusted_Network_CA_2.pem\r\nAdding debian:Certum_Trusted_Root_CA.pem\r\nAdding debian:Comodo_AAA_Services_root.pem\r\nAdding debian:D-TRUST_BR_Root_CA_1_2020.pem\r\nAdding debian:D-TRUST_EV_Root_CA_1_2020.pem\r\nAdding debian:D-TRUST_Root_Class_3_CA_2_2009.pem\r\nAdding debian:D-TRUST_Root_Class_3_CA_2_EV_2009.pem\r\nAdding debian:DigiCert_Assured_ID_Root_CA.pem\r\nAdding debian:DigiCert_Assured_ID_Root_G2.pem\r\nAdding debian:DigiCert_Assured_ID_Root_G3.pem\r\nAdding debian:DigiCert_Global_Root_CA.pem\r\nAdding debian:DigiCert_Global_Root_G2.pem\r\nAdding debian:DigiCert_Global_Root_G3.pem\r\nAdding debian:DigiCert_High_Assurance_EV_Root_CA.pem\r\nAdding debian:DigiCert_TLS_ECC_P384_Root_G5.pem\r\nAdding debian:DigiCert_TLS_RSA4096_Root_G5.pem\r\nAdding debian:DigiCert_Trusted_Root_G4.pem\r\nAdding debian:E-Tugra_Certification_Authority.pem\r\nAdding debian:E-Tugra_Global_Root_CA_ECC_v3.pem\r\nAdding debian:E-Tugra_Global_Root_CA_RSA_v3.pem\r\nAdding debian:Entrust.net_Premium_2048_Secure_Server_CA.pem\r\nAdding debian:Entrust_Root_Certification_Authority.pem\r\nAdding debian:Entrust_Root_Certification_Authority_-_EC1.pem\r\nAdding debian:Entrust_Root_Certification_Authority_-_G2.pem\r\nAdding debian:Entrust_Root_Certification_Authority_-_G4.pem\r\nAdding debian:GDCA_TrustAUTH_R5_ROOT.pem\r\nAdding debian:GLOBALTRUST_2020.pem\r\nAdding debian:GTS_Root_R1.pem\r\nAdding debian:GTS_Root_R2.pem\r\nAdding debian:GTS_Root_R3.pem\r\nAdding debian:GTS_Root_R4.pem\r\nAdding debian:GlobalSign_ECC_Root_CA_-_R4.pem\r\nAdding debian:GlobalSign_ECC_Root_CA_-_R5.pem\r\nAdding debian:GlobalSign_Root_CA.pem\r\nAdding debian:GlobalSign_Root_CA_-_R3.pem\r\nAdding debian:GlobalSign_Root_CA_-_R6.pem\r\nAdding debian:GlobalSign_Root_E46.pem\r\nAdding debian:GlobalSign_Root_R46.pem\r\nAdding debian:Go_Daddy_Class_2_CA.pem\r\nAdding debian:Go_Daddy_Root_Certificate_Authority_-_G2.pem\r\nAdding debian:HARICA_TLS_ECC_Root_CA_2021.pem\r\nAdding debian:HARICA_TLS_RSA_Root_CA_2021.pem\r\nAdding debian:Hellenic_Academic_and_Research_Institutions_ECC_RootCA_2015.pem\r\nAdding debian:Hellenic_Academic_and_Research_Institutions_RootCA_2015.pem\r\nAdding debian:HiPKI_Root_CA_-_G1.pem\r\nAdding debian:Hongkong_Post_Root_CA_1.pem\r\nAdding debian:Hongkong_Post_Root_CA_3.pem\r\nAdding debian:ISRG_Root_X1.pem\r\nAdding debian:ISRG_Root_X2.pem\r\nAdding debian:IdenTrust_Commercial_Root_CA_1.pem\r\nAdding debian:IdenTrust_Public_Sector_Root_CA_1.pem\r\nAdding debian:Izenpe.com.pem\r\nAdding debian:Microsec_e-Szigno_Root_CA_2009.pem\r\nAdding debian:Microsoft_ECC_Root_Certificate_Authority_2017.pem\r\nAdding debian:Microsoft_RSA_Root_Certificate_Authority_2017.pem\r\nAdding debian:NAVER_Global_Root_Certification_Authority.pem\r\nAdding debian:NetLock_Arany_=Class_Gold=_F\u0151tan\u00fas\u00edtv\u00e1ny.pem\r\nAdding debian:OISTE_WISeKey_Global_Root_GB_CA.pem\r\nAdding debian:OISTE_WISeKey_Global_Root_GC_CA.pem\r\nAdding debian:QuoVadis_Root_CA_1_G3.pem\r\nAdding debian:QuoVadis_Root_CA_2.pem\r\nAdding debian:QuoVadis_Root_CA_2_G3.pem\r\nAdding debian:QuoVadis_Root_CA_3.pem\r\nAdding debian:QuoVadis_Root_CA_3_G3.pem\r\nAdding debian:SSL.com_EV_Root_Certification_Authority_ECC.pem\r\nAdding debian:SSL.com_EV_Root_Certification_Authority_RSA_R2.pem\r\nAdding debian:SSL.com_Root_Certification_Authority_ECC.pem\r\nAdding debian:SSL.com_Root_Certification_Authority_RSA.pem\r\nAdding debian:SZAFIR_ROOT_CA2.pem\r\nAdding debian:SecureSign_RootCA11.pem\r\nAdding debian:SecureTrust_CA.pem\r\nAdding debian:Secure_Global_CA.pem\r\nAdding debian:Security_Communication_ECC_RootCA1.pem\r\nAdding debian:Security_Communication_RootCA2.pem\r\nAdding debian:Security_Communication_RootCA3.pem\r\nAdding debian:Security_Communication_Root_CA.pem\r\nAdding debian:Starfield_Class_2_CA.pem\r\nAdding debian:Starfield_Root_Certificate_Authority_-_G2.pem\r\nAdding debian:Starfield_Services_Root_Certificate_Authority_-_G2.pem\r\nAdding debian:SwissSign_Gold_CA_-_G2.pem\r\nAdding debian:SwissSign_Silver_CA_-_G2.pem\r\nAdding debian:T-TeleSec_GlobalRoot_Class_2.pem\r\nAdding debian:T-TeleSec_GlobalRoot_Class_3.pem\r\nAdding debian:TUBITAK_Kamu_SM_SSL_Kok_Sertifikasi_-_Surum_1.pem\r\nAdding debian:TWCA_Global_Root_CA.pem\r\nAdding debian:TWCA_Root_Certification_Authority.pem\r\nAdding debian:TeliaSonera_Root_CA_v1.pem\r\nAdding debian:Telia_Root_CA_v2.pem\r\nAdding debian:TrustCor_ECA-1.pem\r\nAdding debian:TrustCor_RootCert_CA-1.pem\r\nAdding debian:TrustCor_RootCert_CA-2.pem\r\nAdding debian:Trustwave_Global_Certification_Authority.pem\r\nAdding debian:Trustwave_Global_ECC_P256_Certification_Authority.pem\r\nAdding debian:Trustwave_Global_ECC_P384_Certification_Authority.pem\r\nAdding debian:TunTrust_Root_CA.pem\r\nAdding debian:UCA_Extended_Validation_Root.pem\r\nAdding debian:UCA_Global_G2_Root.pem\r\nAdding debian:USERTrust_ECC_Certification_Authority.pem\r\nAdding debian:USERTrust_RSA_Certification_Authority.pem\r\nAdding debian:XRamp_Global_CA_Root.pem\r\nAdding debian:certSIGN_ROOT_CA.pem\r\nAdding debian:certSIGN_Root_CA_G2.pem\r\nAdding debian:e-Szigno_Root_CA_2017.pem\r\nAdding debian:ePKI_Root_Certification_Authority.pem\r\nAdding debian:emSign_ECC_Root_CA_-_C3.pem\r\nAdding debian:emSign_ECC_Root_CA_-_G3.pem\r\nAdding debian:emSign_Root_CA_-_C1.pem\r\nAdding debian:emSign_Root_CA_-_G1.pem\r\nAdding debian:vTrus_ECC_Root_CA.pem\r\nAdding debian:vTrus_Root_CA.pem\r\ndone.\r\nSetting up openjdk-17-jdk-headless:amd64 (17.0.10+7-1~deb12u1) ...\r\nupdate-alternatives: using /usr/lib/jvm/java-17-openjdk-amd64/bin/jar to provide /usr/bin/jar (jar) in auto mode\r\nupdate-alternatives: using /usr/lib/jvm/java-17-openjdk-amd64/bin/jarsigner to provide /usr/bin/jarsigner (jarsigner) in auto mode\r\nupdate-alternatives: using /usr/lib/jvm/java-17-openjdk-amd64/bin/javac to provide /usr/bin/javac (javac) in auto mode\r\nupdate-alternatives: using /usr/lib/jvm/java-17-openjdk-amd64/bin/javadoc to provide /usr/bin/javadoc (javadoc) in auto mode\r\nupdate-alternatives: using /usr/lib/jvm/java-17-openjdk-amd64/bin/javap to provide /usr/bin/javap (javap) in auto mode\r\nupdate-alternatives: using /usr/lib/jvm/java-17-openjdk-amd64/bin/jcmd to provide /usr/bin/jcmd (jcmd) in auto mode\r\nupdate-alternatives: using /usr/lib/jvm/java-17-openjdk-amd64/bin/jdb to provide /usr/bin/jdb (jdb) in auto mode\r\nupdate-alternatives: using /usr/lib/jvm/java-17-openjdk-amd64/bin/jdeprscan to provide /usr/bin/jdeprscan (jdeprscan) in auto mode\r\nupdate-alternatives: using /usr/lib/jvm/java-17-openjdk-amd64/bin/jdeps to provide /usr/bin/jdeps (jdeps) in auto mode\r\nupdate-alternatives: using /usr/lib/jvm/java-17-openjdk-amd64/bin/jfr to provide /usr/bin/jfr (jfr) in auto mode\r\nupdate-alternatives: using /usr/lib/jvm/java-17-openjdk-amd64/bin/jimage to provide /usr/bin/jimage (jimage) in auto mode\r\nupdate-alternatives: using /usr/lib/jvm/java-17-openjdk-amd64/bin/jinfo to provide /usr/bin/jinfo (jinfo) in auto mode\r\nupdate-alternatives: using /usr/lib/jvm/java-17-openjdk-amd64/bin/jlink to provide /usr/bin/jlink (jlink) in auto mode\r\nupdate-alternatives: using /usr/lib/jvm/java-17-openjdk-amd64/bin/jmap to provide /usr/bin/jmap (jmap) in auto mode\r\nupdate-alternatives: using /usr/lib/jvm/java-17-openjdk-amd64/bin/jmod to provide /usr/bin/jmod (jmod) in auto mode\r\nupdate-alternatives: using /usr/lib/jvm/java-17-openjdk-amd64/bin/jps to provide /usr/bin/jps (jps) in auto mode\r\nupdate-alternatives: using /usr/lib/jvm/java-17-openjdk-amd64/bin/jrunscript to provide /usr/bin/jrunscript (jrunscript) in auto mode\r\nupdate-alternatives: using /usr/lib/jvm/java-17-openjdk-amd64/bin/jshell to provide /usr/bin/jshell (jshell) in auto mode\r\nupdate-alternatives: using /usr/lib/jvm/java-17-openjdk-amd64/bin/jstack to provide /usr/bin/jstack (jstack) in auto mode\r\nupdate-alternatives: using /usr/lib/jvm/java-17-openjdk-amd64/bin/jstat to provide /usr/bin/jstat (jstat) in auto mode\r\nupdate-alternatives: using /usr/lib/jvm/java-17-openjdk-amd64/bin/jstatd to provide /usr/bin/jstatd (jstatd) in auto mode\r\nupdate-alternatives: using /usr/lib/jvm/java-17-openjdk-amd64/bin/serialver to provide /usr/bin/serialver (serialver) in auto mode\r\nupdate-alternatives: using /usr/lib/jvm/java-17-openjdk-amd64/bin/jhsdb to provide /usr/bin/jhsdb (jhsdb) in auto mode\r\nProcessing triggers for ca-certificates (20230311) ...\r\nUpdating certificates in /etc/ssl/certs...\r\n0 added, 0 removed; done.\r\nRunning hooks in /etc/ca-certificates/update.d...\r\ndone.\r\nProcessing triggers for ca-certificates-java (20230710~deb12u1) ...\r\ndone.\r\n+ update-alternatives --auto java\n+ adduser --disabled-password --comment '' build --home /build\nAdding user `build' ...\nAdding new group `build' (1000) ...\nAdding new user `build' (1000) with group `build (1000)' ...\nCreating home directory `/build' ...\nCopying files from `/etc/skel' ...\nAdding new user `build' to supplemental / extra groups `users' ...\nAdding user `build' to group `users' ...\n+ mkdir -p /opt/sdk\n+ chown build:build /opt/sdk\n+ mkdir -p /opt/sdk/cmdline-tools\n+ wget -q -O /tmp/tools.zip -- https://dl.google.com/android/repository/commandlinetools-linux-11076708_latest.zip\n+ sha256sum -c\n/tmp/tools.zip: OK\n+ unzip -q -d /opt/sdk/cmdline-tools /tmp/tools.zip\n+ mv /opt/sdk/cmdline-tools/cmdline-tools /opt/sdk/cmdline-tools/12.0\n+ rm /tmp/tools.zip\n+ export PATH=/usr/local/sbin:/usr/local/bin:/usr/sbin:/usr/bin:/sbin:/bin:/opt/sdk/cmdline-tools/12.0/bin\n+ PATH=/usr/local/sbin:/usr/local/bin:/usr/sbin:/usr/bin:/sbin:/bin:/opt/sdk/cmdline-tools/12.0/bin\n+ yes\n+ sdkmanager --sdk_root=/opt/sdk --licenses\nLoading local repository...                                                     \r[=========                              ] 25% Loading local repository...       \r[=========                              ] 25% Fetch remote repository...        \r[==========                             ] 26% Fetch remote repository...        \r[============                           ] 31% Fetch remote repository...        \r[============                           ] 32% Fetch remote repository...        \r[=============                          ] 34% Fetch remote repository...        \r[=============                          ] 35% Fetch remote repository...        \r[==============                         ] 36% Fetch remote repository...        \r[==============                         ] 37% Fetch remote repository...        \r[===============                        ] 38% Fetch remote repository...        \r[===============                        ] 39% Fetch remote repository...        \r[================                       ] 41% Fetch remote repository...        \r[================                       ] 42% Fetch remote repository...        \r[=================                      ] 43% Fetch remote repository...        \r[=================                      ] 44% Fetch remote repository...        \r[==================                     ] 45% Fetch remote repository...        \r[==================                     ] 47% Fetch remote repository...        \r[===================                    ] 48% Fetch remote repository...        \r[===================                    ] 49% Fetch remote repository...        \r[====================                   ] 50% Fetch remote repository...        \r[====================                   ] 51% Fetch remote repository...        \r[====================                   ] 53% Fetch remote repository...        \r[=====================                  ] 54% Fetch remote repository...        \r[=====================                  ] 55% Fetch remote repository...        \r[======================                 ] 56% Fetch remote repository...        \r[======================                 ] 57% Fetch remote repository...        \r[=======================                ] 58% Fetch remote repository...        \r[=======================                ] 60% Fetch remote repository...        \r[========================               ] 61% Fetch remote repository...        \r[========================               ] 62% Fetch remote repository...        \r[=========================              ] 63% Fetch remote repository...        \r[=========================              ] 64% Fetch remote repository...        \r[==========================             ] 66% Fetch remote repository...        \r[==========================             ] 67% Fetch remote repository...        \r[===========================            ] 68% Fetch remote repository...        \r[===========================            ] 69% Fetch remote repository...        \r[============================           ] 70% Fetch remote repository...        \r[============================           ] 71% Fetch remote repository...        \r[=============================          ] 73% Fetch remote repository...        \r[=============================          ] 74% Fetch remote repository...        \r[=============================          ] 75% Fetch remote repository...        \r[=============================          ] 75% Computing updates...              \r[=======================================] 100% Computing updates...             \r\n6 of 6 SDK package licenses not accepted.\nReview licenses that have not been accepted (y/N)? \n1/6: License android-googletv-license:\n---------------------------------------\nTerms and Conditions\n\nThis is the Google TV Add-on for the Android Software Development Kit License Agreement.\n\n1. Introduction\n\n1.1 The Google TV Add-on for the Android Software Development Kit (referred to in this License Agreement as the \"Google TV Add-on\" and specifically including the Android system files, packaged APIs, and Google APIs add-ons) is licensed to you subject to the terms of this License Agreement. This License Agreement forms a legally binding contract between you and Google in relation to your use of the Google TV Add-on.\n\n1.2 \"Google\" means Google Inc., a Delaware corporation with principal place of business at 1600 Amphitheatre Parkway, Mountain View, CA 94043, United States.\n\n2. Accepting this License Agreement\n\n2.1 In order to use the Google TV Add-on, you must first agree to this License Agreement. You may not use the Google TV Add-on if you do not accept this License Agreement.\n\n2.2 You can accept this License Agreement by:\n\n(A) clicking to accept or agree to this License Agreement, where this option is made available to you; or\n\n(B) by actually using the Google TV Add-on. In this case, you agree that use of the Google TV Add-on constitutes acceptance of the License Agreement from that point onwards.\n\n2.3 You may not use the Google TV Add-on and may not accept the Licensing Agreement if you are a person barred from receiving the Google TV Add-on under the laws of the United States or other countries including the country in which you are resident or from which you use the Google TV Add-on.\n\n2.4 If you are agreeing to be bound by this License Agreement on behalf of your employer or other entity, you represent and warrant that you have full legal authority to bind your employer or such entity to this License Agreement. If you do not have the requisite authority, you may not accept the Licensing Agreement or use the Google TV Add-on on behalf of your employer or other entity.\n\n3. Google TV Add-on License from Google\n\n3.1 Subject to the terms of this License Agreement, Google grants you a limited, worldwide, royalty-free, non- assignable and non-exclusive license to use the Google TV Add-on solely to develop applications to run on the Google TV platform.\n\n3.2 You agree that Google or third parties own all legal right, title and interest in and to the Google TV Add-on, including any Intellectual Property Rights that subsist in the Google TV Add-on. \"Intellectual Property Rights\" means any and all rights under patent law, copyright law, trade secret law, trademark law, and any and all other proprietary rights. Google reserves all rights not expressly granted to you.\n\n3.3 Except to the extent required by applicable third party licenses, you may not copy (except for backup purposes), modify, adapt, redistribute, decompile, reverse engineer, disassemble, or create derivative works of the Google TV Add-on or any part of the Google TV Add-on. Except to the extent required by applicable third party licenses, you may not load any part of the Google TV Add-on onto a mobile handset, television, or any other hardware device except a personal computer, combine any part of the Google TV Add-on with other software, or distribute any software or device incorporating a part of the Google TV Add-on.\n\n3.4 Use, reproduction and distribution of components of the Google TV Add-on licensed under an open source software license are governed solely by the terms of that open source software license and not this License Agreement.\n\n3.5 You agree that the form and nature of the Google TV Add-on that Google provides may change without prior notice to you and that future versions of the Google TV Add-on may be incompatible with applications developed on previous versions of the Google TV Add-on. You agree that Google may stop (permanently or temporarily) providing the Google TV Add-on (or any features within the Google TV Add-on) to you or to users generally at Google's sole discretion, without prior notice to you.\n\n3.6 Nothing in this License Agreement gives you a right to use any of Google's or it?s licensors? trade names, trademarks, service marks, logos, domain names, or other distinctive brand features.\n\n3.7 You agree that you will not remove, obscure, or alter any proprietary rights notices (including copyright and trademark notices) that may be affixed to or contained within the Google TV Add-on.\n\n4. Use of the Google TV Add-on by You\n\n4.1 Google agrees that it obtains no right, title or interest from you (or your licensors) under this License Agreement in or to any software applications that you develop using the Google TV Add-on, including any intellectual property rights that subsist in those applications.\n\n4.2 You agree to use the Google TV Add-on and write applications only for purposes that are permitted by (a) this License Agreement and (b) any applicable law, regulation or generally accepted practices or guidelines in the relevant jurisdictions (including any laws regarding the export of data or software to and from the United States or other relevant countries).\n\n4.3 You agree that if you use the Google TV Add-on to develop applications for general public users, you will protect the privacy and legal rights of those users. If the users provide you with user names, passwords, or other login information or personal information, your must make the users aware that the information will be available to your application, and you must provide legally adequate privacy notice and protection for those users. If your application stores personal or sensitive information provided by users, it must do so securely. If the user provides your application with Google Account information, your application may only use that information to access the user's Google Account when, and for the limited purposes for which, the user has given you explicit permission to do so.\n\n4.4 You agree that you will not engage in any activity with the Google TV Add-on, including the development or distribution of an application, that interferes with, disrupts, damages, or accesses in an unauthorized manner the servers, networks, or other properties or services of any third party including, but not limited to, Google, Multichannel Video Program Distributors or any mobile communications carrier.\n\n4.5 You agree that you are solely responsible for (and that Google has no responsibility to you or to any third party for) any data, content, or resources that you create, transmit or display through the Google TV platform and/or applications for the Google TV platform, and for the consequences of your actions (including any loss or damage which Google may suffer) by doing so.\n\n4.6 You agree that you are solely responsible for (and that Google has no responsibility to you or to any third party for) any breach of your obligations under this License Agreement, any applicable third party contract or Terms of Service, or any applicable law or regulation, and for the consequences (including any loss or damage which Google or any third party may suffer) of any such breach.\n\n5. Your Developer Credentials\n\n5.1 You agree that you are responsible for maintaining the confidentiality of any developer credentials that may be issued to you by Google or which you may choose yourself and that you will be solely responsible for all applications that are developed under your developer credentials.\n\n6. Privacy and Information\n\n6.1 In order to continually innovate and improve the Google TV Add-on, Google may collect certain usage statistics from the software including but not limited to a unique identifier, associated IP address, version number of the software, and information on which tools and/or services in the Google TV Add-on are being used and how they are being used. Before any of this information is collected, the Google TV Add-on will notify you and seek your consent. If you withhold consent, the information will not be collected.\n\n6.2 The data collected is examined in the aggregate to improve the Google TV Add-on and is maintained in accordance with Google's Privacy Policy.\n\n7. Third Party Applications for the Google TV Platform\n\n7.1 If you use the Google TV Add-on to run applications developed by a third party or that access data, content or resources provided by a third party, you agree that Google is not responsible for those applications, data, content, or resources. You understand that all data, content or resources which you may access through such third party applications are the sole responsibility of the person from which they originated and that Google is not liable for any loss or damage that you may experience as a result of the use or access of any of those third party applications, data, content, or resources.\n\n7.2 You should be aware the data, content, and resources presented to you through such a third party application may be protected by intellectual property rights which are owned by the providers (or by other persons or companies on their behalf). You may not modify, rent, lease, loan, sell, distribute or create derivative works based on these data, content, or resources (either in whole or in part) unless you have been specifically given permission to do so by the relevant owners.\n\n7.3 You acknowledge that your use of such third party applications, data, content, or resources may be subject to separate terms between you and the relevant third party. In that case, this License Agreement does not affect your legal relationship with these third parties.\n\n8. Using Google TV APIs\n\n8.1 If you use any Google TV API to retrieve data from Google, you acknowledge that the data (?Google TV API Content?) may be protected by intellectual property rights which are owned by Google or those parties that provide the data (or by other persons or companies on their behalf). Your use of any such API may be subject to additional Terms of Service. You may not modify, rent, lease, loan, sell, distribute or create derivative works based on this data (either in whole or in part) unless allowed by the relevant Terms of Service. Some portions of the Google TV API Content are licensed to Google by third parties, including but not limited to Tribune Media Services\n\n8.2 If you use any API to retrieve a user's data from Google, you acknowledge and agree that you shall retrieve data only with the user's explicit consent and only when, and for the limited purposes for which, the user has given you permission to do so.\n\n8.3 Except as explicitly permitted in Section 3 (Google TV Add-on License from Google), you must:\n\n(a) not modify nor format the Google TV API Content except to the extent reasonably and technically necessary to optimize the display such Google TV API Content in your application;\n\n(b) not edit the Google TV API Content in a manner that renders the Google TV API Content inaccurate of alters its inherent meaning (provided that displaying excerpts will not violate the foregoing); or\n\n(c) not create any commercial audience measurement tool or service using the Google TV API Content\n\n9. Terminating this License Agreement\n\n9.1 This License Agreement will continue to apply until terminated by either you or Google as set out below.\n\n9.2 If you want to terminate this License Agreement, you may do so by ceasing your use of the Google TV Add-on and any relevant developer credentials.\n\n9.3 Google may at any time, terminate this License Agreement with you if:\n\n(A) you have breached any provision of this License Agreement; or\n\n(B) Google is required to do so by law; or\n\n(C) the partner with whom Google offered certain parts of Google TV Add-on (such as APIs) to you has terminated its relationship with Google or ceased to offer certain parts of the Google TV Add-on to you; or\n\n(D) Google decides to no longer providing the Google TV Add-on or certain parts of the Google TV Add-on to users in the country in which you are resident or from which you use the service, or the provision of the Google TV Add-on or certain Google TV Add-on services to you by Google is, in Google's sole discretion, no longer commercially viable.\n\n9.4 When this License Agreement comes to an end, all of the legal rights, obligations and liabilities that you and Google have benefited from, been subject to (or which have accrued over time whilst this License Agreement has been in force) or which are expressed to continue indefinitely, shall be unaffected by this cessation, and the provisions of paragraph 14.7 shall continue to apply to such rights, obligations and liabilities indefinitely.\n\n10. DISCLAIMER OF WARRANTIES\n\n10.1 YOU EXPRESSLY UNDERSTAND AND AGREE THAT YOUR USE OF THE GOOGLE TV ADD-ON IS AT YOUR SOLE RISK AND THAT THE GOOGLE TV ADD-ON IS PROVIDED \"AS IS\" AND \"AS AVAILABLE\" WITHOUT WARRANTY OF ANY KIND FROM GOOGLE.\n\n10.2 YOUR USE OF THE GOOGLE TV ADD-ON AND ANY MATERIAL DOWNLOADED OR OTHERWISE OBTAINED THROUGH THE USE OF THE GOOGLE TV ADD-ON IS AT YOUR OWN DISCRETION AND RISK AND YOU ARE SOLELY RESPONSIBLE FOR ANY DAMAGE TO YOUR COMPUTER SYSTEM OR OTHER DEVICE OR LOSS OF DATA THAT RESULTS FROM SUCH USE.\n\n10.3 GOOGLE FURTHER EXPRESSLY DISCLAIMS ALL WARRANTIES AND CONDITIONS OF ANY KIND, WHETHER EXPRESS OR IMPLIED, INCLUDING, BUT NOT LIMITED TO THE IMPLIED WARRANTIES AND CONDITIONS OF MERCHANTABILITY, FITNESS FOR A PARTICULAR PURPOSE AND NON-INFRINGEMENT.\n\n11. LIMITATION OF LIABILITY\n\n11.1 YOU EXPRESSLY UNDERSTAND AND AGREE THAT GOOGLE, ITS SUBSIDIARIES AND AFFILIATES, AND ITS LICENSORS SHALL NOT BE LIABLE TO YOU UNDER ANY THEORY OF LIABILITY FOR ANY DIRECT, INDIRECT, INCIDENTAL, SPECIAL CONSEQUENTIAL OR EXEMPLARY DAMAGES THAT MAY BE INCURRED BY YOU, INCLUDING ANY LOSS OF DATA, WHETHER OR NOT GOOGLE OR ITS REPRESENTATIVES HAVE BEEN ADVISED OF OR SHOULD HAVE BEEN AWARE OF THE POSSIBILITY OF ANY SUCH LOSSES ARISING.\n\n12. Indemnification\n\n12.1 To the maximum extent permitted by law, you agree to defend, indemnify and hold harmless Google, its affiliates and their respective directors, officers, employees and agents from and against any and all claims, actions, suits or proceedings, as well as any and all losses, liabilities, damages, costs and expenses (including reasonable attorneys fees) arising out of or accruing from (a) your use of the Google TV Add-on, (b) any application you develop on the Google TV Add-on that infringes any copyright, trademark, trade secret, trade dress, patent or other intellectual property right of any person or defames any person or violates their rights of publicity or privacy, and (c) any non-compliance by you with this License Agreement.\n\n13. Changes to the License Agreement\n\n13.1 Google may make changes to the License Agreement as it distributes new versions of the Google TV Add-on.\n\n14. General Legal Terms\n\n14.1 This License Agreement constitute the whole legal agreement between you and Google and govern your use of the Google TV Add-on (excluding any services which Google may provide to you under a separate written agreement), and completely replace any prior agreements between you and Google in relation to the Google TV Add-on.\n\n14.2 You agree that if Google does not exercise or enforce any legal right or remedy which is contained in this License Agreement (or which Google has the benefit of under any applicable law), this will not be taken to be a formal waiver of Google's rights and that those rights or remedies will still be available to Google.\n\n14.3 If any court of law, having the jurisdiction to decide on this matter, rules that any provision of this License Agreement is invalid, then that provision will be removed from this License Agreement without affecting the rest of this License Agreement. The remaining provisions of this License Agreement will continue to be valid and enforceable.\n\n14.4 You acknowledge and agree that Google?s API data licensors and each member of the group of companies of which Google is the parent shall be third party beneficiaries to this License Agreement and that such other companies shall be entitled to directly enforce, and rely upon, any provision of this License Agreement that confers a benefit on (or rights in favor of) them. Other than this, no other person or company shall be third party beneficiaries to this License Agreement.\n\n14.5 EXPORT RESTRICTIONS. THE GOOGLE TV ADD-ON IS SUBJECT TO UNITED STATES EXPORT LAWS AND REGULATIONS. YOU MUST COMPLY WITH ALL DOMESTIC AND INTERNATIONAL EXPORT LAWS AND REGULATIONS THAT APPLY TO THE GOOGLE TV ADD-ON. THESE LAWS INCLUDE RESTRICTIONS ON DESTINATIONS, END USERS AND END USE.\n\n14.6 The rights granted in this License Agreement may not be assigned or transferred by either you or Google without the prior written approval of the other party. Neither you nor Google shall be permitted to delegate their responsibilities or obligations under this License Agreement without the prior written approval of the other party.\n\n14.7 This License Agreement, and your relationship with Google under this License Agreement, shall be governed by the laws of the State of California without regard to its conflict of laws provisions. You and Google agree to submit to the exclusive jurisdiction of the courts located within the county of Santa Clara, California to resolve any legal matter arising from this License Agreement. Notwithstanding this, you agree that Google shall still be allowed to apply for injunctive remedies (or an equivalent type of urgent legal relief) in any jurisdiction.\n\n\nAugust 15, 2011\n---------------------------------------\nAccept? (y/N): \n2/6: License android-sdk-arm-dbt-license:\n---------------------------------------\nTerms and Conditions\n\nThis is the Android Software Development Kit License Agreement\n\n1. Introduction\n\n1.1 The Android Software Development Kit (referred to in the License Agreement as the \"SDK\" and specifically including the Android system files, packaged APIs, and Google APIs add-ons) is licensed to you subject to the terms of the License Agreement. The License Agreement forms a legally binding contract between you and Google in relation to your use of the SDK.\n\n1.2 \"Android\" means the Android software stack for devices, as made available under the Android Open Source Project, which is located at the following URL: http://source.android.com/, as updated from time to time.\n\n1.3 A \"compatible implementation\" means any Android device that (i) complies with the Android Compatibility Definition document, which can be found at the Android compatibility website (http://source.android.com/compatibility) and which may be updated from time to time; and (ii) successfully passes the Android Compatibility Test Suite (CTS).\n\n1.4 \"Google\" means Google Inc., a Delaware corporation with principal place of business at 1600 Amphitheatre Parkway, Mountain View, CA 94043, United States.\n\n\n2. Accepting the License Agreement\n\n2.1 In order to use the SDK, you must first agree to the License Agreement. You may not use the SDK if you do not accept the License Agreement.\n\n2.2 By clicking to accept, you hereby agree to the terms of the License Agreement.\n\n2.3 You may not use the SDK and may not accept the License Agreement if you are a person barred from receiving the SDK under the laws of the United States or other countries, including the country in which you are resident or from which you use the SDK.\n\n2.4 If you are agreeing to be bound by the License Agreement on behalf of your employer or other entity, you represent and warrant that you have full legal authority to bind your employer or such entity to the License Agreement. If you do not have the requisite authority, you may not accept the License Agreement or use the SDK on behalf of your employer or other entity.\n\n\n3. SDK License from Google\n\n3.1 Subject to the terms of the License Agreement, Google grants you a limited, worldwide, royalty-free, non-assignable, non-exclusive, and non-sublicensable license to use the SDK solely to develop applications for compatible implementations of Android.\n\n3.2 You may not use this SDK to develop applications for other platforms (including non-compatible implementations of Android) or to develop another SDK. You are of course free to develop applications for other platforms, including non-compatible implementations of Android, provided that this SDK is not used for that purpose.\n\n3.3 You agree that Google or third parties own all legal right, title and interest in and to the SDK, including any Intellectual Property Rights that subsist in the SDK. \"Intellectual Property Rights\" means any and all rights under patent law, copyright law, trade secret law, trademark law, and any and all other proprietary rights. Google reserves all rights not expressly granted to you.\n\n3.4 You may not use the SDK for any purpose not expressly permitted by the License Agreement. Except to the extent required by applicable third party licenses, you may not copy (except for backup purposes), modify, adapt, redistribute, decompile, reverse engineer, disassemble, or create derivative works of the SDK or any part of the SDK.\n\n3.5 Use, reproduction and distribution of components of the SDK licensed under an open source software license are governed solely by the terms of that open source software license and not the License Agreement.\n\n3.6 You agree that the form and nature of the SDK that Google provides may change without prior notice to you and that future versions of the SDK may be incompatible with applications developed on previous versions of the SDK. You agree that Google may stop (permanently or temporarily) providing the SDK (or any features within the SDK) to you or to users generally at Google's sole discretion, without prior notice to you.\n\n3.7 Nothing in the License Agreement gives you a right to use any of Google's trade names, trademarks, service marks, logos, domain names, or other distinctive brand features.\n\n3.8 You agree that you will not remove, obscure, or alter any proprietary rights notices (including copyright and trademark notices) that may be affixed to or contained within the SDK.\n\n\n4. Use of the SDK by You\n\n4.1 Google agrees that it obtains no right, title or interest from you (or your licensors) under the License Agreement in or to any software applications that you develop using the SDK, including any intellectual property rights that subsist in those applications.\n\n4.2 You agree to use the SDK and write applications only for purposes that are permitted by (a) the License Agreement and (b) any applicable law, regulation or generally accepted practices or guidelines in the relevant jurisdictions (including any laws regarding the export of data or software to and from the United States or other relevant countries).\n\n4.3 You agree that if you use the SDK to develop applications for general public users, you will protect the privacy and legal rights of those users. If the users provide you with user names, passwords, or other login information or personal information, you must make the users aware that the information will be available to your application, and you must provide legally adequate privacy notice and protection for those users. If your application stores personal or sensitive information provided by users, it must do so securely. If the user provides your application with Google Account information, your application may only use that information to access the user's Google Account when, and for the limited purposes for which, the user has given you permission to do so.\n\n4.4 You agree that you will not engage in any activity with the SDK, including the development or distribution of an application, that interferes with, disrupts, damages, or accesses in an unauthorized manner the servers, networks, or other properties or services of any third party including, but not limited to, Google or any mobile communications carrier.\n\n4.5 You agree that you are solely responsible for (and that Google has no responsibility to you or to any third party for) any data, content, or resources that you create, transmit or display through Android and/or applications for Android, and for the consequences of your actions (including any loss or damage which Google may suffer) by doing so.\n\n4.6 You agree that you are solely responsible for (and that Google has no responsibility to you or to any third party for) any breach of your obligations under the License Agreement, any applicable third party contract or Terms of Service, or any applicable law or regulation, and for the consequences (including any loss or damage which Google or any third party may suffer) of any such breach.\n\n4.7 This software enables the execution of intellectual property owned by Arm Limited. You agree that your use of the software, that allows execution of ARM Instruction Set Architecture (?ISA?) compliant executables for application development and debug only on x86 desktop, laptop, customer on-premise servers, and customer-procured cloud-based environments.\n\n5. Your Developer Credentials\n\n5.1 You agree that you are responsible for maintaining the confidentiality of any developer credentials that may be issued to you by Google or which you may choose yourself and that you will be solely responsible for all applications that are developed under your developer credentials.\n\n6. Privacy and Information\n\n6.1 In order to continually innovate and improve the SDK, Google may collect certain usage statistics from the software including but not limited to a unique identifier, associated IP address, version number of the software, and information on which tools and/or services in the SDK are being used and how they are being used. Before any of this information is collected, the SDK will notify you and seek your consent. If you withhold consent, the information will not be collected.\n\n6.2 The data collected is examined in the aggregate to improve the SDK and is maintained in accordance with Google's Privacy Policy.\n\n\n7. Third Party Applications\n\n7.1 If you use the SDK to run applications developed by a third party or that access data, content or resources provided by a third party, you agree that Google is not responsible for those applications, data, content, or resources. You understand that all data, content or resources which you may access through such third party applications are the sole responsibility of the person from which they originated and that Google is not liable for any loss or damage that you may experience as a result of the use or access of any of those third party applications, data, content, or resources.\n\n7.2 You should be aware the data, content, and resources presented to you through such a third party application may be protected by intellectual property rights which are owned by the providers (or by other persons or companies on their behalf). You may not modify, rent, lease, loan, sell, distribute or create derivative works based on these data, content, or resources (either in whole or in part) unless you have been specifically given permission to do so by the relevant owners.\n\n7.3 You acknowledge that your use of such third party applications, data, content, or resources may be subject to separate terms between you and the relevant third party. In that case, the License Agreement does not affect your legal relationship with these third parties.\n\n\n8. Using Android APIs\n\n8.1 Google Data APIs\n\n8.1.1 If you use any API to retrieve data from Google, you acknowledge that the data may be protected by intellectual property rights which are owned by Google or those parties that provide the data (or by other persons or companies on their behalf). Your use of any such API may be subject to additional Terms of Service. You may not modify, rent, lease, loan, sell, distribute or create derivative works based on this data (either in whole or in part) unless allowed by the relevant Terms of Service.\n\n8.1.2 If you use any API to retrieve a user's data from Google, you acknowledge and agree that you shall retrieve data only with the user's explicit consent and only when, and for the limited purposes for which, the user has given you permission to do so. If you use the Android Recognition Service API, documented at the following URL: https://developer.android.com/reference/android/speech/RecognitionService, as updated from time to time, you acknowledge that the use of the API is subject to the Data Processing Addendum for Products where Google is a Data Processor, which is located at the following URL: https://privacy.google.com/businesses/gdprprocessorterms/, as updated from time to time. By clicking to accept, you hereby agree to the terms of the Data Processing Addendum for Products where Google is a Data Processor.\n\n\n9. Terminating the License Agreement\n\n9.1 The License Agreement will continue to apply until terminated by either you or Google as set out below.\n\n9.2 If you want to terminate the License Agreement, you may do so by ceasing your use of the SDK and any relevant developer credentials.\n\n9.3 Google may at any time, terminate the License Agreement with you if: (A) you have breached any provision of the License Agreement; or (B) Google is required to do so by law; or (C) the partner with whom Google offered certain parts of SDK (such as APIs) to you has terminated its relationship with Google or ceased to offer certain parts of the SDK to you; or (D) Google decides to no longer provide the SDK or certain parts of the SDK to users in the country in which you are resident or from which you use the service, or the provision of the SDK or certain SDK services to you by Google is, in Google's sole discretion, no longer commercially viable.\n\n9.4 When the License Agreement comes to an end, all of the legal rights, obligations and liabilities that you and Google have benefited from, been subject to (or which have accrued over time whilst the License Agreement has been in force) or which are expressed to continue indefinitely, shall be unaffected by this cessation, and the provisions of paragraph 14.7 shall continue to apply to such rights, obligations and liabilities indefinitely.\n\n\n10. DISCLAIMER OF WARRANTIES\n\n10.1 YOU EXPRESSLY UNDERSTAND AND AGREE THAT YOUR USE OF THE SDK IS AT YOUR SOLE RISK AND THAT THE SDK IS PROVIDED \"AS IS\" AND \"AS AVAILABLE\" WITHOUT WARRANTY OF ANY KIND FROM GOOGLE.\n\n10.2 YOUR USE OF THE SDK AND ANY MATERIAL DOWNLOADED OR OTHERWISE OBTAINED THROUGH THE USE OF THE SDK IS AT YOUR OWN DISCRETION AND RISK AND YOU ARE SOLELY RESPONSIBLE FOR ANY DAMAGE TO YOUR COMPUTER SYSTEM OR OTHER DEVICE OR LOSS OF DATA THAT RESULTS FROM SUCH USE.\n\n10.3 GOOGLE FURTHER EXPRESSLY DISCLAIMS ALL WARRANTIES AND CONDITIONS OF ANY KIND, WHETHER EXPRESS OR IMPLIED, INCLUDING, BUT NOT LIMITED TO THE IMPLIED WARRANTIES AND CONDITIONS OF MERCHANTABILITY, FITNESS FOR A PARTICULAR PURPOSE AND NON-INFRINGEMENT.\n\n\n11. LIMITATION OF LIABILITY\n\n11.1 YOU EXPRESSLY UNDERSTAND AND AGREE THAT GOOGLE, ITS SUBSIDIARIES AND AFFILIATES, AND ITS LICENSORS SHALL NOT BE LIABLE TO YOU UNDER ANY THEORY OF LIABILITY FOR ANY DIRECT, INDIRECT, INCIDENTAL, SPECIAL, CONSEQUENTIAL OR EXEMPLARY DAMAGES THAT MAY BE INCURRED BY YOU, INCLUDING ANY LOSS OF DATA, WHETHER OR NOT GOOGLE OR ITS REPRESENTATIVES HAVE BEEN ADVISED OF OR SHOULD HAVE BEEN AWARE OF THE POSSIBILITY OF ANY SUCH LOSSES ARISING.\n\n\n12. Indemnification\n\n12.1 To the maximum extent permitted by law, you agree to defend, indemnify and hold harmless Google, its affiliates and their respective directors, officers, employees and agents from and against any and all claims, actions, suits or proceedings, as well as any and all losses, liabilities, damages, costs and expenses (including reasonable attorneys fees) arising out of or accruing from (a) your use of the SDK, (b) any application you develop on the SDK that infringes any copyright, trademark, trade secret, trade dress, patent or other intellectual property right of any person or defames any person or violates their rights of publicity or privacy, and (c) any non-compliance by you with the License Agreement.\n\n\n13. Changes to the License Agreement\n\n13.1 Google may make changes to the License Agreement as it distributes new versions of the SDK. When these changes are made, Google will make a new version of the License Agreement available on the website where the SDK is made available.\n\n\n14. General Legal Terms\n\n14.1 The License Agreement constitutes the whole legal agreement between you and Google and governs your use of the SDK (excluding any services which Google may provide to you under a separate written agreement), and completely replaces any prior agreements between you and Google in relation to the SDK.\n\n14.2 You agree that if Google does not exercise or enforce any legal right or remedy which is contained in the License Agreement (or which Google has the benefit of under any applicable law), this will not be taken to be a formal waiver of Google's rights and that those rights or remedies will still be available to Google.\n\n14.3 If any court of law, having the jurisdiction to decide on this matter, rules that any provision of the License Agreement is invalid, then that provision will be removed from the License Agreement without affecting the rest of the License Agreement. The remaining provisions of the License Agreement will continue to be valid and enforceable.\n\n14.4 You acknowledge and agree that each member of the group of companies of which Google is the parent shall be third party beneficiaries to the License Agreement and that such other companies shall be entitled to directly enforce, and rely upon, any provision of the License Agreement that confers a benefit on (or rights in favor of) them. Other than this, no other person or company shall be third party beneficiaries to the License Agreement.\n\n14.5 EXPORT RESTRICTIONS. THE SDK IS SUBJECT TO UNITED STATES EXPORT LAWS AND REGULATIONS. YOU MUST COMPLY WITH ALL DOMESTIC AND INTERNATIONAL EXPORT LAWS AND REGULATIONS THAT APPLY TO THE SDK. THESE LAWS INCLUDE RESTRICTIONS ON DESTINATIONS, END USERS AND END USE.\n\n14.6 The rights granted in the License Agreement may not be assigned or transferred by either you or Google without the prior written approval of the other party. Neither you nor Google shall be permitted to delegate their responsibilities or obligations under the License Agreement without the prior written approval of the other party.\n\n14.7 The License Agreement, and your relationship with Google under the License Agreement, shall be governed by the laws of the State of California without regard to its conflict of laws provisions. You and Google agree to submit to the exclusive jurisdiction of the courts located within the county of Santa Clara, California to resolve any legal matter arising from the License Agreement. Notwithstanding this, you agree that Google shall still be allowed to apply for injunctive remedies (or an equivalent type of urgent legal relief) in any jurisdiction.\n\n\nJanuary 16, 2019\n---------------------------------------\nAccept? (y/N): \n3/6: License android-sdk-license:\n---------------------------------------\nTerms and Conditions\n\nThis is the Android Software Development Kit License Agreement\n\n1. Introduction\n\n1.1 The Android Software Development Kit (referred to in the License Agreement as the \"SDK\" and specifically including the Android system files, packaged APIs, and Google APIs add-ons) is licensed to you subject to the terms of the License Agreement. The License Agreement forms a legally binding contract between you and Google in relation to your use of the SDK.\n\n1.2 \"Android\" means the Android software stack for devices, as made available under the Android Open Source Project, which is located at the following URL: http://source.android.com/, as updated from time to time.\n\n1.3 A \"compatible implementation\" means any Android device that (i) complies with the Android Compatibility Definition document, which can be found at the Android compatibility website (http://source.android.com/compatibility) and which may be updated from time to time; and (ii) successfully passes the Android Compatibility Test Suite (CTS).\n\n1.4 \"Google\" means Google Inc., a Delaware corporation with principal place of business at 1600 Amphitheatre Parkway, Mountain View, CA 94043, United States.\n\n\n2. Accepting the License Agreement\n\n2.1 In order to use the SDK, you must first agree to the License Agreement. You may not use the SDK if you do not accept the License Agreement.\n\n2.2 By clicking to accept, you hereby agree to the terms of the License Agreement.\n\n2.3 You may not use the SDK and may not accept the License Agreement if you are a person barred from receiving the SDK under the laws of the United States or other countries, including the country in which you are resident or from which you use the SDK.\n\n2.4 If you are agreeing to be bound by the License Agreement on behalf of your employer or other entity, you represent and warrant that you have full legal authority to bind your employer or such entity to the License Agreement. If you do not have the requisite authority, you may not accept the License Agreement or use the SDK on behalf of your employer or other entity.\n\n\n3. SDK License from Google\n\n3.1 Subject to the terms of the License Agreement, Google grants you a limited, worldwide, royalty-free, non-assignable, non-exclusive, and non-sublicensable license to use the SDK solely to develop applications for compatible implementations of Android.\n\n3.2 You may not use this SDK to develop applications for other platforms (including non-compatible implementations of Android) or to develop another SDK. You are of course free to develop applications for other platforms, including non-compatible implementations of Android, provided that this SDK is not used for that purpose.\n\n3.3 You agree that Google or third parties own all legal right, title and interest in and to the SDK, including any Intellectual Property Rights that subsist in the SDK. \"Intellectual Property Rights\" means any and all rights under patent law, copyright law, trade secret law, trademark law, and any and all other proprietary rights. Google reserves all rights not expressly granted to you.\n\n3.4 You may not use the SDK for any purpose not expressly permitted by the License Agreement. Except to the extent required by applicable third party licenses, you may not copy (except for backup purposes), modify, adapt, redistribute, decompile, reverse engineer, disassemble, or create derivative works of the SDK or any part of the SDK.\n\n3.5 Use, reproduction and distribution of components of the SDK licensed under an open source software license are governed solely by the terms of that open source software license and not the License Agreement.\n\n3.6 You agree that the form and nature of the SDK that Google provides may change without prior notice to you and that future versions of the SDK may be incompatible with applications developed on previous versions of the SDK. You agree that Google may stop (permanently or temporarily) providing the SDK (or any features within the SDK) to you or to users generally at Google's sole discretion, without prior notice to you.\n\n3.7 Nothing in the License Agreement gives you a right to use any of Google's trade names, trademarks, service marks, logos, domain names, or other distinctive brand features.\n\n3.8 You agree that you will not remove, obscure, or alter any proprietary rights notices (including copyright and trademark notices) that may be affixed to or contained within the SDK.\n\n\n4. Use of the SDK by You\n\n4.1 Google agrees that it obtains no right, title or interest from you (or your licensors) under the License Agreement in or to any software applications that you develop using the SDK, including any intellectual property rights that subsist in those applications.\n\n4.2 You agree to use the SDK and write applications only for purposes that are permitted by (a) the License Agreement and (b) any applicable law, regulation or generally accepted practices or guidelines in the relevant jurisdictions (including any laws regarding the export of data or software to and from the United States or other relevant countries).\n\n4.3 You agree that if you use the SDK to develop applications for general public users, you will protect the privacy and legal rights of those users. If the users provide you with user names, passwords, or other login information or personal information, you must make the users aware that the information will be available to your application, and you must provide legally adequate privacy notice and protection for those users. If your application stores personal or sensitive information provided by users, it must do so securely. If the user provides your application with Google Account information, your application may only use that information to access the user's Google Account when, and for the limited purposes for which, the user has given you permission to do so.\n\n4.4 You agree that you will not engage in any activity with the SDK, including the development or distribution of an application, that interferes with, disrupts, damages, or accesses in an unauthorized manner the servers, networks, or other properties or services of any third party including, but not limited to, Google or any mobile communications carrier.\n\n4.5 You agree that you are solely responsible for (and that Google has no responsibility to you or to any third party for) any data, content, or resources that you create, transmit or display through Android and/or applications for Android, and for the consequences of your actions (including any loss or damage which Google may suffer) by doing so.\n\n4.6 You agree that you are solely responsible for (and that Google has no responsibility to you or to any third party for) any breach of your obligations under the License Agreement, any applicable third party contract or Terms of Service, or any applicable law or regulation, and for the consequences (including any loss or damage which Google or any third party may suffer) of any such breach.\n\n5. Your Developer Credentials\n\n5.1 You agree that you are responsible for maintaining the confidentiality of any developer credentials that may be issued to you by Google or which you may choose yourself and that you will be solely responsible for all applications that are developed under your developer credentials.\n\n6. Privacy and Information\n\n6.1 In order to continually innovate and improve the SDK, Google may collect certain usage statistics from the software including but not limited to a unique identifier, associated IP address, version number of the software, and information on which tools and/or services in the SDK are being used and how they are being used. Before any of this information is collected, the SDK will notify you and seek your consent. If you withhold consent, the information will not be collected.\n\n6.2 The data collected is examined in the aggregate to improve the SDK and is maintained in accordance with Google's Privacy Policy.\n\n\n7. Third Party Applications\n\n7.1 If you use the SDK to run applications developed by a third party or that access data, content or resources provided by a third party, you agree that Google is not responsible for those applications, data, content, or resources. You understand that all data, content or resources which you may access through such third party applications are the sole responsibility of the person from which they originated and that Google is not liable for any loss or damage that you may experience as a result of the use or access of any of those third party applications, data, content, or resources.\n\n7.2 You should be aware the data, content, and resources presented to you through such a third party application may be protected by intellectual property rights which are owned by the providers (or by other persons or companies on their behalf). You may not modify, rent, lease, loan, sell, distribute or create derivative works based on these data, content, or resources (either in whole or in part) unless you have been specifically given permission to do so by the relevant owners.\n\n7.3 You acknowledge that your use of such third party applications, data, content, or resources may be subject to separate terms between you and the relevant third party. In that case, the License Agreement does not affect your legal relationship with these third parties.\n\n\n8. Using Android APIs\n\n8.1 Google Data APIs\n\n8.1.1 If you use any API to retrieve data from Google, you acknowledge that the data may be protected by intellectual property rights which are owned by Google or those parties that provide the data (or by other persons or companies on their behalf). Your use of any such API may be subject to additional Terms of Service. You may not modify, rent, lease, loan, sell, distribute or create derivative works based on this data (either in whole or in part) unless allowed by the relevant Terms of Service.\n\n8.1.2 If you use any API to retrieve a user's data from Google, you acknowledge and agree that you shall retrieve data only with the user's explicit consent and only when, and for the limited purposes for which, the user has given you permission to do so. If you use the Android Recognition Service API, documented at the following URL: https://developer.android.com/reference/android/speech/RecognitionService, as updated from time to time, you acknowledge that the use of the API is subject to the Data Processing Addendum for Products where Google is a Data Processor, which is located at the following URL: https://privacy.google.com/businesses/gdprprocessorterms/, as updated from time to time. By clicking to accept, you hereby agree to the terms of the Data Processing Addendum for Products where Google is a Data Processor.\n\n\n9. Terminating the License Agreement\n\n9.1 The License Agreement will continue to apply until terminated by either you or Google as set out below.\n\n9.2 If you want to terminate the License Agreement, you may do so by ceasing your use of the SDK and any relevant developer credentials.\n\n9.3 Google may at any time, terminate the License Agreement with you if: (A) you have breached any provision of the License Agreement; or (B) Google is required to do so by law; or (C) the partner with whom Google offered certain parts of SDK (such as APIs) to you has terminated its relationship with Google or ceased to offer certain parts of the SDK to you; or (D) Google decides to no longer provide the SDK or certain parts of the SDK to users in the country in which you are resident or from which you use the service, or the provision of the SDK or certain SDK services to you by Google is, in Google's sole discretion, no longer commercially viable.\n\n9.4 When the License Agreement comes to an end, all of the legal rights, obligations and liabilities that you and Google have benefited from, been subject to (or which have accrued over time whilst the License Agreement has been in force) or which are expressed to continue indefinitely, shall be unaffected by this cessation, and the provisions of paragraph 14.7 shall continue to apply to such rights, obligations and liabilities indefinitely.\n\n\n10. DISCLAIMER OF WARRANTIES\n\n10.1 YOU EXPRESSLY UNDERSTAND AND AGREE THAT YOUR USE OF THE SDK IS AT YOUR SOLE RISK AND THAT THE SDK IS PROVIDED \"AS IS\" AND \"AS AVAILABLE\" WITHOUT WARRANTY OF ANY KIND FROM GOOGLE.\n\n10.2 YOUR USE OF THE SDK AND ANY MATERIAL DOWNLOADED OR OTHERWISE OBTAINED THROUGH THE USE OF THE SDK IS AT YOUR OWN DISCRETION AND RISK AND YOU ARE SOLELY RESPONSIBLE FOR ANY DAMAGE TO YOUR COMPUTER SYSTEM OR OTHER DEVICE OR LOSS OF DATA THAT RESULTS FROM SUCH USE.\n\n10.3 GOOGLE FURTHER EXPRESSLY DISCLAIMS ALL WARRANTIES AND CONDITIONS OF ANY KIND, WHETHER EXPRESS OR IMPLIED, INCLUDING, BUT NOT LIMITED TO THE IMPLIED WARRANTIES AND CONDITIONS OF MERCHANTABILITY, FITNESS FOR A PARTICULAR PURPOSE AND NON-INFRINGEMENT.\n\n\n11. LIMITATION OF LIABILITY\n\n11.1 YOU EXPRESSLY UNDERSTAND AND AGREE THAT GOOGLE, ITS SUBSIDIARIES AND AFFILIATES, AND ITS LICENSORS SHALL NOT BE LIABLE TO YOU UNDER ANY THEORY OF LIABILITY FOR ANY DIRECT, INDIRECT, INCIDENTAL, SPECIAL, CONSEQUENTIAL OR EXEMPLARY DAMAGES THAT MAY BE INCURRED BY YOU, INCLUDING ANY LOSS OF DATA, WHETHER OR NOT GOOGLE OR ITS REPRESENTATIVES HAVE BEEN ADVISED OF OR SHOULD HAVE BEEN AWARE OF THE POSSIBILITY OF ANY SUCH LOSSES ARISING.\n\n\n12. Indemnification\n\n12.1 To the maximum extent permitted by law, you agree to defend, indemnify and hold harmless Google, its affiliates and their respective directors, officers, employees and agents from and against any and all claims, actions, suits or proceedings, as well as any and all losses, liabilities, damages, costs and expenses (including reasonable attorneys fees) arising out of or accruing from (a) your use of the SDK, (b) any application you develop on the SDK that infringes any copyright, trademark, trade secret, trade dress, patent or other intellectual property right of any person or defames any person or violates their rights of publicity or privacy, and (c) any non-compliance by you with the License Agreement.\n\n\n13. Changes to the License Agreement\n\n13.1 Google may make changes to the License Agreement as it distributes new versions of the SDK. When these changes are made, Google will make a new version of the License Agreement available on the website where the SDK is made available.\n\n\n14. General Legal Terms\n\n14.1 The License Agreement constitutes the whole legal agreement between you and Google and governs your use of the SDK (excluding any services which Google may provide to you under a separate written agreement), and completely replaces any prior agreements between you and Google in relation to the SDK.\n\n14.2 You agree that if Google does not exercise or enforce any legal right or remedy which is contained in the License Agreement (or which Google has the benefit of under any applicable law), this will not be taken to be a formal waiver of Google's rights and that those rights or remedies will still be available to Google.\n\n14.3 If any court of law, having the jurisdiction to decide on this matter, rules that any provision of the License Agreement is invalid, then that provision will be removed from the License Agreement without affecting the rest of the License Agreement. The remaining provisions of the License Agreement will continue to be valid and enforceable.\n\n14.4 You acknowledge and agree that each member of the group of companies of which Google is the parent shall be third party beneficiaries to the License Agreement and that such other companies shall be entitled to directly enforce, and rely upon, any provision of the License Agreement that confers a benefit on (or rights in favor of) them. Other than this, no other person or company shall be third party beneficiaries to the License Agreement.\n\n14.5 EXPORT RESTRICTIONS. THE SDK IS SUBJECT TO UNITED STATES EXPORT LAWS AND REGULATIONS. YOU MUST COMPLY WITH ALL DOMESTIC AND INTERNATIONAL EXPORT LAWS AND REGULATIONS THAT APPLY TO THE SDK. THESE LAWS INCLUDE RESTRICTIONS ON DESTINATIONS, END USERS AND END USE.\n\n14.6 The rights granted in the License Agreement may not be assigned or transferred by either you or Google without the prior written approval of the other party. Neither you nor Google shall be permitted to delegate their responsibilities or obligations under the License Agreement without the prior written approval of the other party.\n\n14.7 The License Agreement, and your relationship with Google under the License Agreement, shall be governed by the laws of the State of California without regard to its conflict of laws provisions. You and Google agree to submit to the exclusive jurisdiction of the courts located within the county of Santa Clara, California to resolve any legal matter arising from the License Agreement. Notwithstanding this, you agree that Google shall still be allowed to apply for injunctive remedies (or an equivalent type of urgent legal relief) in any jurisdiction.\n\n\nJanuary 16, 2019\n---------------------------------------\nAccept? (y/N): \n4/6: License android-sdk-preview-license:\n---------------------------------------\nTo get started with the Android SDK Preview, you must agree to the following terms and conditions. As described below, please note that this is a preview version of the Android SDK, subject to change, that you use at your own risk. The Android SDK Preview is not a stable release, and may contain errors and defects that can result in serious damage to your computer systems, devices and data.\n\nThis is the Android SDK Preview License Agreement (the \"License Agreement\").\n\n1. Introduction\n\n1.1 The Android SDK Preview (referred to in the License Agreement as the ?Preview? and specifically including the Android system files, packaged APIs, and Preview library files, if and when they are made available) is licensed to you subject to the terms of the License Agreement. The License Agreement forms a legally binding contract between you and Google in relation to your use of the Preview.\n\n1.2 \"Android\" means the Android software stack for devices, as made available under the Android Open Source Project, which is located at the following URL: http://source.android.com/, as updated from time to time.\n\n1.3 \"Google\" means Google Inc., a Delaware corporation with principal place of business at 1600 Amphitheatre Parkway, Mountain View, CA 94043, United States.\n\n2. Accepting the License Agreement\n\n2.1 In order to use the Preview, you must first agree to the License Agreement. You may not use the Preview if you do not accept the License Agreement.\n\n2.2 By clicking to accept and/or using the Preview, you hereby agree to the terms of the License Agreement.\n\n2.3 You may not use the Preview and may not accept the License Agreement if you are a person barred from receiving the Preview under the laws of the United States or other countries including the country in which you are resident or from which you use the Preview.\n\n2.4 If you will use the Preview internally within your company or organization you agree to be bound by the License Agreement on behalf of your employer or other entity, and you represent and warrant that you have full legal authority to bind your employer or such entity to the License Agreement. If you do not have the requisite authority, you may not accept the License Agreement or use the Preview on behalf of your employer or other entity.\n\n3. Preview License from Google\n\n3.1 Subject to the terms of the License Agreement, Google grants you a royalty-free, non-assignable, non-exclusive, non-sublicensable, limited, revocable license to use the Preview, personally or internally within your company or organization, solely to develop applications to run on the Android platform.\n\n3.2 You agree that Google or third parties owns all legal right, title and interest in and to the Preview, including any Intellectual Property Rights that subsist in the Preview. \"Intellectual Property Rights\" means any and all rights under patent law, copyright law, trade secret law, trademark law, and any and all other proprietary rights. Google reserves all rights not expressly granted to you.\n\n3.3 You may not use the Preview for any purpose not expressly permitted by the License Agreement. Except to the extent required by applicable third party licenses, you may not: (a) copy (except for backup purposes), modify, adapt, redistribute, decompile, reverse engineer, disassemble, or create derivative works of the Preview or any part of the Preview; or (b) load any part of the Preview onto a mobile handset or any other hardware device except a personal computer, combine any part of the Preview with other software, or distribute any software or device incorporating a part of the Preview.\n\n3.4 You agree that you will not take any actions that may cause or result in the fragmentation of Android, including but not limited to distributing, participating in the creation of, or promoting in any way a software development kit derived from the Preview.\n\n3.5 Use, reproduction and distribution of components of the Preview licensed under an open source software license are governed solely by the terms of that open source software license and not the License Agreement. You agree to remain a licensee in good standing in regard to such open source software licenses under all the rights granted and to refrain from any actions that may terminate, suspend, or breach such rights.\n\n3.6 You agree that the form and nature of the Preview that Google provides may change without prior notice to you and that future versions of the Preview may be incompatible with applications developed on previous versions of the Preview. You agree that Google may stop (permanently or temporarily) providing the Preview (or any features within the Preview) to you or to users generally at Google's sole discretion, without prior notice to you.\n\n3.7 Nothing in the License Agreement gives you a right to use any of Google's trade names, trademarks, service marks, logos, domain names, or other distinctive brand features.\n\n3.8 You agree that you will not remove, obscure, or alter any proprietary rights notices (including copyright and trademark notices) that may be affixed to or contained within the Preview.\n\n4. Use of the Preview by You\n\n4.1 Google agrees that nothing in the License Agreement gives Google any right, title or interest from you (or your licensors) under the License Agreement in or to any software applications that you develop using the Preview, including any intellectual property rights that subsist in those applications.\n\n4.2 You agree to use the Preview and write applications only for purposes that are permitted by (a) the License Agreement, and (b) any applicable law, regulation or generally accepted practices or guidelines in the relevant jurisdictions (including any laws regarding the export of data or software to and from the United States or other relevant countries).\n\n4.3 You agree that if you use the Preview to develop applications, you will protect the privacy and legal rights of users. If users provide you with user names, passwords, or other login information or personal information, you must make the users aware that the information will be available to your application, and you must provide legally adequate privacy notice and protection for those users. If your application stores personal or sensitive information provided by users, it must do so securely. If users provide you with Google Account information, your application may only use that information to access the user's Google Account when, and for the limited purposes for which, each user has given you permission to do so.\n\n4.4 You agree that you will not engage in any activity with the Preview, including the development or distribution of an application, that interferes with, disrupts, damages, or accesses in an unauthorized manner the servers, networks, or other properties or services of Google or any third party.\n\n4.5 You agree that you are solely responsible for (and that Google has no responsibility to you or to any third party for) any data, content, or resources that you create, transmit or display through Android and/or applications for Android, and for the consequences of your actions (including any loss or damage which Google may suffer) by doing so.\n\n4.6 You agree that you are solely responsible for (and that Google has no responsibility to you or to any third party for) any breach of your obligations under the License Agreement, any applicable third party contract or Terms of Service, or any applicable law or regulation, and for the consequences (including any loss or damage which Google or any third party may suffer) of any such breach.\n\n4.7 The Preview is in development, and your testing and feedback are an important part of the development process. By using the Preview, you acknowledge that implementation of some features are still under development and that you should not rely on the Preview having the full functionality of a stable release. You agree not to publicly distribute or ship any application using this Preview as this Preview will no longer be supported after the official Android SDK is released.\n\n5. Your Developer Credentials\n\n5.1 You agree that you are responsible for maintaining the confidentiality of any developer credentials that may be issued to you by Google or which you may choose yourself and that you will be solely responsible for all applications that are developed under your developer credentials.\n\n6. Privacy and Information\n\n6.1 In order to continually innovate and improve the Preview, Google may collect certain usage statistics from the software including but not limited to a unique identifier, associated IP address, version number of the software, and information on which tools and/or services in the Preview are being used and how they are being used. Before any of this information is collected, the Preview will notify you and seek your consent. If you withhold consent, the information will not be collected.\n\n6.2 The data collected is examined in the aggregate to improve the Preview and is maintained in accordance with Google's Privacy Policy located at http://www.google.com/policies/privacy/.\n\n7. Third Party Applications\n\n7.1 If you use the Preview to run applications developed by a third party or that access data, content or resources provided by a third party, you agree that Google is not responsible for those applications, data, content, or resources. You understand that all data, content or resources which you may access through such third party applications are the sole responsibility of the person from which they originated and that Google is not liable for any loss or damage that you may experience as a result of the use or access of any of those third party applications, data, content, or resources.\n\n7.2 You should be aware the data, content, and resources presented to you through such a third party application may be protected by intellectual property rights which are owned by the providers (or by other persons or companies on their behalf). You may not modify, rent, lease, loan, sell, distribute or create derivative works based on these data, content, or resources (either in whole or in part) unless you have been specifically given permission to do so by the relevant owners.\n\n7.3 You acknowledge that your use of such third party applications, data, content, or resources may be subject to separate terms between you and the relevant third party.\n\n8. Using Google APIs\n\n8.1 Google APIs\n\n8.1.1 If you use any API to retrieve data from Google, you acknowledge that the data may be protected by intellectual property rights which are owned by Google or those parties that provide the data (or by other persons or companies on their behalf). Your use of any such API may be subject to additional Terms of Service. You may not modify, rent, lease, loan, sell, distribute or create derivative works based on this data (either in whole or in part) unless allowed by the relevant Terms of Service.\n\n8.1.2 If you use any API to retrieve a user's data from Google, you acknowledge and agree that you shall retrieve data only with the user's explicit consent and only when, and for the limited purposes for which, the user has given you permission to do so.\n\n9. Terminating the License Agreement\n\n9.1 the License Agreement will continue to apply until terminated by either you or Google as set out below.\n\n9.2 If you want to terminate the License Agreement, you may do so by ceasing your use of the Preview and any relevant developer credentials.\n\n9.3 Google may at any time, terminate the License Agreement, with or without cause, upon notice to you.\n\n9.4 The License Agreement will automatically terminate without notice or other action upon the earlier of: (A) when Google ceases to provide the Preview or certain parts of the Preview to users in the country in which you are resident or from which you use the service; and (B) Google issues a final release version of the Android SDK.\n\n9.5 When the License Agreement is terminated, the license granted to you in the License Agreement will terminate, you will immediately cease all use of the Preview, and the provisions of paragraphs 10, 11, 12 and 14 shall survive indefinitely.\n\n10. DISCLAIMERS\n\n10.1 YOU EXPRESSLY UNDERSTAND AND AGREE THAT YOUR USE OF THE PREVIEW IS AT YOUR SOLE RISK AND THAT THE PREVIEW IS PROVIDED \"AS IS\" AND \"AS AVAILABLE\" WITHOUT WARRANTY OF ANY KIND FROM GOOGLE.\n\n10.2 YOUR USE OF THE PREVIEW AND ANY MATERIAL DOWNLOADED OR OTHERWISE OBTAINED THROUGH THE USE OF THE PREVIEW IS AT YOUR OWN DISCRETION AND RISK AND YOU ARE SOLELY RESPONSIBLE FOR ANY DAMAGE TO YOUR COMPUTER SYSTEM OR OTHER DEVICE OR LOSS OF DATA THAT RESULTS FROM SUCH USE. WITHOUT LIMITING THE FOREGOING, YOU UNDERSTAND THAT THE PREVIEW IS NOT A STABLE RELEASE AND MAY CONTAIN ERRORS, DEFECTS AND SECURITY VULNERABILITIES THAT CAN RESULT IN SIGNIFICANT DAMAGE, INCLUDING THE COMPLETE, IRRECOVERABLE LOSS OF USE OF YOUR COMPUTER SYSTEM OR OTHER DEVICE.\n\n10.3 GOOGLE FURTHER EXPRESSLY DISCLAIMS ALL WARRANTIES AND CONDITIONS OF ANY KIND, WHETHER EXPRESS OR IMPLIED, INCLUDING, BUT NOT LIMITED TO THE IMPLIED WARRANTIES AND CONDITIONS OF MERCHANTABILITY, FITNESS FOR A PARTICULAR PURPOSE AND NON-INFRINGEMENT.\n\n11. LIMITATION OF LIABILITY\n\n11.1 YOU EXPRESSLY UNDERSTAND AND AGREE THAT GOOGLE, ITS SUBSIDIARIES AND AFFILIATES, AND ITS LICENSORS SHALL NOT BE LIABLE TO YOU UNDER ANY THEORY OF LIABILITY FOR ANY DIRECT, INDIRECT, INCIDENTAL, SPECIAL, CONSEQUENTIAL OR EXEMPLARY DAMAGES THAT MAY BE INCURRED BY YOU, INCLUDING ANY LOSS OF DATA, WHETHER OR NOT GOOGLE OR ITS REPRESENTATIVES HAVE BEEN ADVISED OF OR SHOULD HAVE BEEN AWARE OF THE POSSIBILITY OF ANY SUCH LOSSES ARISING.\n\n12. Indemnification\n\n12.1 To the maximum extent permitted by law, you agree to defend, indemnify and hold harmless Google, its affiliates and their respective directors, officers, employees and agents from and against any and all claims, actions, suits or proceedings, as well as any and all losses, liabilities, damages, costs and expenses (including reasonable attorneys? fees) arising out of or accruing from (a) your use of the Preview, (b) any application you develop on the Preview that infringes any Intellectual Property Rights of any person or defames any person or violates their rights of publicity or privacy, and (c) any non-compliance by you of the License Agreement.\n\n13. Changes to the License Agreement\n\n13.1 Google may make changes to the License Agreement as it distributes new versions of the Preview. When these changes are made, Google will make a new version of the License Agreement available on the website where the Preview is made available.\n\n14. General Legal Terms\n\n14.1 the License Agreement constitutes the whole legal agreement between you and Google and governs your use of the Preview (excluding any services which Google may provide to you under a separate written agreement), and completely replaces any prior agreements between you and Google in relation to the Preview.\n\n14.2 You agree that if Google does not exercise or enforce any legal right or remedy which is contained in the License Agreement (or which Google has the benefit of under any applicable law), this will not be taken to be a formal waiver of Google's rights and that those rights or remedies will still be available to Google.\n\n14.3 If any court of law, having the jurisdiction to decide on this matter, rules that any provision of the License Agreement is invalid, then that provision will be removed from the License Agreement without affecting the rest of the License Agreement. The remaining provisions of the License Agreement will continue to be valid and enforceable.\n\n14.4 You acknowledge and agree that each member of the group of companies of which Google is the parent shall be third party beneficiaries to the License Agreement and that such other companies shall be entitled to directly enforce, and rely upon, any provision of the License Agreement that confers a benefit on (or rights in favor of) them. Other than this, no other person or company shall be third party beneficiaries to the License Agreement.\n\n14.5 EXPORT RESTRICTIONS. THE PREVIEW IS SUBJECT TO UNITED STATES EXPORT LAWS AND REGULATIONS. YOU MUST COMPLY WITH ALL DOMESTIC AND INTERNATIONAL EXPORT LAWS AND REGULATIONS THAT APPLY TO THE PREVIEW. THESE LAWS INCLUDE RESTRICTIONS ON DESTINATIONS, END USERS AND END USE.\n\n14.6 The License Agreement may not be assigned or transferred by you without the prior written approval of Google, and any attempted assignment without such approval will be void. You shall not delegate your responsibilities or obligations under the License Agreement without the prior written approval of Google.\n\n14.7 The License Agreement, and your relationship with Google under the License Agreement, shall be governed by the laws of the State of California without regard to its conflict of laws provisions. You and Google agree to submit to the exclusive jurisdiction of the courts located within the county of Santa Clara, California to resolve any legal matter arising from the License Agreement. Notwithstanding this, you agree that Google shall still be allowed to apply for injunctive remedies (or an equivalent type of urgent legal relief) in any jurisdiction.\n\nJune 2014.\n---------------------------------------\nAccept? (y/N): \n5/6: License google-gdk-license:\n---------------------------------------\nThis is a Developer Preview of the GDK that is subject to change.\n\nTerms and Conditions\n\nThis is the Glass Development Kit License Agreement.\n\n1. Introduction\n\n1.1 The Glass Development Kit (referred to in this License Agreement as the \"GDK\" and specifically including the Android system files, packaged APIs, and GDK library files, if and when they are made available) is licensed to you subject to the terms of this License Agreement. This License Agreement forms a legally binding contract between you and Google in relation to your use of the GDK.\n\n1.2 \"Glass\" means Glass devices and the Glass software stack for use on Glass devices.\n\n\n1.3 \"Android\" means the Android software stack for devices, as made available under the Android Open Source Project, which is located at the following URL: http://source.android.com/, as updated from time to time.\n\n1.4 \"Google\" means Google Inc., a Delaware corporation with principal place of business at 1600 Amphitheatre Parkway, Mountain View, CA 94043, United States.\n\n2. Accepting this License Agreement\n\n2.1 In order to use the GDK, you must first agree to this License Agreement. You may not use the GDK if you do not accept this License Agreement.\n\n2.2 By clicking to accept, you hereby agree to the terms of this License Agreement.\n\n2.3 You may not use the GDK and may not accept the License Agreement if you are a person barred from receiving the GDK under the laws of the United States or other countries including the country in which you are resident or from which you use the GDK.\n\n2.4 If you are agreeing to be bound by this License Agreement on behalf of your employer or other entity, you represent and warrant that you have full legal authority to bind your employer or such entity to this License Agreement. If you do not have the requisite authority, you may not accept the License Agreement or use the GDK on behalf of your employer or other entity.\n\n3. GDK License from Google\n\n3.1 Subject to the terms of this License Agreement, Google grants you a limited, worldwide, royalty-free, non-assignable and non-exclusive license to use the GDK solely to develop applications to run on the Glass platform for Glass devices.\n\n3.2 You agree that Google or third parties own all legal right, title and interest in and to the GDK, including any Intellectual Property Rights that subsist in the GDK. \"Intellectual Property Rights\" means any and all rights under patent law, copyright law, trade secret law, trademark law, and any and all other proprietary rights. Google reserves all rights not expressly granted to you.\n\n3.3 You may not use the GDK for any purpose not expressly permitted by this License Agreement. Except to the extent required by applicable third party licenses, you may not: (a) copy (except for backup purposes), modify, adapt, redistribute, decompile, reverse engineer, disassemble, or create derivative works of the GDK or any part of the GDK; or (b) load any part of the GDK onto a mobile handset or wearable computing device or any other hardware device except a Glass device personal computer, combine any part of the GDK with other software, or distribute any software or device incorporating a part of the GDK.\n\n3.4 You agree that you will not take any actions that may cause or result in the fragmentation of Glass, including but not limited to distributing, participating in the creation of, or promoting in any way a software development kit derived from the GDK.\n\n3.5 Use, reproduction and distribution of components of the GDK licensed under an open source software license are governed solely by the terms of that open source software license and not this License Agreement.\n\n3.6 You agree that the form and nature of the GDK that Google provides may change without prior notice to you and that future versions of the GDK may be incompatible with applications developed on previous versions of the GDK. You agree that Google may stop (permanently or temporarily) providing the GDK (or any features within the GDK) to you or to users generally at Google's sole discretion, without prior notice to you.\n\n3.7 Nothing in this License Agreement gives you a right to use any of Google's trade names, trademarks, service marks, logos, domain names, or other distinctive brand features.\n\n3.8 You agree that you will not remove, obscure, or alter any proprietary rights notices (including copyright and trademark notices) that may be affixed to or contained within the GDK.\n\n\n3.9 Your use of any Android system files, packaged APIs, or other components of the GDK which are part of the Android Software Development Kit is subject to the terms of the Android Software Development Kit License Agreement located at http://developer.android.com/sdk/terms.html. These terms are hereby incorporated by reference into this License Agreement.\n\n4. Use of the GDK by You\n\n4.1 Google agrees that it obtains no right, title or interest from you (or your licensors) under this License Agreement in or to any software applications that you develop using the GDK, including any intellectual property rights that subsist in those applications.\n\n4.2 You agree to use the GDK and write applications only for purposes that are permitted by (a) this License Agreement, (b) the Glass Platform Developer Policies (located at https://developers.google.com/glass/policies, and hereby incorporated into this License Agreement by reference), and (c) any applicable law, regulation or generally accepted practices or guidelines in the relevant jurisdictions (including any laws regarding the export of data or software to and from the United States or other relevant countries).\n\n4.3 You agree that if you use the GDK to develop applications for general public users, you will protect the privacy and legal rights of those users. If the users provide you with user names, passwords, or other login information or personal information, you must make the users aware that the information will be available to your application, and you must provide legally adequate privacy notice and protection for those users. If your application stores personal or sensitive information provided by users, it must do so securely. If the user provides your application with Google Account information, your application may only use that information to access the user's Google Account when, and for the limited purposes for which, the user has given you permission to do so.\n\n4.4 You agree that you will not engage in any activity with the GDK, including the development or distribution of an application, that interferes with, disrupts, damages, or accesses in an unauthorized manner the servers, networks, or other properties or services of any third party including, but not limited to, Google.\n\n4.5 You agree that you are solely responsible for (and that Google has no responsibility to you or to any third party for) any data, content, or resources that you create, transmit or display through Glass and/or applications for Glass, and for the consequences of your actions (including any loss or damage which Google may suffer) by doing so.\n\n4.6 You agree that you are solely responsible for (and that Google has no responsibility to you or to any third party for) any breach of your obligations under this License Agreement, any applicable third party contract or Terms of Service, or any applicable law or regulation, and for the consequences (including any loss or damage which Google or any third party may suffer) of any such breach.\n\n\n4.7 The GDK is in development, and your testing and feedback are an important part of the development process. By using the GDK, you acknowledge that implementation of some features are still under development and that you should not rely on the GDK, Glass devices, Glass system software, Google Mirror API, or Glass services having the full functionality of a stable release.\n\n5. Your Developer Credentials\n\n5.1 You agree that you are responsible for maintaining the confidentiality of any developer credentials that may be issued to you by Google or which you may choose yourself and that you will be solely responsible for all applications that are developed under your developer credentials.\n\n6. Privacy and Information\n\n\n6.1 In order to continually innovate and improve the GDK, Google may collect certain usage statistics from the software including but not limited to a unique identifier, associated IP address, version number of the software, and information on which tools and/or services in the GDK are being used and how they are being used. Before any of this information is collected, the GDK will notify you and seek your consent. If you withhold consent, the information will not be collected.\n\n6.2 The data collected is examined in the aggregate to improve the GDK and is maintained in accordance with Google's Privacy Policy.\n\n7. Third Party Applications\n\n7.1 If you use the GDK to run applications developed by a third party or that access data, content or resources provided by a third party, you agree that Google is not responsible for those applications, data, content, or resources. You understand that all data, content or resources which you may access through such third party applications are the sole responsibility of the person from which they originated and that Google is not liable for any loss or damage that you may experience as a result of the use or access of any of those third party applications, data, content, or resources.\n\n7.2 You should be aware the data, content, and resources presented to you through such a third party application may be protected by intellectual property rights which are owned by the providers (or by other persons or companies on their behalf). You may not modify, rent, lease, loan, sell, distribute or create derivative works based on these data, content, or resources (either in whole or in part) unless you have been specifically given permission to do so by the relevant owners.\n\n7.3 You acknowledge that your use of such third party applications, data, content, or resources may be subject to separate terms between you and the relevant third party. In that case, this License Agreement does not affect your legal relationship with these third parties.\n\n8. Using Google APIs\n\n8.1 Google APIs\n\n8.1.1 If you use any API to retrieve data from Google, you acknowledge that the data may be protected by intellectual property rights which are owned by Google or those parties that provide the data (or by other persons or companies on their behalf). Your use of any such API may be subject to additional Terms of Service. You may not modify, rent, lease, loan, sell, distribute or create derivative works based on this data (either in whole or in part) unless allowed by the relevant Terms of Service.\n\n8.1.2 If you use any API to retrieve a user's data from Google, you acknowledge and agree that you shall retrieve data only with the user's explicit consent and only when, and for the limited purposes for which, the user has given you permission to do so.\n\n9. Terminating this License Agreement\n\n9.1 This License Agreement will continue to apply until terminated by either you or Google as set out below.\n\n9.2 If you want to terminate this License Agreement, you may do so by ceasing your use of the GDK and any relevant developer credentials.\n\n9.3 Google may at any time, terminate this License Agreement with you if: (A) you have breached any provision of this License Agreement; or (B) Google is required to do so by law; or (C) the partner with whom Google offered certain parts of GDK (such as APIs) to you has terminated its relationship with Google or ceased to offer certain parts of the GDK to you; or (D) Google decides to no longer provide the GDK or certain parts of the GDK to users in the country in which you are resident or from which you use the service, or the provision of the GDK or certain GDK services to you by Google is, in Google's sole discretion, no longer commercially viable.\n\n9.4 When this License Agreement comes to an end, all of the legal rights, obligations and liabilities that you and Google have benefited from, been subject to (or which have accrued over time whilst this License Agreement has been in force) or which are expressed to continue indefinitely, shall be unaffected by this cessation, and the provisions of paragraph 14.7 shall continue to apply to such rights, obligations and liabilities indefinitely.\n\n10. DISCLAIMER OF WARRANTIES\n\n10.1 YOU EXPRESSLY UNDERSTAND AND AGREE THAT YOUR USE OF THE GDK IS AT YOUR SOLE RISK AND THAT THE GDK IS PROVIDED \"AS IS\" AND \"AS AVAILABLE\" WITHOUT WARRANTY OF ANY KIND FROM GOOGLE.\n\n10.2 YOUR USE OF THE GDK AND ANY MATERIAL DOWNLOADED OR OTHERWISE OBTAINED THROUGH THE USE OF THE GDK IS AT YOUR OWN DISCRETION AND RISK AND YOU ARE SOLELY RESPONSIBLE FOR ANY DAMAGE TO YOUR COMPUTER SYSTEM OR OTHER DEVICE OR LOSS OF DATA THAT RESULTS FROM SUCH USE.\n\n10.3 GOOGLE FURTHER EXPRESSLY DISCLAIMS ALL WARRANTIES AND CONDITIONS OF ANY KIND, WHETHER EXPRESS OR IMPLIED, INCLUDING, BUT NOT LIMITED TO THE IMPLIED WARRANTIES AND CONDITIONS OF MERCHANTABILITY, FITNESS FOR A PARTICULAR PURPOSE AND NON-INFRINGEMENT.\n\n11. LIMITATION OF LIABILITY\n\n11.1 YOU EXPRESSLY UNDERSTAND AND AGREE THAT GOOGLE, ITS SUBSIDIARIES AND AFFILIATES, AND ITS LICENSORS SHALL NOT BE LIABLE TO YOU UNDER ANY THEORY OF LIABILITY FOR ANY DIRECT, INDIRECT, INCIDENTAL, SPECIAL, CONSEQUENTIAL OR EXEMPLARY DAMAGES THAT MAY BE INCURRED BY YOU, INCLUDING ANY LOSS OF DATA, WHETHER OR NOT GOOGLE OR ITS REPRESENTATIVES HAVE BEEN ADVISED OF OR SHOULD HAVE BEEN AWARE OF THE POSSIBILITY OF ANY SUCH LOSSES ARISING.\n\n12. Indemnification\n\n12.1 To the maximum extent permitted by law, you agree to defend, indemnify and hold harmless Google, its affiliates and their respective directors, officers, employees and agents from and against any and all claims, actions, suits or proceedings, as well as any and all losses, liabilities, damages, costs and expenses (including reasonable attorneys fees) arising out of or accruing from (a) your use of the GDK, (b) any application you develop on the GDK that infringes any copyright, trademark, trade secret, trade dress, patent or other intellectual property right of any person or defames any person or violates their rights of publicity or privacy, and (c) any non-compliance by you with this License Agreement.\n\n13. Changes to the License Agreement\n\n13.1 Google may make changes to the License Agreement as it distributes new versions of the GDK. When these changes are made, Google will make a new version of the License Agreement available on the website where the GDK is made available.\n\n14. General Legal Terms\n\n14.1 This License Agreement constitutes the whole legal agreement between you and Google and governs your use of the GDK (excluding any services which Google may provide to you under a separate written agreement), and completely replaces any prior agreements between you and Google in relation to the GDK.\n\n14.2 You agree that if Google does not exercise or enforce any legal right or remedy which is contained in this License Agreement (or which Google has the benefit of under any applicable law), this will not be taken to be a formal waiver of Google's rights and that those rights or remedies will still be available to Google.\n\n14.3 If any court of law, having the jurisdiction to decide on this matter, rules that any provision of this License Agreement is invalid, then that provision will be removed from this License Agreement without affecting the rest of this License Agreement. The remaining provisions of this License Agreement will continue to be valid and enforceable.\n\n14.4 You acknowledge and agree that each member of the group of companies of which Google is the parent shall be third party beneficiaries to this License Agreement and that such other companies shall be entitled to directly enforce, and rely upon, any provision of this License Agreement that confers a benefit on (or rights in favor of) them. Other than this, no other person or company shall be third party beneficiaries to this License Agreement.\n\n14.5 EXPORT RESTRICTIONS. THE GDK IS SUBJECT TO UNITED STATES EXPORT LAWS AND REGULATIONS. YOU MUST COMPLY WITH ALL DOMESTIC AND INTERNATIONAL EXPORT LAWS AND REGULATIONS THAT APPLY TO THE GDK. THESE LAWS INCLUDE RESTRICTIONS ON DESTINATIONS, END USERS AND END USE.\n\n14.6 The rights granted in this License Agreement may not be assigned or transferred by either you or Google without the prior written approval of the other party. Neither you nor Google shall be permitted to delegate their responsibilities or obligations under this License Agreement without the prior written approval of the other party.\n\n14.7 This License Agreement, and your relationship with Google under this License Agreement, shall be governed by the laws of the State of California without regard to its conflict of laws provisions. You and Google agree to submit to the exclusive jurisdiction of the courts located within the county of Santa Clara, California to resolve any legal matter arising from this License Agreement. Notwithstanding this, you agree that Google shall still be allowed to apply for injunctive remedies (or an equivalent type of urgent legal relief) in any jurisdiction.\n\nNovember 19, 2013\n---------------------------------------\nAccept? (y/N): \n6/6: License mips-android-sysimage-license:\n---------------------------------------\nMIPS Technologies, Inc. (?MIPS?) Internal Evaluation License Agreement for MIPS Android? System Images for Android Software Development Kit (SDK): This Internal Evaluation License Agreement (this \"Agreement\") is entered into by and between MIPS and you (as an individual developer or a legal entity -- identified below as ?Recipient?). MIPS shall make the Evaluation Software available to Recipient as described in accordance with the terms and conditions set forth below.\n\nBy clicking on the ?Accept? button, downloading, installing, or otherwise using the Evaluation Materials (defined below), you agree to be bound by the terms of this Agreement effective as of the date you click ?Accept? (the ?Effective Date?), and if doing so on behalf of an entity, you represent that you are authorized to bind the entity to the terms and conditions of this Agreement. If you do not agree to be bound by the terms and conditions of this Agreement, do not download, install, or use the Evaluation Materials.\n\n1. DEFINITIONS. These terms shall have the following meanings:\n\n1.1 ?MIPS? shall mean MIPS Technologies, Inc., a Delaware corporation having a principal place of business at: 955 East Arques Ave., Sunnyvale, CA 94085\n\n1.2 ?Evaluation Software? shall mean MIPS Android? emulator system images for Android Software Development Kit (SDK), as made available to Recipient.\n\n1.3 ?Evaluation Materials\" means, collectively, the Evaluation Software (in source and/or object code form) and documentation (including, without limitation, any design documents, specifications, reference manuals, and other related materials) related to the Evaluation Software as made available to Recipient.\n\n1.4 ?Open Source Software? means any software that requires (as a condition of use, modification and/or distribution of such software) that such software or other software incorporated into, derived from or distributed with such software (a) be disclosed or distributed in source code form; or (b) be licensed by the user to third parties for the purpose of making and/or distributing derivative works; or (c) be redistributable at no charge. Open Source Software includes, without limitation, software licensed or distributed under any of the following licenses or distribution models, or licenses or distribution models substantially similar to any of the following: (a) GNU?s General Public License (GPL) or Lesser/Library GPL (LGPL), (b) the Artistic License (e.g., PERL), (c) the Mozilla Public License, (d) the Netscape Public License, (e) the Sun Community Source License (SCSL), (f) the Sun Industry Source License (SISL), (g) the Apache Software license and (h) the Common Public License (CPL).\n\n1.5 ?Pre-Release Materials? means ?alpha? or ?beta? designated pre-release features, which may not be fully functional, which MIPS may substantially modify in producing any production version of the Evaluation Materials, and/or which is still under development by MIPS and/or MIPS? suppliers.\n\n2. PURPOSE. MIPS desires to make the Evaluation Materials available to Recipient solely for Recipient's internal evaluation of the Evaluation Software to evaluate the desirability of cooperating with MIPS in developing products that are compatible with the Evaluation Software and/or to advise MIPS as to possible modifications to the Evaluation Software. Recipient may not disclose, distribute, modify (except to facilitate the above-mentioned internal evaluation), or make commercial use of the Evaluation Materials or any modifications of the Evaluation Materials.\n\nTHE EVALUATION MATERIALS ARE PROVIDED FOR EVALUATION PURPOSES ONLY AND MAY NOT BE MODIFIED (EXCEPT TO FACILITATE THE INTERNAL EVALUATION) OR DISTRIBUTED BY RECIPIENT OR INCORPORATED INTO RECIPIENT?S PRODUCTS OR SOFTWARE. PLEASE CONTACT A MIPS SALES REPRESENTATIVE TO LEARN ABOUT THE AVAILABILITY AND COST OF A COMMERCIAL VERSION OF THE EVALUATION SOFTWARE.\n\n3. TITLE. Title to the Evaluation Materials remains with MIPS or its suppliers. Recipient shall not mortgage, pledge or encumber the Evaluation Materials in any way. Recipient shall return all Evaluation Materials, keeping no copies, upon termination or expiration of this Agreement.\n\n4. LICENSE. MIPS grants Recipient a royalty-free, personal, nontransferable, nonexclusive license under its copyrights to use the Evaluation Software only for the purposes described in paragraph 2 above and only for a period beginning on the Effective Date and extending to the first anniversary of the Effective Date (the ?Evaluation Period?). Unless otherwise communicated in writing by MIPS to Recipient, to the extent the Evaluation Software is provided in more than one delivery or release (each, a ?Release?) the license grant in this Section 4 and the Evaluation Period shall apply to each Release, in which case the Evaluation Period shall begin on the date that the Release is made generally available and continue to the first anniversary of such date. Recipient may not make modifications to the Evaluation Software. Recipient shall not disassemble, reverse-engineer, or decompile any software that is not provided to Recipient in source code form.\n\n\nEXCEPT AS PROVIDED HEREIN, NO OTHER LICENSE, EXPRESS OR IMPLIED, BY ESTOPPEL OR OTHERWISE, TO ANY OTHER MIPS INTELLECTUAL PROPERTY RIGHTS IS GRANTED TO THE RECIPIENT. OTHER THAN AS EXPLICITLY SET FORTH IN PARAGRAPH 2 ABOVE, NO RIGHT TO COPY, TO REPRODUCE, TO MODIFY, OR TO CREATE DERIVATIVE WORKS OF, THE EVALUATION MATERIALS IS GRANTED HEREIN.\n\n5. NO OBLIGATION. Recipient shall have no duty to purchase or license any product from MIPS. MIPS and its suppliers shall have no obligation to provide support for, or develop a non-evaluation version of, the Evaluation Software or to license any version of it.\n\n6. MODIFICATIONS. This Agreement does not obligate Recipient to provide MIPS with comments or suggestions regarding Evaluation Materials. However, should Recipient provide MIPS with comments or suggestions for the modification, correction, improvement or enhancement of (a) the Evaluation Materials or (b) MIPS products or processes which may embody the Evaluation Materials, then Recipient agrees to grant and hereby grants to MIPS a non-exclusive, irrevocable, worldwide, fully paid-up, royalty-free license, with the right to sublicense MIPS? licensees and customers, under Recipient?s Intellectual property rights, to use and disclose such comments and suggestions in any manner MIPS chooses and to display, perform, copy, make, have made, use, sell, offer to sell, import, and otherwise dispose of MIPS? and its sublicensee?s products embodying such comments and suggestions in any manner and via any media MIPS chooses, without reference to the source.\n\n7. WARRANTY DISCLAIMER. MIPS AND ITS SUPPLIERS MAKE NO WARRANTIES WITH RESPECT TO EVALUATION MATERIALS, EITHER EXPRESS OR IMPLIED, INCLUDING ANY IMPLIED WARRANTIES OF MERCHANTABILITY OR FITNESS FOR A PARTICULAR PURPOSE, OR ANY IMPLIED WARRANTY OF NONINFRINGEMENT WITH RESPECT TO THIRD PARTY INTELLECTUAL PROPERTY. RECIPIENT ACKNOWLEDGES AND AGREES THAT THE EVALUATION MATERIALS ARE PROVIDED ?AS IS,? WITHOUT WARRANTY OF ANY KIND.\n\n8. LIMITATION OF LIABILITY. MIPS AND ITS SUPPLIERS SHALL NOT BE LIABLE FOR ANY PROPERTY DAMAGE, PERSONAL INJURY, LOSS OF PROFITS, INTERRUPTION OF BUSINESS OR FOR ANY DIRECT, INDIRECT, SPECIAL, CONSEQUENTIAL OR INCIDENTAL DAMAGES, HOWEVER CAUSED OR ALLEGED, WHETHER FOR BREACH OF WARRANTY, CONTRACT, STRICT LIABILITY OR OTHERWISE, INCLUDING WITHOUT LIMITATION, UNDER TORT OR OTHER LEGAL THEORY. MIPS AND ITS SUPPLIERS DISCLAIM ANY AND ALL LIABILITY, INCLUDING LIABILITY FOR INFRINGEMENT OF ANY INTELLECTUAL PROPERTY RIGHTS OF ANY KIND RELATING TO THE EVALUATION MATERIALS.\n\n9. EXPIRATION. MIPS may terminate this Agreement immediately after a breach by Recipient or otherwise at MIPS? reasonable discretion and upon five (5) business days? notice to Recipient.\n\n10. GENERAL.\n\n10.1 Controlling Law. This Agreement shall be governed by California law excluding its choice of law rules. With the exception of MIPS? rights to enforce its intellectual property rights and any confidentiality obligations under this Agreement or any licenses distributed with the Evaluation Materials, all disputes and any claims arising under or relating to this Agreement shall be subject to the exclusive jurisdiction and venue of the state and federal courts located in Santa Clara County, California. Each party hereby agrees to jurisdiction and venue in the courts set forth in the preceding sentence. The parties agree that the United Nations Convention on Contracts for the International Sale of Goods is specifically excluded from application to this Agreement. The parties consent to the personal jurisdiction of the above courts.\n\n10.2 Remedies. Recipient acknowledges and agrees that any breach of confidentiality obligations under this Agreement or any licenses distributed with the Evaluation Materials, as well as any disclosure, commercialization, or public use of the Evaluation Materials, would cause irreparable injury to MIPS, and therefore Recipient agrees to consent to, and hereby consents to, the grant of an injunction by any court of competent jurisdiction in the event of an actual or threatened breach.\n\n10.3 Assignment. Recipient may not delegate, assign or transfer this Agreement, the license granted or any of Recipient?s rights, obligations, or duties hereunder, expressly, by implication, by operation of law, by way of merger (regardless of whether Recipient is the surviving entity) or acquisition, or otherwise and any attempt to do so, without MIPS? express prior written consent, shall be ineffective, null and void. MIPS may freely assign this Agreement, and its rights and obligations hereunder, in its sole discretion.\n\n10.4 Entire Agreement. This Agreement constitutes the entire agreement between Recipient and MIPS and supersedes in their entirety any and all oral or written agreements previously existing between Recipient and MIPS with respect to the subject matter hereof. This Agreement may only be amended or supplemented by a writing that refers explicitly to this Agreement and that is signed or otherwise accepted by duly authorized representatives of Recipient and MIPS.\n\n10.5 Severability. In the event that any provision of this Agreement is finally adjudicated to be unenforceable or invalid under any applicable law, such unenforceability or invalidity shall not render this Agreement unenforceable or invalid as a whole, and, in such event, such unenforceable or invalid provision shall be interpreted so as to best accomplish the objectives of such provision within the limits of applicable law or applicable court decisions.\n\n10.6 Export Regulations / Export Control. Recipient shall not export, either directly or indirectly, any product, service or technical data or system incorporating the Evaluation Materials without first obtaining any required license or other necessary approval from the U.S. Department of Commerce or any other governing agency or department of the United States Government. In the event any product is exported from the United States or re-exported from a foreign destination by Recipient, Recipient shall ensure that the distribution and export/re-export or import of the product is in compliance with all applicable laws, regulations, orders, or other restrictions of the U.S. Export Administration Regulations and the appropriate foreign government. Recipient agrees that neither it nor any of its subsidiaries will export/re-export any technical data, process, product, or service, directly or indirectly, to any country for which the United States government or any agency thereof or the foreign government from where it is shipping requires an export license, or other governmental approval, without first obtaining such license or approval. Recipient also agrees to implement measures to ensure that foreign national employees are authorized to receive any information controlled by U.S. export control laws. An export is \"deemed\" to take place when information is released to a foreign national wherever located.\n\n10.7 Special Terms for Pre-Release Materials. If so indicated in the description of the Evaluation Software, the Evaluation Software may contain Pre-Release Materials. Recipient hereby understands, acknowledges and agrees that: (i) Pre-Release Materials may not be fully tested and may contain bugs or errors; (ii) Pre-Release materials are not suitable for commercial release in their current state; (iii) regulatory approvals for Pre-Release Materials (such as UL or FCC) have not been obtained, and Pre-Release Materials may therefore not be certified for use in certain countries or environments or may not be suitable for certain applications and (iv) MIPS can provide no assurance that it will ever produce or make generally available a production version of the Pre-Release Materials . MIPS is not under any obligation to develop and/or release or offer for sale or license a final product based upon the Pre-Release Materials and may unilaterally elect to abandon the Pre-Release Materials or any such development platform at any time and without any obligation or liability whatsoever to Recipient or any other person.\n\nANY PRE-RELEASE MATERIALS ARE NON-QUALIFIED AND, AS SUCH, ARE PROVIDED ?AS IS? AND ?AS AVAILABLE?, POSSIBLY WITH FAULTS, AND WITHOUT REPRESENTATION OR WARRANTY OF ANY KIND.\n\n10.8 Open Source Software. In the event Open Source software is included with Evaluation Software, such Open Source software is licensed pursuant to the applicable Open Source software license agreement identified in the Open Source software comments in the applicable source code file(s) and/or file header as indicated in the Evaluation Software. Additional detail may be available (where applicable) in the accompanying on-line documentation. With respect to the Open Source software, nothing in this Agreement limits any rights under, or grants rights that supersede, the terms of any applicable Open Source software license agreement.\n---------------------------------------\nAccept? (y/N): All SDK package licenses accepted\n\n+ true\n+ '[' -n '' ']'\n+ '[' -n '' ']'\n+ '[' -n '' ']'\n+ '[' -n '' ']'\n+ '[' -n '' ']'\n+ '[' -n '' ']'\n+ git clone --recurse-submodules -b 1.0.0 -- https://github.com/FossifyOrg/File-Manager.git /build/repo\nCloning into '/build/repo'...\nNote: switching to 'feef6998a0fc79aa859f54699d783df4f0a0c147'.\n\nYou are in 'detached HEAD' state. You can look around, make experimental\nchanges and commit them, and you can discard any commits you make in this\nstate without impacting any branches by switching back to a branch.\n\nIf you want to create a new branch to retain commits you create, you may\ndo so (now or later) by using -c with the switch command. Example:\n\n  git switch -c <new-branch-name>\n\nOr undo this operation with:\n\n  git switch -\n\nTurn off this advice by setting config variable advice.detachedHead to false\n\n+ cd /build/repo\n++ git rev-parse HEAD\n+ test feef6998a0fc79aa859f54699d783df4f0a0c147 = feef6998a0fc79aa859f54699d783df4f0a0c147\n+ export PATH=/usr/local/sbin:/usr/local/bin:/usr/sbin:/usr/bin:/sbin:/bin:/opt/sdk/cmdline-tools/12.0/bin\n+ PATH=/usr/local/sbin:/usr/local/bin:/usr/sbin:/usr/bin:/sbin:/bin:/opt/sdk/cmdline-tools/12.0/bin\n+ ./gradlew assembleRelease\nDownloading https://services.gradle.org/distributions/gradle-8.2.1-bin.zip\n..................................................................................................................................................................................................................................................................................................................................................................................................................................................................................................................................................................................................................................................................................................................................................................................................................................................................................................................................................................................................................................................................................................................................................................................................................................................................................................................................................................................................................................................................................................................................................................................................................................................................................................................................................................................................................................................................................................................................................................................................................................................................................................................................................................................................................................................................................................................................................................................................................................................................................................................................................................................................................................................................................................................................................................................................................................................................................................................................................................................................................................................................................................................................................................................................................................................................................................................................................................................................................................................................................................................................................................................................................................................................................................................................................................................................................................................................................................................................................................................................................................................................................................................................................................................................................................................................................................................................................................................................................................................................................................................................................................................................................................................................................................................................................................................................................................................................................................................................................................................................................................................................................................................................................................................................................................................................................................................................................................................................................................................................................................................................................................................................................................................................................................................................................................................................................................................................................................................................................................................................................................................................................................................................................................................................................................................................................................................................................................................................................................................................................................................................................................................................................................................................................................\nUnzipping /build/.gradle/wrapper/dists/gradle-8.2.1-bin/5hap6b9n41hkg4jeh2au2pllh/gradle-8.2.1-bin.zip to /build/.gradle/wrapper/dists/gradle-8.2.1-bin/5hap6b9n41hkg4jeh2au2pllh\nSet executable permissions for: /build/.gradle/wrapper/dists/gradle-8.2.1-bin/5hap6b9n41hkg4jeh2au2pllh/gradle-8.2.1/bin/gradle\n\nWelcome to Gradle 8.2.1!\n\nHere are the highlights of this release:\n - Kotlin DSL: new reference documentation, assignment syntax by default\n - Kotlin DSL is now the default with Gradle init\n - Improved suggestions to resolve errors in console output\n - Reduced sync memory consumption\n\nFor more details see https://docs.gradle.org/8.2.1/release-notes.html\n\nStarting a Gradle Daemon (subsequent builds will be faster)\nChecking the license for package Android SDK Build-Tools 34 in /opt/sdk/licenses\nLicense for package Android SDK Build-Tools 34 accepted.\nPreparing \"Install Android SDK Build-Tools 34 v.34.0.0\".\n\"Install Android SDK Build-Tools 34 v.34.0.0\" ready.\nInstalling Android SDK Build-Tools 34 in /opt/sdk/build-tools/34.0.0\n\"Install Android SDK Build-Tools 34 v.34.0.0\" complete.\n\"Install Android SDK Build-Tools 34 v.34.0.0\" finished.\nChecking the license for package Android SDK Platform 34 in /opt/sdk/licenses\nLicense for package Android SDK Platform 34 accepted.\nPreparing \"Install Android SDK Platform 34 (revision 3)\".\n\"Install Android SDK Platform 34 (revision 3)\" ready.\nInstalling Android SDK Platform 34 in /opt/sdk/platforms/android-34\n\"Install Android SDK Platform 34 (revision 3)\" complete.\n\"Install Android SDK Platform 34 (revision 3)\" finished.\nChecking the license for package Android SDK Platform-Tools in /opt/sdk/licenses\nLicense for package Android SDK Platform-Tools accepted.\nPreparing \"Install Android SDK Platform-Tools v.35.0.0\".\n\"Install Android SDK Platform-Tools v.35.0.0\" ready.\nInstalling Android SDK Platform-Tools in /opt/sdk/platform-tools\n\"Install Android SDK Platform-Tools v.35.0.0\" complete.\n\"Install Android SDK Platform-Tools v.35.0.0\" finished.\n> Task :app:preBuild UP-TO-DATE\n> Task :app:preCoreReleaseBuild UP-TO-DATE\n> Task :app:mergeCoreReleaseJniLibFolders\n> Task :app:mergeCoreReleaseNativeLibs NO-SOURCE\n> Task :app:stripCoreReleaseDebugSymbols NO-SOURCE\n> Task :app:extractCoreReleaseNativeSymbolTables NO-SOURCE\n> Task :app:mergeCoreReleaseNativeDebugMetadata NO-SOURCE\n> Task :app:buildKotlinToolingMetadata\n> Task :app:checkCoreReleaseDuplicateClasses\n> Task :app:dataBindingMergeDependencyArtifactsCoreRelease\n> Task :app:generateCoreReleaseResValues\n> Task :app:generateCoreReleaseResources\n\n> Task :app:mergeCoreReleaseResources\n/build/.gradle/caches/transforms-3/1fbb3dccd22c860adfb8fae6ccb06cee/transformed/jetified-commons-b34aef8104/res/values-pt/values-pt.xml:400:4: Multiple substitutions specified in non-positional format of string resource string/during_day_at. Did you mean to add the formatted=\"false\" attribute?\n/build/.gradle/caches/transforms-3/1fbb3dccd22c860adfb8fae6ccb06cee/transformed/jetified-commons-b34aef8104/res/values-hr/values-hr.xml:401:4: Multiple substitutions specified in non-positional format of string resource string/during_day_at. Did you mean to add the formatted=\"false\" attribute?\n/build/.gradle/caches/transforms-3/1fbb3dccd22c860adfb8fae6ccb06cee/transformed/jetified-commons-b34aef8104/res/values/values.xml:1157:4: Multiple substitutions specified in non-positional format of string resource string/during_day_at. Did you mean to add the formatted=\"false\" attribute?\n/build/.gradle/caches/transforms-3/1fbb3dccd22c860adfb8fae6ccb06cee/transformed/jetified-commons-b34aef8104/res/values-in/values-in.xml:332:4: Multiple substitutions specified in non-positional format of string resource string/during_day_at. Did you mean to add the formatted=\"false\" attribute?\n/build/.gradle/caches/transforms-3/1fbb3dccd22c860adfb8fae6ccb06cee/transformed/jetified-commons-b34aef8104/res/values-hu/values-hu.xml:364:4: Multiple substitutions specified in non-positional format of string resource string/during_day_at. Did you mean to add the formatted=\"false\" attribute?\n/build/.gradle/caches/transforms-3/1fbb3dccd22c860adfb8fae6ccb06cee/transformed/jetified-commons-b34aef8104/res/values-it/values-it.xml:389:4: Multiple substitutions specified in non-positional format of string resource string/during_day_at. Did you mean to add the formatted=\"false\" attribute?\n/build/.gradle/caches/transforms-3/1fbb3dccd22c860adfb8fae6ccb06cee/transformed/jetified-commons-b34aef8104/res/values-nb-rNO/values-nb-rNO.xml:358:4: Multiple substitutions specified in non-positional format of string resource string/during_day_at. Did you mean to add the formatted=\"false\" attribute?\n/build/.gradle/caches/transforms-3/1fbb3dccd22c860adfb8fae6ccb06cee/transformed/jetified-commons-b34aef8104/res/values-zh-rHK/values-zh-rHK.xml:326:4: Multiple substitutions specified in non-positional format of string resource string/during_day_at. Did you mean to add the formatted=\"false\" attribute?\n/build/.gradle/caches/transforms-3/1fbb3dccd22c860adfb8fae6ccb06cee/transformed/jetified-commons-b34aef8104/res/values-ar/values-ar.xml:512:4: Multiple substitutions specified in non-positional format of string resource string/during_day_at. Did you mean to add the formatted=\"false\" attribute?\n/build/.gradle/caches/transforms-3/1fbb3dccd22c860adfb8fae6ccb06cee/transformed/jetified-commons-b34aef8104/res/values-bg/values-bg.xml:366:4: Multiple substitutions specified in non-positional format of string resource string/during_day_at. Did you mean to add the formatted=\"false\" attribute?\n/build/.gradle/caches/transforms-3/1fbb3dccd22c860adfb8fae6ccb06cee/transformed/jetified-commons-b34aef8104/res/values-iw/values-iw.xml:358:4: Multiple substitutions specified in non-positional format of string resource string/during_day_at. Did you mean to add the formatted=\"false\" attribute?\n/build/.gradle/caches/transforms-3/1fbb3dccd22c860adfb8fae6ccb06cee/transformed/jetified-commons-b34aef8104/res/values-az/values-az.xml:358:4: Multiple substitutions specified in non-positional format of string resource string/during_day_at. Did you mean to add the formatted=\"false\" attribute?\n/build/.gradle/caches/transforms-3/1fbb3dccd22c860adfb8fae6ccb06cee/transformed/jetified-commons-b34aef8104/res/values-br/values-br.xml:358:4: Multiple substitutions specified in non-positional format of string resource string/during_day_at. Did you mean to add the formatted=\"false\" attribute?\n/build/.gradle/caches/transforms-3/1fbb3dccd22c860adfb8fae6ccb06cee/transformed/jetified-commons-b34aef8104/res/values-sl/values-sl.xml:437:4: Multiple substitutions specified in non-positional format of string resource string/during_day_at. Did you mean to add the formatted=\"false\" attribute?\n/build/.gradle/caches/transforms-3/1fbb3dccd22c860adfb8fae6ccb06cee/transformed/jetified-commons-b34aef8104/res/values-ro/values-ro.xml:392:4: Multiple substitutions specified in non-positional format of string resource string/during_day_at. Did you mean to add the formatted=\"false\" attribute?\n/build/.gradle/caches/transforms-3/1fbb3dccd22c860adfb8fae6ccb06cee/transformed/jetified-commons-b34aef8104/res/values-ru/values-ru.xml:406:4: Multiple substitutions specified in non-positional format of string resource string/during_day_at. Did you mean to add the formatted=\"false\" attribute?\n/build/.gradle/caches/transforms-3/1fbb3dccd22c860adfb8fae6ccb06cee/transformed/jetified-commons-b34aef8104/res/values-sv/values-sv.xml:364:4: Multiple substitutions specified in non-positional format of string resource string/during_day_at. Did you mean to add the formatted=\"false\" attribute?\n/build/.gradle/caches/transforms-3/1fbb3dccd22c860adfb8fae6ccb06cee/transformed/jetified-commons-b34aef8104/res/values-be/values-be.xml:435:4: Multiple substitutions specified in non-positional format of string resource string/during_day_at. Did you mean to add the formatted=\"false\" attribute?\n/build/.gradle/caches/transforms-3/1fbb3dccd22c860adfb8fae6ccb06cee/transformed/jetified-commons-b34aef8104/res/values-bs/values-bs.xml:401:4: Multiple substitutions specified in non-positional format of string resource string/during_day_at. Did you mean to add the formatted=\"false\" attribute?\n/build/.gradle/caches/transforms-3/1fbb3dccd22c860adfb8fae6ccb06cee/transformed/jetified-commons-b34aef8104/res/values-de/values-de.xml:364:4: Multiple substitutions specified in non-positional format of string resource string/during_day_at. Did you mean to add the formatted=\"false\" attribute?\n/build/.gradle/caches/transforms-3/1fbb3dccd22c860adfb8fae6ccb06cee/transformed/jetified-commons-b34aef8104/res/values-pa-rPK/values-pa-rPK.xml:357:4: Multiple substitutions specified in non-positional format of string resource string/during_day_at. Did you mean to add the formatted=\"false\" attribute?\n/build/.gradle/caches/transforms-3/1fbb3dccd22c860adfb8fae6ccb06cee/transformed/jetified-commons-b34aef8104/res/values-bn/values-bn.xml:358:4: Multiple substitutions specified in non-positional format of string resource string/during_day_at. Did you mean to add the formatted=\"false\" attribute?\n/build/.gradle/caches/transforms-3/1fbb3dccd22c860adfb8fae6ccb06cee/transformed/jetified-commons-b34aef8104/res/values-ca/values-ca.xml:364:4: Multiple substitutions specified in non-positional format of string resource string/during_day_at. Did you mean to add the formatted=\"false\" attribute?\n/build/.gradle/caches/transforms-3/1fbb3dccd22c860adfb8fae6ccb06cee/transformed/jetified-commons-b34aef8104/res/values-ml/values-ml.xml:358:4: Multiple substitutions specified in non-positional format of string resource string/during_day_at. Did you mean to add the formatted=\"false\" attribute?\n/build/.gradle/caches/transforms-3/1fbb3dccd22c860adfb8fae6ccb06cee/transformed/jetified-commons-b34aef8104/res/values-cy/values-cy.xml:506:4: Multiple substitutions specified in non-positional format of string resource string/during_day_at. Did you mean to add the formatted=\"false\" attribute?\n/build/.gradle/caches/transforms-3/1fbb3dccd22c860adfb8fae6ccb06cee/transformed/jetified-commons-b34aef8104/res/values-ta/values-ta.xml:358:4: Multiple substitutions specified in non-positional format of string resource string/during_day_at. Did you mean to add the formatted=\"false\" attribute?\n/build/.gradle/caches/transforms-3/1fbb3dccd22c860adfb8fae6ccb06cee/transformed/jetified-commons-b34aef8104/res/values-el/values-el.xml:358:4: Multiple substitutions specified in non-positional format of string resource string/during_day_at. Did you mean to add the formatted=\"false\" attribute?\n/build/.gradle/caches/transforms-3/1fbb3dccd22c860adfb8fae6ccb06cee/transformed/jetified-commons-b34aef8104/res/values-tr/values-tr.xml:364:4: Multiple substitutions specified in non-positional format of string resource string/during_day_at. Did you mean to add the formatted=\"false\" attribute?\n/build/.gradle/caches/transforms-3/1fbb3dccd22c860adfb8fae6ccb06cee/transformed/jetified-commons-b34aef8104/res/values-es/values-es.xml:402:4: Multiple substitutions specified in non-positional format of string resource string/during_day_at. Did you mean to add the formatted=\"false\" attribute?\n/build/.gradle/caches/transforms-3/1fbb3dccd22c860adfb8fae6ccb06cee/transformed/jetified-commons-b34aef8104/res/values-cs/values-cs.xml:401:4: Multiple substitutions specified in non-positional format of string resource string/during_day_at. Did you mean to add the formatted=\"false\" attribute?\n/build/.gradle/caches/transforms-3/1fbb3dccd22c860adfb8fae6ccb06cee/transformed/jetified-commons-b34aef8104/res/values-lt/values-lt.xml:393:4: Multiple substitutions specified in non-positional format of string resource string/during_day_at. Did you mean to add the formatted=\"false\" attribute?\n/build/.gradle/caches/transforms-3/1fbb3dccd22c860adfb8fae6ccb06cee/transformed/jetified-commons-b34aef8104/res/values-vi/values-vi.xml:358:4: Multiple substitutions specified in non-positional format of string resource string/during_day_at. Did you mean to add the formatted=\"false\" attribute?\n/build/.gradle/caches/transforms-3/1fbb3dccd22c860adfb8fae6ccb06cee/transformed/jetified-commons-b34aef8104/res/values-th/values-th.xml:358:4: Multiple substitutions specified in non-positional format of string resource string/during_day_at. Did you mean to add the formatted=\"false\" attribute?\n/build/.gradle/caches/transforms-3/1fbb3dccd22c860adfb8fae6ccb06cee/transformed/jetified-commons-b34aef8104/res/values-hi-rIN/values-hi-rIN.xml:358:4: Multiple substitutions specified in non-positional format of string resource string/during_day_at. Did you mean to add the formatted=\"false\" attribute?\n/build/.gradle/caches/transforms-3/1fbb3dccd22c860adfb8fae6ccb06cee/transformed/jetified-commons-b34aef8104/res/values-ko-rKR/values-ko-rKR.xml:327:4: Multiple substitutions specified in non-positional format of string resource string/during_day_at. Did you mean to add the formatted=\"false\" attribute?\n/build/.gradle/caches/transforms-3/1fbb3dccd22c860adfb8fae6ccb06cee/transformed/jetified-commons-b34aef8104/res/values-da/values-da.xml:358:4: Multiple substitutions specified in non-positional format of string resource string/during_day_at. Did you mean to add the formatted=\"false\" attribute?\n/build/.gradle/caches/transforms-3/1fbb3dccd22c860adfb8fae6ccb06cee/transformed/jetified-commons-b34aef8104/res/values-eo/values-eo.xml:358:4: Multiple substitutions specified in non-positional format of string resource string/during_day_at. Did you mean to add the formatted=\"false\" attribute?\n/build/.gradle/caches/transforms-3/1fbb3dccd22c860adfb8fae6ccb06cee/transformed/jetified-commons-b34aef8104/res/values-ja/values-ja.xml:322:4: Multiple substitutions specified in non-positional format of string resource string/during_day_at. Did you mean to add the formatted=\"false\" attribute?\n/build/.gradle/caches/transforms-3/1fbb3dccd22c860adfb8fae6ccb06cee/transformed/jetified-commons-b34aef8104/res/values-zh-rCN/values-zh-rCN.xml:323:4: Multiple substitutions specified in non-positional format of string resource string/during_day_at. Did you mean to add the formatted=\"false\" attribute?\n/build/.gradle/caches/transforms-3/1fbb3dccd22c860adfb8fae6ccb06cee/transformed/jetified-commons-b34aef8104/res/values-zh-rTW/values-zh-rTW.xml:325:4: Multiple substitutions specified in non-positional format of string resource string/during_day_at. Did you mean to add the formatted=\"false\" attribute?\n/build/.gradle/caches/transforms-3/1fbb3dccd22c860adfb8fae6ccb06cee/transformed/jetified-commons-b34aef8104/res/values-eu/values-eu.xml:365:4: Multiple substitutions specified in non-positional format of string resource string/during_day_at. Did you mean to add the formatted=\"false\" attribute?\n/build/.gradle/caches/transforms-3/1fbb3dccd22c860adfb8fae6ccb06cee/transformed/jetified-commons-b34aef8104/res/values-gl/values-gl.xml:358:4: Multiple substitutions specified in non-positional format of string resource string/during_day_at. Did you mean to add the formatted=\"false\" attribute?\n/build/.gradle/caches/transforms-3/1fbb3dccd22c860adfb8fae6ccb06cee/transformed/jetified-commons-b34aef8104/res/values-et/values-et.xml:365:4: Multiple substitutions specified in non-positional format of string resource string/during_day_at. Did you mean to add the formatted=\"false\" attribute?\n/build/.gradle/caches/transforms-3/1fbb3dccd22c860adfb8fae6ccb06cee/transformed/jetified-commons-b34aef8104/res/values-nl/values-nl.xml:364:4: Multiple substitutions specified in non-positional format of string resource string/during_day_at. Did you mean to add the formatted=\"false\" attribute?\n/build/.gradle/caches/transforms-3/1fbb3dccd22c860adfb8fae6ccb06cee/transformed/jetified-commons-b34aef8104/res/values-pa/values-pa.xml:358:4: Multiple substitutions specified in non-positional format of string resource string/during_day_at. Did you mean to add the formatted=\"false\" attribute?\n/build/.gradle/caches/transforms-3/1fbb3dccd22c860adfb8fae6ccb06cee/transformed/jetified-commons-b34aef8104/res/values-sk/values-sk.xml:395:4: Multiple substitutions specified in non-positional format of string resource string/during_day_at. Did you mean to add the formatted=\"false\" attribute?\n/build/.gradle/caches/transforms-3/1fbb3dccd22c860adfb8fae6ccb06cee/transformed/jetified-commons-b34aef8104/res/values-fa/values-fa.xml:358:4: Multiple substitutions specified in non-positional format of string resource string/during_day_at. Did you mean to add the formatted=\"false\" attribute?\n/build/.gradle/caches/transforms-3/1fbb3dccd22c860adfb8fae6ccb06cee/transformed/jetified-commons-b34aef8104/res/values-pl/values-pl.xml:433:4: Multiple substitutions specified in non-positional format of string resource string/during_day_at. Did you mean to add the formatted=\"false\" attribute?\n/build/.gradle/caches/transforms-3/1fbb3dccd22c860adfb8fae6ccb06cee/transformed/jetified-commons-b34aef8104/res/values-sr/values-sr.xml:393:4: Multiple substitutions specified in non-positional format of string resource string/during_day_at. Did you mean to add the formatted=\"false\" attribute?\n/build/.gradle/caches/transforms-3/1fbb3dccd22c860adfb8fae6ccb06cee/transformed/jetified-commons-b34aef8104/res/values-fi/values-fi.xml:365:4: Multiple substitutions specified in non-positional format of string resource string/during_day_at. Did you mean to add the formatted=\"false\" attribute?\n\n> Task :app:generateCoreReleaseBuildConfig\n> Task :app:mapCoreReleaseSourceSetPaths\n> Task :app:checkCoreReleaseAarMetadata\n> Task :app:createCoreReleaseCompatibleScreenManifests\n> Task :app:extractDeepLinksCoreRelease\n\n> Task :app:mergeCoreReleaseResources\n/build/.gradle/caches/transforms-3/1fbb3dccd22c860adfb8fae6ccb06cee/transformed/jetified-commons-b34aef8104/res/values-pt-rBR/values-pt-rBR.xml:394:4: Multiple substitutions specified in non-positional format of string resource string/during_day_at. Did you mean to add the formatted=\"false\" attribute?\n/build/.gradle/caches/transforms-3/1fbb3dccd22c860adfb8fae6ccb06cee/transformed/jetified-commons-b34aef8104/res/values-fr/values-fr.xml:396:4: Multiple substitutions specified in non-positional format of string resource string/during_day_at. Did you mean to add the formatted=\"false\" attribute?\n/build/.gradle/caches/transforms-3/1fbb3dccd22c860adfb8fae6ccb06cee/transformed/jetified-commons-b34aef8104/res/values-uk/values-uk.xml:439:4: Multiple substitutions specified in non-positional format of string resource string/during_day_at. Did you mean to add the formatted=\"false\" attribute?\n\n> Task :app:processCoreReleaseMainManifest\n/build/repo/app/src/main/AndroidManifest.xml Warning:\n\tuses-permission#com.samsung.android.providers.context.permission.WRITE_USE_APP_FEATURE_SURVEY was tagged at AndroidManifest.xml:0 to remove other declarations but no other declaration present\n\n> Task :app:dataBindingGenBaseClassesCoreRelease\n> Task :app:processCoreReleaseManifest\n> Task :app:javaPreCompileCoreRelease\n> Task :app:extractProguardFiles\n> Task :app:mergeCoreReleaseArtProfile\n> Task :app:mergeCoreReleaseShaders\n> Task :app:compileCoreReleaseShaders NO-SOURCE\n> Task :app:generateCoreReleaseAssets UP-TO-DATE\n> Task :app:mergeCoreReleaseAssets\n> Task :app:compressCoreReleaseAssets\n> Task :app:collectCoreReleaseDependencies\n> Task :app:sdkCoreReleaseDependencyData\n> Task :app:writeCoreReleaseAppMetadata\n> Task :app:writeCoreReleaseSigningConfigVersions\n> Task :app:preFossReleaseBuild UP-TO-DATE\n> Task :app:mergeFossReleaseJniLibFolders\n> Task :app:mergeFossReleaseNativeLibs NO-SOURCE\n> Task :app:stripFossReleaseDebugSymbols NO-SOURCE\n> Task :app:extractFossReleaseNativeSymbolTables NO-SOURCE\n> Task :app:mergeFossReleaseNativeDebugMetadata NO-SOURCE\n> Task :app:checkFossReleaseDuplicateClasses\n> Task :app:generateFossReleaseResValues\n> Task :app:generateFossReleaseResources\n> Task :app:dataBindingMergeDependencyArtifactsFossRelease\n> Task :app:generateFossReleaseBuildConfig\n> Task :app:mapFossReleaseSourceSetPaths\n> Task :app:createFossReleaseCompatibleScreenManifests\n> Task :app:extractDeepLinksFossRelease\n\n> Task :app:mergeFossReleaseResources\n/build/.gradle/caches/transforms-3/1fbb3dccd22c860adfb8fae6ccb06cee/transformed/jetified-commons-b34aef8104/res/values-hr/values-hr.xml:401:4: Multiple substitutions specified in non-positional format of string resource string/during_day_at. Did you mean to add the formatted=\"false\" attribute?\n/build/.gradle/caches/transforms-3/1fbb3dccd22c860adfb8fae6ccb06cee/transformed/jetified-commons-b34aef8104/res/values/values.xml:1157:4: Multiple substitutions specified in non-positional format of string resource string/during_day_at. Did you mean to add the formatted=\"false\" attribute?\n/build/.gradle/caches/transforms-3/1fbb3dccd22c860adfb8fae6ccb06cee/transformed/jetified-commons-b34aef8104/res/values-pt/values-pt.xml:400:4: Multiple substitutions specified in non-positional format of string resource string/during_day_at. Did you mean to add the formatted=\"false\" attribute?\n/build/.gradle/caches/transforms-3/1fbb3dccd22c860adfb8fae6ccb06cee/transformed/jetified-commons-b34aef8104/res/values-it/values-it.xml:389:4: Multiple substitutions specified in non-positional format of string resource string/during_day_at. Did you mean to add the formatted=\"false\" attribute?\n/build/.gradle/caches/transforms-3/1fbb3dccd22c860adfb8fae6ccb06cee/transformed/jetified-commons-b34aef8104/res/values-hu/values-hu.xml:364:4: Multiple substitutions specified in non-positional format of string resource string/during_day_at. Did you mean to add the formatted=\"false\" attribute?\n/build/.gradle/caches/transforms-3/1fbb3dccd22c860adfb8fae6ccb06cee/transformed/jetified-commons-b34aef8104/res/values-zh-rHK/values-zh-rHK.xml:326:4: Multiple substitutions specified in non-positional format of string resource string/during_day_at. Did you mean to add the formatted=\"false\" attribute?\n/build/.gradle/caches/transforms-3/1fbb3dccd22c860adfb8fae6ccb06cee/transformed/jetified-commons-b34aef8104/res/values-bg/values-bg.xml:366:4: Multiple substitutions specified in non-positional format of string resource string/during_day_at. Did you mean to add the formatted=\"false\" attribute?\n/build/.gradle/caches/transforms-3/1fbb3dccd22c860adfb8fae6ccb06cee/transformed/jetified-commons-b34aef8104/res/values-iw/values-iw.xml:358:4: Multiple substitutions specified in non-positional format of string resource string/during_day_at. Did you mean to add the formatted=\"false\" attribute?\n\n> Task :app:processFossReleaseMainManifest\n/build/repo/app/src/main/AndroidManifest.xml Warning:\n\tuses-permission#com.samsung.android.providers.context.permission.WRITE_USE_APP_FEATURE_SURVEY was tagged at AndroidManifest.xml:0 to remove other declarations but no other declaration present\n\n> Task :app:processFossReleaseManifest\n> Task :app:checkFossReleaseAarMetadata\n> Task :app:processCoreReleaseManifestForPackage\n> Task :app:javaPreCompileFossRelease\n\n> Task :app:mergeFossReleaseResources\n/build/.gradle/caches/transforms-3/1fbb3dccd22c860adfb8fae6ccb06cee/transformed/jetified-commons-b34aef8104/res/values-br/values-br.xml:358:4: Multiple substitutions specified in non-positional format of string resource string/during_day_at. Did you mean to add the formatted=\"false\" attribute?\n/build/.gradle/caches/transforms-3/1fbb3dccd22c860adfb8fae6ccb06cee/transformed/jetified-commons-b34aef8104/res/values-sl/values-sl.xml:437:4: Multiple substitutions specified in non-positional format of string resource string/during_day_at. Did you mean to add the formatted=\"false\" attribute?\n/build/.gradle/caches/transforms-3/1fbb3dccd22c860adfb8fae6ccb06cee/transformed/jetified-commons-b34aef8104/res/values-ru/values-ru.xml:406:4: Multiple substitutions specified in non-positional format of string resource string/during_day_at. Did you mean to add the formatted=\"false\" attribute?\n/build/.gradle/caches/transforms-3/1fbb3dccd22c860adfb8fae6ccb06cee/transformed/jetified-commons-b34aef8104/res/values-bs/values-bs.xml:401:4: Multiple substitutions specified in non-positional format of string resource string/during_day_at. Did you mean to add the formatted=\"false\" attribute?\n/build/.gradle/caches/transforms-3/1fbb3dccd22c860adfb8fae6ccb06cee/transformed/jetified-commons-b34aef8104/res/values-in/values-in.xml:332:4: Multiple substitutions specified in non-positional format of string resource string/during_day_at. Did you mean to add the formatted=\"false\" attribute?\n/build/.gradle/caches/transforms-3/1fbb3dccd22c860adfb8fae6ccb06cee/transformed/jetified-commons-b34aef8104/res/values-sv/values-sv.xml:364:4: Multiple substitutions specified in non-positional format of string resource string/during_day_at. Did you mean to add the formatted=\"false\" attribute?\n/build/.gradle/caches/transforms-3/1fbb3dccd22c860adfb8fae6ccb06cee/transformed/jetified-commons-b34aef8104/res/values-nb-rNO/values-nb-rNO.xml:358:4: Multiple substitutions specified in non-positional format of string resource string/during_day_at. Did you mean to add the formatted=\"false\" attribute?\n/build/.gradle/caches/transforms-3/1fbb3dccd22c860adfb8fae6ccb06cee/transformed/jetified-commons-b34aef8104/res/values-ca/values-ca.xml:364:4: Multiple substitutions specified in non-positional format of string resource string/during_day_at. Did you mean to add the formatted=\"false\" attribute?\n/build/.gradle/caches/transforms-3/1fbb3dccd22c860adfb8fae6ccb06cee/transformed/jetified-commons-b34aef8104/res/values-ar/values-ar.xml:512:4: Multiple substitutions specified in non-positional format of string resource string/during_day_at. Did you mean to add the formatted=\"false\" attribute?\n/build/.gradle/caches/transforms-3/1fbb3dccd22c860adfb8fae6ccb06cee/transformed/jetified-commons-b34aef8104/res/values-de/values-de.xml:364:4: Multiple substitutions specified in non-positional format of string resource string/during_day_at. Did you mean to add the formatted=\"false\" attribute?\n/build/.gradle/caches/transforms-3/1fbb3dccd22c860adfb8fae6ccb06cee/transformed/jetified-commons-b34aef8104/res/values-az/values-az.xml:358:4: Multiple substitutions specified in non-positional format of string resource string/during_day_at. Did you mean to add the formatted=\"false\" attribute?\n/build/.gradle/caches/transforms-3/1fbb3dccd22c860adfb8fae6ccb06cee/transformed/jetified-commons-b34aef8104/res/values-ro/values-ro.xml:392:4: Multiple substitutions specified in non-positional format of string resource string/during_day_at. Did you mean to add the formatted=\"false\" attribute?\n/build/.gradle/caches/transforms-3/1fbb3dccd22c860adfb8fae6ccb06cee/transformed/jetified-commons-b34aef8104/res/values-ta/values-ta.xml:358:4: Multiple substitutions specified in non-positional format of string resource string/during_day_at. Did you mean to add the formatted=\"false\" attribute?\n/build/.gradle/caches/transforms-3/1fbb3dccd22c860adfb8fae6ccb06cee/transformed/jetified-commons-b34aef8104/res/values-pa-rPK/values-pa-rPK.xml:357:4: Multiple substitutions specified in non-positional format of string resource string/during_day_at. Did you mean to add the formatted=\"false\" attribute?\n/build/.gradle/caches/transforms-3/1fbb3dccd22c860adfb8fae6ccb06cee/transformed/jetified-commons-b34aef8104/res/values-hi-rIN/values-hi-rIN.xml:358:4: Multiple substitutions specified in non-positional format of string resource string/during_day_at. Did you mean to add the formatted=\"false\" attribute?\n/build/.gradle/caches/transforms-3/1fbb3dccd22c860adfb8fae6ccb06cee/transformed/jetified-commons-b34aef8104/res/values-be/values-be.xml:435:4: Multiple substitutions specified in non-positional format of string resource string/during_day_at. Did you mean to add the formatted=\"false\" attribute?\n/build/.gradle/caches/transforms-3/1fbb3dccd22c860adfb8fae6ccb06cee/transformed/jetified-commons-b34aef8104/res/values-ml/values-ml.xml:358:4: Multiple substitutions specified in non-positional format of string resource string/during_day_at. Did you mean to add the formatted=\"false\" attribute?\n/build/.gradle/caches/transforms-3/1fbb3dccd22c860adfb8fae6ccb06cee/transformed/jetified-commons-b34aef8104/res/values-cs/values-cs.xml:401:4: Multiple substitutions specified in non-positional format of string resource string/during_day_at. Did you mean to add the formatted=\"false\" attribute?\n/build/.gradle/caches/transforms-3/1fbb3dccd22c860adfb8fae6ccb06cee/transformed/jetified-commons-b34aef8104/res/values-bn/values-bn.xml:358:4: Multiple substitutions specified in non-positional format of string resource string/during_day_at. Did you mean to add the formatted=\"false\" attribute?\n/build/.gradle/caches/transforms-3/1fbb3dccd22c860adfb8fae6ccb06cee/transformed/jetified-commons-b34aef8104/res/values-ja/values-ja.xml:322:4: Multiple substitutions specified in non-positional format of string resource string/during_day_at. Did you mean to add the formatted=\"false\" attribute?\n/build/.gradle/caches/transforms-3/1fbb3dccd22c860adfb8fae6ccb06cee/transformed/jetified-commons-b34aef8104/res/values-th/values-th.xml:358:4: Multiple substitutions specified in non-positional format of string resource string/during_day_at. Did you mean to add the formatted=\"false\" attribute?\n/build/.gradle/caches/transforms-3/1fbb3dccd22c860adfb8fae6ccb06cee/transformed/jetified-commons-b34aef8104/res/values-da/values-da.xml:358:4: Multiple substitutions specified in non-positional format of string resource string/during_day_at. Did you mean to add the formatted=\"false\" attribute?\n/build/.gradle/caches/transforms-3/1fbb3dccd22c860adfb8fae6ccb06cee/transformed/jetified-commons-b34aef8104/res/values-el/values-el.xml:358:4: Multiple substitutions specified in non-positional format of string resource string/during_day_at. Did you mean to add the formatted=\"false\" attribute?\n/build/.gradle/caches/transforms-3/1fbb3dccd22c860adfb8fae6ccb06cee/transformed/jetified-commons-b34aef8104/res/values-es/values-es.xml:402:4: Multiple substitutions specified in non-positional format of string resource string/during_day_at. Did you mean to add the formatted=\"false\" attribute?\n/build/.gradle/caches/transforms-3/1fbb3dccd22c860adfb8fae6ccb06cee/transformed/jetified-commons-b34aef8104/res/values-zh-rTW/values-zh-rTW.xml:325:4: Multiple substitutions specified in non-positional format of string resource string/during_day_at. Did you mean to add the formatted=\"false\" attribute?\n/build/.gradle/caches/transforms-3/1fbb3dccd22c860adfb8fae6ccb06cee/transformed/jetified-commons-b34aef8104/res/values-cy/values-cy.xml:506:4: Multiple substitutions specified in non-positional format of string resource string/during_day_at. Did you mean to add the formatted=\"false\" attribute?\n/build/.gradle/caches/transforms-3/1fbb3dccd22c860adfb8fae6ccb06cee/transformed/jetified-commons-b34aef8104/res/values-sk/values-sk.xml:395:4: Multiple substitutions specified in non-positional format of string resource string/during_day_at. Did you mean to add the formatted=\"false\" attribute?\n/build/.gradle/caches/transforms-3/1fbb3dccd22c860adfb8fae6ccb06cee/transformed/jetified-commons-b34aef8104/res/values-et/values-et.xml:365:4: Multiple substitutions specified in non-positional format of string resource string/during_day_at. Did you mean to add the formatted=\"false\" attribute?\n/build/.gradle/caches/transforms-3/1fbb3dccd22c860adfb8fae6ccb06cee/transformed/jetified-commons-b34aef8104/res/values-vi/values-vi.xml:358:4: Multiple substitutions specified in non-positional format of string resource string/during_day_at. Did you mean to add the formatted=\"false\" attribute?\n/build/.gradle/caches/transforms-3/1fbb3dccd22c860adfb8fae6ccb06cee/transformed/jetified-commons-b34aef8104/res/values-fa/values-fa.xml:358:4: Multiple substitutions specified in non-positional format of string resource string/during_day_at. Did you mean to add the formatted=\"false\" attribute?\n/build/.gradle/caches/transforms-3/1fbb3dccd22c860adfb8fae6ccb06cee/transformed/jetified-commons-b34aef8104/res/values-sr/values-sr.xml:393:4: Multiple substitutions specified in non-positional format of string resource string/during_day_at. Did you mean to add the formatted=\"false\" attribute?\n/build/.gradle/caches/transforms-3/1fbb3dccd22c860adfb8fae6ccb06cee/transformed/jetified-commons-b34aef8104/res/values-tr/values-tr.xml:364:4: Multiple substitutions specified in non-positional format of string resource string/during_day_at. Did you mean to add the formatted=\"false\" attribute?\n/build/.gradle/caches/transforms-3/1fbb3dccd22c860adfb8fae6ccb06cee/transformed/jetified-commons-b34aef8104/res/values-fi/values-fi.xml:365:4: Multiple substitutions specified in non-positional format of string resource string/during_day_at. Did you mean to add the formatted=\"false\" attribute?\n/build/.gradle/caches/transforms-3/1fbb3dccd22c860adfb8fae6ccb06cee/transformed/jetified-commons-b34aef8104/res/values-ko-rKR/values-ko-rKR.xml:327:4: Multiple substitutions specified in non-positional format of string resource string/during_day_at. Did you mean to add the formatted=\"false\" attribute?\n/build/.gradle/caches/transforms-3/1fbb3dccd22c860adfb8fae6ccb06cee/transformed/jetified-commons-b34aef8104/res/values-lt/values-lt.xml:393:4: Multiple substitutions specified in non-positional format of string resource string/during_day_at. Did you mean to add the formatted=\"false\" attribute?\n/build/.gradle/caches/transforms-3/1fbb3dccd22c860adfb8fae6ccb06cee/transformed/jetified-commons-b34aef8104/res/values-pt-rBR/values-pt-rBR.xml:394:4: Multiple substitutions specified in non-positional format of string resource string/during_day_at. Did you mean to add the formatted=\"false\" attribute?\n/build/.gradle/caches/transforms-3/1fbb3dccd22c860adfb8fae6ccb06cee/transformed/jetified-commons-b34aef8104/res/values-zh-rCN/values-zh-rCN.xml:323:4: Multiple substitutions specified in non-positional format of string resource string/during_day_at. Did you mean to add the formatted=\"false\" attribute?\n/build/.gradle/caches/transforms-3/1fbb3dccd22c860adfb8fae6ccb06cee/transformed/jetified-commons-b34aef8104/res/values-eo/values-eo.xml:358:4: Multiple substitutions specified in non-positional format of string resource string/during_day_at. Did you mean to add the formatted=\"false\" attribute?\n/build/.gradle/caches/transforms-3/1fbb3dccd22c860adfb8fae6ccb06cee/transformed/jetified-commons-b34aef8104/res/values-uk/values-uk.xml:439:4: Multiple substitutions specified in non-positional format of string resource string/during_day_at. Did you mean to add the formatted=\"false\" attribute?\n/build/.gradle/caches/transforms-3/1fbb3dccd22c860adfb8fae6ccb06cee/transformed/jetified-commons-b34aef8104/res/values-fr/values-fr.xml:396:4: Multiple substitutions specified in non-positional format of string resource string/during_day_at. Did you mean to add the formatted=\"false\" attribute?\n/build/.gradle/caches/transforms-3/1fbb3dccd22c860adfb8fae6ccb06cee/transformed/jetified-commons-b34aef8104/res/values-eu/values-eu.xml:365:4: Multiple substitutions specified in non-positional format of string resource string/during_day_at. Did you mean to add the formatted=\"false\" attribute?\n/build/.gradle/caches/transforms-3/1fbb3dccd22c860adfb8fae6ccb06cee/transformed/jetified-commons-b34aef8104/res/values-gl/values-gl.xml:358:4: Multiple substitutions specified in non-positional format of string resource string/during_day_at. Did you mean to add the formatted=\"false\" attribute?\n/build/.gradle/caches/transforms-3/1fbb3dccd22c860adfb8fae6ccb06cee/transformed/jetified-commons-b34aef8104/res/values-pa/values-pa.xml:358:4: Multiple substitutions specified in non-positional format of string resource string/during_day_at. Did you mean to add the formatted=\"false\" attribute?\n/build/.gradle/caches/transforms-3/1fbb3dccd22c860adfb8fae6ccb06cee/transformed/jetified-commons-b34aef8104/res/values-nl/values-nl.xml:364:4: Multiple substitutions specified in non-positional format of string resource string/during_day_at. Did you mean to add the formatted=\"false\" attribute?\n/build/.gradle/caches/transforms-3/1fbb3dccd22c860adfb8fae6ccb06cee/transformed/jetified-commons-b34aef8104/res/values-pl/values-pl.xml:433:4: Multiple substitutions specified in non-positional format of string resource string/during_day_at. Did you mean to add the formatted=\"false\" attribute?\n\n> Task :app:dataBindingGenBaseClassesFossRelease\n> Task :app:mergeFossReleaseArtProfile\n> Task :app:mergeFossReleaseShaders\n> Task :app:compileFossReleaseShaders NO-SOURCE\n> Task :app:generateFossReleaseAssets UP-TO-DATE\n> Task :app:mergeFossReleaseAssets\n> Task :app:compressFossReleaseAssets\n> Task :app:collectFossReleaseDependencies\n> Task :app:sdkFossReleaseDependencyData\n> Task :app:writeFossReleaseAppMetadata\n> Task :app:writeFossReleaseSigningConfigVersions\n> Task :app:prePrepaidReleaseBuild UP-TO-DATE\n> Task :app:mergePrepaidReleaseJniLibFolders\n> Task :app:mergePrepaidReleaseNativeLibs NO-SOURCE\n> Task :app:stripPrepaidReleaseDebugSymbols NO-SOURCE\n> Task :app:extractPrepaidReleaseNativeSymbolTables NO-SOURCE\n> Task :app:mergePrepaidReleaseNativeDebugMetadata NO-SOURCE\n> Task :app:processFossReleaseManifestForPackage\n> Task :app:checkPrepaidReleaseDuplicateClasses\n> Task :app:dataBindingMergeDependencyArtifactsPrepaidRelease\n> Task :app:generatePrepaidReleaseResValues\n> Task :app:generatePrepaidReleaseResources\n> Task :app:processCoreReleaseResources\n> Task :app:processFossReleaseResources\n\n> Task :app:mergePrepaidReleaseResources\n/build/.gradle/caches/transforms-3/1fbb3dccd22c860adfb8fae6ccb06cee/transformed/jetified-commons-b34aef8104/res/values/values.xml:1157:4: Multiple substitutions specified in non-positional format of string resource string/during_day_at. Did you mean to add the formatted=\"false\" attribute?\n/build/.gradle/caches/transforms-3/1fbb3dccd22c860adfb8fae6ccb06cee/transformed/jetified-commons-b34aef8104/res/values-hr/values-hr.xml:401:4: Multiple substitutions specified in non-positional format of string resource string/during_day_at. Did you mean to add the formatted=\"false\" attribute?\n/build/.gradle/caches/transforms-3/1fbb3dccd22c860adfb8fae6ccb06cee/transformed/jetified-commons-b34aef8104/res/values-it/values-it.xml:389:4: Multiple substitutions specified in non-positional format of string resource string/during_day_at. Did you mean to add the formatted=\"false\" attribute?\n/build/.gradle/caches/transforms-3/1fbb3dccd22c860adfb8fae6ccb06cee/transformed/jetified-commons-b34aef8104/res/values-pt/values-pt.xml:400:4: Multiple substitutions specified in non-positional format of string resource string/during_day_at. Did you mean to add the formatted=\"false\" attribute?\n/build/.gradle/caches/transforms-3/1fbb3dccd22c860adfb8fae6ccb06cee/transformed/jetified-commons-b34aef8104/res/values-hu/values-hu.xml:364:4: Multiple substitutions specified in non-positional format of string resource string/during_day_at. Did you mean to add the formatted=\"false\" attribute?\n/build/.gradle/caches/transforms-3/1fbb3dccd22c860adfb8fae6ccb06cee/transformed/jetified-commons-b34aef8104/res/values-bg/values-bg.xml:366:4: Multiple substitutions specified in non-positional format of string resource string/during_day_at. Did you mean to add the formatted=\"false\" attribute?\n/build/.gradle/caches/transforms-3/1fbb3dccd22c860adfb8fae6ccb06cee/transformed/jetified-commons-b34aef8104/res/values-zh-rHK/values-zh-rHK.xml:326:4: Multiple substitutions specified in non-positional format of string resource string/during_day_at. Did you mean to add the formatted=\"false\" attribute?\n/build/.gradle/caches/transforms-3/1fbb3dccd22c860adfb8fae6ccb06cee/transformed/jetified-commons-b34aef8104/res/values-in/values-in.xml:332:4: Multiple substitutions specified in non-positional format of string resource string/during_day_at. Did you mean to add the formatted=\"false\" attribute?\n/build/.gradle/caches/transforms-3/1fbb3dccd22c860adfb8fae6ccb06cee/transformed/jetified-commons-b34aef8104/res/values-br/values-br.xml:358:4: Multiple substitutions specified in non-positional format of string resource string/during_day_at. Did you mean to add the formatted=\"false\" attribute?\n/build/.gradle/caches/transforms-3/1fbb3dccd22c860adfb8fae6ccb06cee/transformed/jetified-commons-b34aef8104/res/values-iw/values-iw.xml:358:4: Multiple substitutions specified in non-positional format of string resource string/during_day_at. Did you mean to add the formatted=\"false\" attribute?\n/build/.gradle/caches/transforms-3/1fbb3dccd22c860adfb8fae6ccb06cee/transformed/jetified-commons-b34aef8104/res/values-nb-rNO/values-nb-rNO.xml:358:4: Multiple substitutions specified in non-positional format of string resource string/during_day_at. Did you mean to add the formatted=\"false\" attribute?\n/build/.gradle/caches/transforms-3/1fbb3dccd22c860adfb8fae6ccb06cee/transformed/jetified-commons-b34aef8104/res/values-sl/values-sl.xml:437:4: Multiple substitutions specified in non-positional format of string resource string/during_day_at. Did you mean to add the formatted=\"false\" attribute?\n/build/.gradle/caches/transforms-3/1fbb3dccd22c860adfb8fae6ccb06cee/transformed/jetified-commons-b34aef8104/res/values-ar/values-ar.xml:512:4: Multiple substitutions specified in non-positional format of string resource string/during_day_at. Did you mean to add the formatted=\"false\" attribute?\n/build/.gradle/caches/transforms-3/1fbb3dccd22c860adfb8fae6ccb06cee/transformed/jetified-commons-b34aef8104/res/values-sv/values-sv.xml:364:4: Multiple substitutions specified in non-positional format of string resource string/during_day_at. Did you mean to add the formatted=\"false\" attribute?\n/build/.gradle/caches/transforms-3/1fbb3dccd22c860adfb8fae6ccb06cee/transformed/jetified-commons-b34aef8104/res/values-ru/values-ru.xml:406:4: Multiple substitutions specified in non-positional format of string resource string/during_day_at. Did you mean to add the formatted=\"false\" attribute?\n/build/.gradle/caches/transforms-3/1fbb3dccd22c860adfb8fae6ccb06cee/transformed/jetified-commons-b34aef8104/res/values-de/values-de.xml:364:4: Multiple substitutions specified in non-positional format of string resource string/during_day_at. Did you mean to add the formatted=\"false\" attribute?\n/build/.gradle/caches/transforms-3/1fbb3dccd22c860adfb8fae6ccb06cee/transformed/jetified-commons-b34aef8104/res/values-bs/values-bs.xml:401:4: Multiple substitutions specified in non-positional format of string resource string/during_day_at. Did you mean to add the formatted=\"false\" attribute?\n/build/.gradle/caches/transforms-3/1fbb3dccd22c860adfb8fae6ccb06cee/transformed/jetified-commons-b34aef8104/res/values-pa-rPK/values-pa-rPK.xml:357:4: Multiple substitutions specified in non-positional format of string resource string/during_day_at. Did you mean to add the formatted=\"false\" attribute?\n/build/.gradle/caches/transforms-3/1fbb3dccd22c860adfb8fae6ccb06cee/transformed/jetified-commons-b34aef8104/res/values-ca/values-ca.xml:364:4: Multiple substitutions specified in non-positional format of string resource string/during_day_at. Did you mean to add the formatted=\"false\" attribute?\n/build/.gradle/caches/transforms-3/1fbb3dccd22c860adfb8fae6ccb06cee/transformed/jetified-commons-b34aef8104/res/values-ml/values-ml.xml:358:4: Multiple substitutions specified in non-positional format of string resource string/during_day_at. Did you mean to add the formatted=\"false\" attribute?\n/build/.gradle/caches/transforms-3/1fbb3dccd22c860adfb8fae6ccb06cee/transformed/jetified-commons-b34aef8104/res/values-az/values-az.xml:358:4: Multiple substitutions specified in non-positional format of string resource string/during_day_at. Did you mean to add the formatted=\"false\" attribute?\n/build/.gradle/caches/transforms-3/1fbb3dccd22c860adfb8fae6ccb06cee/transformed/jetified-commons-b34aef8104/res/values-ta/values-ta.xml:358:4: Multiple substitutions specified in non-positional format of string resource string/during_day_at. Did you mean to add the formatted=\"false\" attribute?\n/build/.gradle/caches/transforms-3/1fbb3dccd22c860adfb8fae6ccb06cee/transformed/jetified-commons-b34aef8104/res/values-el/values-el.xml:358:4: Multiple substitutions specified in non-positional format of string resource string/during_day_at. Did you mean to add the formatted=\"false\" attribute?\n/build/.gradle/caches/transforms-3/1fbb3dccd22c860adfb8fae6ccb06cee/transformed/jetified-commons-b34aef8104/res/values-cs/values-cs.xml:401:4: Multiple substitutions specified in non-positional format of string resource string/during_day_at. Did you mean to add the formatted=\"false\" attribute?\n/build/.gradle/caches/transforms-3/1fbb3dccd22c860adfb8fae6ccb06cee/transformed/jetified-commons-b34aef8104/res/values-hi-rIN/values-hi-rIN.xml:358:4: Multiple substitutions specified in non-positional format of string resource string/during_day_at. Did you mean to add the formatted=\"false\" attribute?\n/build/.gradle/caches/transforms-3/1fbb3dccd22c860adfb8fae6ccb06cee/transformed/jetified-commons-b34aef8104/res/values-ro/values-ro.xml:392:4: Multiple substitutions specified in non-positional format of string resource string/during_day_at. Did you mean to add the formatted=\"false\" attribute?\n/build/.gradle/caches/transforms-3/1fbb3dccd22c860adfb8fae6ccb06cee/transformed/jetified-commons-b34aef8104/res/values-th/values-th.xml:358:4: Multiple substitutions specified in non-positional format of string resource string/during_day_at. Did you mean to add the formatted=\"false\" attribute?\n/build/.gradle/caches/transforms-3/1fbb3dccd22c860adfb8fae6ccb06cee/transformed/jetified-commons-b34aef8104/res/values-es/values-es.xml:402:4: Multiple substitutions specified in non-positional format of string resource string/during_day_at. Did you mean to add the formatted=\"false\" attribute?\n/build/.gradle/caches/transforms-3/1fbb3dccd22c860adfb8fae6ccb06cee/transformed/jetified-commons-b34aef8104/res/values-be/values-be.xml:435:4: Multiple substitutions specified in non-positional format of string resource string/during_day_at. Did you mean to add the formatted=\"false\" attribute?\n/build/.gradle/caches/transforms-3/1fbb3dccd22c860adfb8fae6ccb06cee/transformed/jetified-commons-b34aef8104/res/values-ja/values-ja.xml:322:4: Multiple substitutions specified in non-positional format of string resource string/during_day_at. Did you mean to add the formatted=\"false\" attribute?\n/build/.gradle/caches/transforms-3/1fbb3dccd22c860adfb8fae6ccb06cee/transformed/jetified-commons-b34aef8104/res/values-da/values-da.xml:358:4: Multiple substitutions specified in non-positional format of string resource string/during_day_at. Did you mean to add the formatted=\"false\" attribute?\n/build/.gradle/caches/transforms-3/1fbb3dccd22c860adfb8fae6ccb06cee/transformed/jetified-commons-b34aef8104/res/values-vi/values-vi.xml:358:4: Multiple substitutions specified in non-positional format of string resource string/during_day_at. Did you mean to add the formatted=\"false\" attribute?\n/build/.gradle/caches/transforms-3/1fbb3dccd22c860adfb8fae6ccb06cee/transformed/jetified-commons-b34aef8104/res/values-bn/values-bn.xml:358:4: Multiple substitutions specified in non-positional format of string resource string/during_day_at. Did you mean to add the formatted=\"false\" attribute?\n/build/.gradle/caches/transforms-3/1fbb3dccd22c860adfb8fae6ccb06cee/transformed/jetified-commons-b34aef8104/res/values-zh-rTW/values-zh-rTW.xml:325:4: Multiple substitutions specified in non-positional format of string resource string/during_day_at. Did you mean to add the formatted=\"false\" attribute?\n/build/.gradle/caches/transforms-3/1fbb3dccd22c860adfb8fae6ccb06cee/transformed/jetified-commons-b34aef8104/res/values-et/values-et.xml:365:4: Multiple substitutions specified in non-positional format of string resource string/during_day_at. Did you mean to add the formatted=\"false\" attribute?\n/build/.gradle/caches/transforms-3/1fbb3dccd22c860adfb8fae6ccb06cee/transformed/jetified-commons-b34aef8104/res/values-ko-rKR/values-ko-rKR.xml:327:4: Multiple substitutions specified in non-positional format of string resource string/during_day_at. Did you mean to add the formatted=\"false\" attribute?\n/build/.gradle/caches/transforms-3/1fbb3dccd22c860adfb8fae6ccb06cee/transformed/jetified-commons-b34aef8104/res/values-sk/values-sk.xml:395:4: Multiple substitutions specified in non-positional format of string resource string/during_day_at. Did you mean to add the formatted=\"false\" attribute?\n/build/.gradle/caches/transforms-3/1fbb3dccd22c860adfb8fae6ccb06cee/transformed/jetified-commons-b34aef8104/res/values-fa/values-fa.xml:358:4: Multiple substitutions specified in non-positional format of string resource string/during_day_at. Did you mean to add the formatted=\"false\" attribute?\n/build/.gradle/caches/transforms-3/1fbb3dccd22c860adfb8fae6ccb06cee/transformed/jetified-commons-b34aef8104/res/values-cy/values-cy.xml:506:4: Multiple substitutions specified in non-positional format of string resource string/during_day_at. Did you mean to add the formatted=\"false\" attribute?\n/build/.gradle/caches/transforms-3/1fbb3dccd22c860adfb8fae6ccb06cee/transformed/jetified-commons-b34aef8104/res/values-zh-rCN/values-zh-rCN.xml:323:4: Multiple substitutions specified in non-positional format of string resource string/during_day_at. Did you mean to add the formatted=\"false\" attribute?\n/build/.gradle/caches/transforms-3/1fbb3dccd22c860adfb8fae6ccb06cee/transformed/jetified-commons-b34aef8104/res/values-tr/values-tr.xml:364:4: Multiple substitutions specified in non-positional format of string resource string/during_day_at. Did you mean to add the formatted=\"false\" attribute?\n/build/.gradle/caches/transforms-3/1fbb3dccd22c860adfb8fae6ccb06cee/transformed/jetified-commons-b34aef8104/res/values-sr/values-sr.xml:393:4: Multiple substitutions specified in non-positional format of string resource string/during_day_at. Did you mean to add the formatted=\"false\" attribute?\n/build/.gradle/caches/transforms-3/1fbb3dccd22c860adfb8fae6ccb06cee/transformed/jetified-commons-b34aef8104/res/values-fi/values-fi.xml:365:4: Multiple substitutions specified in non-positional format of string resource string/during_day_at. Did you mean to add the formatted=\"false\" attribute?\n/build/.gradle/caches/transforms-3/1fbb3dccd22c860adfb8fae6ccb06cee/transformed/jetified-commons-b34aef8104/res/values-gl/values-gl.xml:358:4: Multiple substitutions specified in non-positional format of string resource string/during_day_at. Did you mean to add the formatted=\"false\" attribute?\n/build/.gradle/caches/transforms-3/1fbb3dccd22c860adfb8fae6ccb06cee/transformed/jetified-commons-b34aef8104/res/values-pt-rBR/values-pt-rBR.xml:394:4: Multiple substitutions specified in non-positional format of string resource string/during_day_at. Did you mean to add the formatted=\"false\" attribute?\n/build/.gradle/caches/transforms-3/1fbb3dccd22c860adfb8fae6ccb06cee/transformed/jetified-commons-b34aef8104/res/values-lt/values-lt.xml:393:4: Multiple substitutions specified in non-positional format of string resource string/during_day_at. Did you mean to add the formatted=\"false\" attribute?\n/build/.gradle/caches/transforms-3/1fbb3dccd22c860adfb8fae6ccb06cee/transformed/jetified-commons-b34aef8104/res/values-fr/values-fr.xml:396:4: Multiple substitutions specified in non-positional format of string resource string/during_day_at. Did you mean to add the formatted=\"false\" attribute?\n/build/.gradle/caches/transforms-3/1fbb3dccd22c860adfb8fae6ccb06cee/transformed/jetified-commons-b34aef8104/res/values-pa/values-pa.xml:358:4: Multiple substitutions specified in non-positional format of string resource string/during_day_at. Did you mean to add the formatted=\"false\" attribute?\n/build/.gradle/caches/transforms-3/1fbb3dccd22c860adfb8fae6ccb06cee/transformed/jetified-commons-b34aef8104/res/values-uk/values-uk.xml:439:4: Multiple substitutions specified in non-positional format of string resource string/during_day_at. Did you mean to add the formatted=\"false\" attribute?\n/build/.gradle/caches/transforms-3/1fbb3dccd22c860adfb8fae6ccb06cee/transformed/jetified-commons-b34aef8104/res/values-eo/values-eo.xml:358:4: Multiple substitutions specified in non-positional format of string resource string/during_day_at. Did you mean to add the formatted=\"false\" attribute?\n/build/.gradle/caches/transforms-3/1fbb3dccd22c860adfb8fae6ccb06cee/transformed/jetified-commons-b34aef8104/res/values-eu/values-eu.xml:365:4: Multiple substitutions specified in non-positional format of string resource string/during_day_at. Did you mean to add the formatted=\"false\" attribute?\n/build/.gradle/caches/transforms-3/1fbb3dccd22c860adfb8fae6ccb06cee/transformed/jetified-commons-b34aef8104/res/values-nl/values-nl.xml:364:4: Multiple substitutions specified in non-positional format of string resource string/during_day_at. Did you mean to add the formatted=\"false\" attribute?\n/build/.gradle/caches/transforms-3/1fbb3dccd22c860adfb8fae6ccb06cee/transformed/jetified-commons-b34aef8104/res/values-pl/values-pl.xml:433:4: Multiple substitutions specified in non-positional format of string resource string/during_day_at. Did you mean to add the formatted=\"false\" attribute?\n\n> Task :app:optimizeCoreReleaseResources\n> Task :app:dataBindingGenBaseClassesPrepaidRelease\n> Task :app:generatePrepaidReleaseBuildConfig\n> Task :app:checkPrepaidReleaseAarMetadata\n> Task :app:mapPrepaidReleaseSourceSetPaths\n> Task :app:createPrepaidReleaseCompatibleScreenManifests\n> Task :app:extractDeepLinksPrepaidRelease\n\n> Task :app:processPrepaidReleaseMainManifest\n/build/repo/app/src/main/AndroidManifest.xml Warning:\n\tuses-permission#com.samsung.android.providers.context.permission.WRITE_USE_APP_FEATURE_SURVEY was tagged at AndroidManifest.xml:0 to remove other declarations but no other declaration present\n\n> Task :app:processPrepaidReleaseManifest\n> Task :app:processPrepaidReleaseManifestForPackage\n> Task :app:optimizeFossReleaseResources\n> Task :app:javaPreCompilePrepaidRelease\n> Task :app:mergePrepaidReleaseArtProfile\n> Task :app:mergePrepaidReleaseShaders\n> Task :app:compilePrepaidReleaseShaders NO-SOURCE\n> Task :app:generatePrepaidReleaseAssets UP-TO-DATE\n> Task :app:mergePrepaidReleaseAssets\n> Task :app:compressPrepaidReleaseAssets\n> Task :app:collectPrepaidReleaseDependencies\n> Task :app:sdkPrepaidReleaseDependencyData\n> Task :app:writePrepaidReleaseAppMetadata\n> Task :app:writePrepaidReleaseSigningConfigVersions\n> Task :app:processPrepaidReleaseResources\n> Task :app:optimizePrepaidReleaseResources\n> Task :app:compileCoreReleaseKotlin\n> Task :app:compileFossReleaseKotlin\n> Task :app:compilePrepaidReleaseKotlin\nw: file:///build/repo/app/src/main/kotlin/org/fossify/filemanager/activities/DecompressActivity.kt:86:19 'onBackPressed(): Unit' is deprecated. Deprecated in Java\nw: file:///build/repo/app/src/main/kotlin/org/fossify/filemanager/activities/MainActivity.kt:152:19 'onBackPressed(): Unit' is deprecated. Deprecated in Java\nw: file:///build/repo/app/src/main/kotlin/org/fossify/filemanager/activities/MainActivity.kt:157:17 'constructor Handler()' is deprecated. Deprecated in Java\nw: file:///build/repo/app/src/main/kotlin/org/fossify/filemanager/activities/MainActivity.kt:334:29 'startActivityForResult(Intent, Int): Unit' is deprecated. Deprecated in Java\nw: file:///build/repo/app/src/main/kotlin/org/fossify/filemanager/activities/MainActivity.kt:339:29 'startActivityForResult(Intent, Int): Unit' is deprecated. Deprecated in Java\nw: file:///build/repo/app/src/main/kotlin/org/fossify/filemanager/activities/MainActivity.kt:506:23 Type mismatch: inferred type is String? but String was expected\nw: file:///build/repo/app/src/main/kotlin/org/fossify/filemanager/activities/MimeTypesActivity.kt:245:24 'setOnActionExpandListener(MenuItem!, MenuItemCompat.OnActionExpandListener!): MenuItem!' is deprecated. Deprecated in Java\nw: file:///build/repo/app/src/main/kotlin/org/fossify/filemanager/activities/MimeTypesActivity.kt:245:90 'OnActionExpandListener' is deprecated. Deprecated in Java\nw: file:///build/repo/app/src/main/kotlin/org/fossify/filemanager/activities/ReadTextActivity.kt:71:46 'get(String!): Any?' is deprecated. Deprecated in Java\nw: file:///build/repo/app/src/main/kotlin/org/fossify/filemanager/activities/ReadTextActivity.kt:124:31 'onBackPressed(): Unit' is deprecated. Deprecated in Java\nw: file:///build/repo/app/src/main/kotlin/org/fossify/filemanager/activities/ReadTextActivity.kt:129:27 'onBackPressed(): Unit' is deprecated. Deprecated in Java\nw: file:///build/repo/app/src/main/kotlin/org/fossify/filemanager/activities/ReadTextActivity.kt:176:21 'startActivityForResult(Intent, Int): Unit' is deprecated. Deprecated in Java\nw: file:///build/repo/app/src/main/kotlin/org/fossify/filemanager/activities/ReadTextActivity.kt:206:23 'onBackPressed(): Unit' is deprecated. Deprecated in Java\nw: file:///build/repo/app/src/main/kotlin/org/fossify/filemanager/activities/SaveAsActivity.kt:38:49 'getParcelableExtra(String!): T?' is deprecated. Deprecated in Java\nw: file:///build/repo/app/src/main/kotlin/org/fossify/filemanager/adapters/DecompressItemsAdapter.kt:69:63 Parameter 'layoutPosition' is never used, could be renamed to _\nw: file:///build/repo/app/src/main/kotlin/org/fossify/filemanager/adapters/DecompressItemsAdapter.kt:81:21 Condition 'itemIcon != null' is always 'true'\nw: file:///build/repo/app/src/main/kotlin/org/fossify/filemanager/adapters/DecompressItemsAdapter.kt:136:34 'getDrawable(Int): Drawable!' is deprecated. Deprecated in Java\nw: file:///build/repo/app/src/main/kotlin/org/fossify/filemanager/adapters/ItemsAdapter.kt:175:85 Parameter 'layoutPosition' is never used, could be renamed to _\nw: file:///build/repo/app/src/main/kotlin/org/fossify/filemanager/adapters/ItemsAdapter.kt:280:38 'getDrawable(Int): Drawable!' is deprecated. Deprecated in Java\nw: file:///build/repo/app/src/main/kotlin/org/fossify/filemanager/adapters/ItemsAdapter.kt:317:22 'into(Int, Int): FutureTarget<TranscodeType!>!' is deprecated. Deprecated in Java\nw: file:///build/repo/app/src/main/kotlin/org/fossify/filemanager/adapters/ItemsAdapter.kt:694:42 Unsafe use of a nullable receiver of type Array<(out) File!>?\nw: file:///build/repo/app/src/main/kotlin/org/fossify/filemanager/adapters/ItemsAdapter.kt:780:108 Unchecked cast: List<ListItem> to kotlin.collections.ArrayList<FileDirItem> /* = java.util.ArrayList<FileDirItem> */\nw: file:///build/repo/app/src/main/kotlin/org/fossify/filemanager/adapters/ItemsAdapter.kt:786:42 Unchecked cast: Any to kotlin.collections.ArrayList<ListItem> /* = java.util.ArrayList<ListItem> */\nw: file:///build/repo/app/src/main/kotlin/org/fossify/filemanager/adapters/ItemsAdapter.kt:911:17 Conditional branch result of type Drawable! is implicitly cast to Any!\nw: file:///build/repo/app/src/main/kotlin/org/fossify/filemanager/adapters/ItemsAdapter.kt:913:17 Conditional branch result of type String is implicitly cast to Any!\nw: file:///build/repo/app/src/main/kotlin/org/fossify/filemanager/adapters/ItemsAdapter.kt:916:13 Conditional branch result of type String is implicitly cast to Any!\nw: file:///build/repo/app/src/main/kotlin/org/fossify/filemanager/adapters/ItemsAdapter.kt:931:34 'getDrawable(Int): Drawable!' is deprecated. Deprecated in Java\nw: file:///build/repo/app/src/main/kotlin/org/fossify/filemanager/adapters/ManageFavoritesAdapter.kt:55:59 Parameter 'layoutPosition' is never used, could be renamed to _\nw: file:///build/repo/app/src/main/kotlin/org/fossify/filemanager/dialogs/ChangeSortingDialog.kt:27:47 Parameter 'dialog' is never used, could be renamed to _\nw: file:///build/repo/app/src/main/kotlin/org/fossify/filemanager/dialogs/ChangeSortingDialog.kt:27:55 Parameter 'which' is never used, could be renamed to _\nw: file:///build/repo/app/src/main/kotlin/org/fossify/filemanager/dialogs/ChangeSortingDialog.kt:39:68 Parameter 'group' is never used, could be renamed to _\nw: file:///build/repo/app/src/main/kotlin/org/fossify/filemanager/dialogs/ChangeViewTypeDialog.kt:38:47 Parameter 'dialog' is never used, could be renamed to _\nw: file:///build/repo/app/src/main/kotlin/org/fossify/filemanager/dialogs/ChangeViewTypeDialog.kt:38:55 Parameter 'which' is never used, could be renamed to _\nw: file:///build/repo/app/src/main/kotlin/org/fossify/filemanager/dialogs/ManageVisibleTabsDialog.kt:38:47 Parameter 'dialog' is never used, could be renamed to _\nw: file:///build/repo/app/src/main/kotlin/org/fossify/filemanager/dialogs/ManageVisibleTabsDialog.kt:38:55 Parameter 'which' is never used, could be renamed to _\nw: file:///build/repo/app/src/main/kotlin/org/fossify/filemanager/extensions/Activity.kt:76:47 Parameter 'success' is never used, could be renamed to _\nw: file:///build/repo/app/src/main/kotlin/org/fossify/filemanager/extensions/Activity.kt:76:56 Parameter 'useAndroid30Way' is never used, could be renamed to _\nw: file:///build/repo/app/src/main/kotlin/org/fossify/filemanager/extensions/Activity.kt:87:22 'setter for systemUiVisibility: Int' is deprecated. Deprecated in Java\nw: file:///build/repo/app/src/main/kotlin/org/fossify/filemanager/extensions/Activity.kt:87:48 'SYSTEM_UI_FLAG_LAYOUT_STABLE: Int' is deprecated. Deprecated in Java\nw: file:///build/repo/app/src/main/kotlin/org/fossify/filemanager/extensions/Activity.kt:88:14 'SYSTEM_UI_FLAG_LAYOUT_HIDE_NAVIGATION: Int' is deprecated. Deprecated in Java\nw: file:///build/repo/app/src/main/kotlin/org/fossify/filemanager/extensions/Activity.kt:89:14 'SYSTEM_UI_FLAG_LAYOUT_FULLSCREEN: Int' is deprecated. Deprecated in Java\nw: file:///build/repo/app/src/main/kotlin/org/fossify/filemanager/extensions/Activity.kt:97:22 'setter for systemUiVisibility: Int' is deprecated. Deprecated in Java\nw: file:///build/repo/app/src/main/kotlin/org/fossify/filemanager/extensions/Activity.kt:97:48 'SYSTEM_UI_FLAG_LAYOUT_STABLE: Int' is deprecated. Deprecated in Java\nw: file:///build/repo/app/src/main/kotlin/org/fossify/filemanager/extensions/Activity.kt:98:14 'SYSTEM_UI_FLAG_LAYOUT_HIDE_NAVIGATION: Int' is deprecated. Deprecated in Java\nw: file:///build/repo/app/src/main/kotlin/org/fossify/filemanager/extensions/Activity.kt:99:14 'SYSTEM_UI_FLAG_HIDE_NAVIGATION: Int' is deprecated. Deprecated in Java\nw: file:///build/repo/app/src/main/kotlin/org/fossify/filemanager/extensions/Activity.kt:100:14 'SYSTEM_UI_FLAG_LAYOUT_FULLSCREEN: Int' is deprecated. Deprecated in Java\nw: file:///build/repo/app/src/main/kotlin/org/fossify/filemanager/extensions/Activity.kt:101:14 'SYSTEM_UI_FLAG_LOW_PROFILE: Int' is deprecated. Deprecated in Java\nw: file:///build/repo/app/src/main/kotlin/org/fossify/filemanager/extensions/Activity.kt:102:14 'SYSTEM_UI_FLAG_FULLSCREEN: Int' is deprecated. Deprecated in Java\nw: file:///build/repo/app/src/main/kotlin/org/fossify/filemanager/extensions/Activity.kt:103:14 'SYSTEM_UI_FLAG_IMMERSIVE: Int' is deprecated. Deprecated in Java\nw: file:///build/repo/app/src/main/kotlin/org/fossify/filemanager/fragments/StorageFragment.kt:123:42 'getColor(Int): Int' is deprecated. Deprecated in Java\nw: file:///build/repo/app/src/main/kotlin/org/fossify/filemanager/fragments/StorageFragment.kt:124:44 'getColor(Int): Int' is deprecated. Deprecated in Java\nw: file:///build/repo/app/src/main/kotlin/org/fossify/filemanager/fragments/StorageFragment.kt:125:48 'getColor(Int): Int' is deprecated. Deprecated in Java\nw: file:///build/repo/app/src/main/kotlin/org/fossify/filemanager/fragments/StorageFragment.kt:126:45 'getColor(Int): Int' is deprecated. Deprecated in Java\nw: file:///build/repo/app/src/main/kotlin/org/fossify/filemanager/fragments/StorageFragment.kt:127:43 'getColor(Int): Int' is deprecated. Deprecated in Java\nw: file:///build/repo/app/src/main/kotlin/org/fossify/filemanager/fragments/StorageFragment.kt:128:43 'getColor(Int): Int' is deprecated. Deprecated in Java\nw: file:///build/repo/app/src/main/kotlin/org/fossify/filemanager/fragments/StorageFragment.kt:370:25 Variable 'start' is never used\n\n> Task :app:compileCoreReleaseKotlin\nw: file:///build/repo/app/src/main/kotlin/org/fossify/filemanager/activities/DecompressActivity.kt:86:19 'onBackPressed(): Unit' is deprecated. Deprecated in Java\nw: file:///build/repo/app/src/main/kotlin/org/fossify/filemanager/activities/MainActivity.kt:152:19 'onBackPressed(): Unit' is deprecated. Deprecated in Java\nw: file:///build/repo/app/src/main/kotlin/org/fossify/filemanager/activities/MainActivity.kt:157:17 'constructor Handler()' is deprecated. Deprecated in Java\nw: file:///build/repo/app/src/main/kotlin/org/fossify/filemanager/activities/MainActivity.kt:334:29 'startActivityForResult(Intent, Int): Unit' is deprecated. Deprecated in Java\nw: file:///build/repo/app/src/main/kotlin/org/fossify/filemanager/activities/MainActivity.kt:339:29 'startActivityForResult(Intent, Int): Unit' is deprecated. Deprecated in Java\nw: file:///build/repo/app/src/main/kotlin/org/fossify/filemanager/activities/MainActivity.kt:506:23 Type mismatch: inferred type is String? but String was expected\nw: file:///build/repo/app/src/main/kotlin/org/fossify/filemanager/activities/MimeTypesActivity.kt:245:24 'setOnActionExpandListener(MenuItem!, MenuItemCompat.OnActionExpandListener!): MenuItem!' is deprecated. Deprecated in Java\nw: file:///build/repo/app/src/main/kotlin/org/fossify/filemanager/activities/MimeTypesActivity.kt:245:90 'OnActionExpandListener' is deprecated. Deprecated in Java\nw: file:///build/repo/app/src/main/kotlin/org/fossify/filemanager/activities/ReadTextActivity.kt:71:46 'get(String!): Any?' is deprecated. Deprecated in Java\nw: file:///build/repo/app/src/main/kotlin/org/fossify/filemanager/activities/ReadTextActivity.kt:124:31 'onBackPressed(): Unit' is deprecated. Deprecated in Java\nw: file:///build/repo/app/src/main/kotlin/org/fossify/filemanager/activities/ReadTextActivity.kt:129:27 'onBackPressed(): Unit' is deprecated. Deprecated in Java\nw: file:///build/repo/app/src/main/kotlin/org/fossify/filemanager/activities/ReadTextActivity.kt:176:21 'startActivityForResult(Intent, Int): Unit' is deprecated. Deprecated in Java\nw: file:///build/repo/app/src/main/kotlin/org/fossify/filemanager/activities/ReadTextActivity.kt:206:23 'onBackPressed(): Unit' is deprecated. Deprecated in Java\nw: file:///build/repo/app/src/main/kotlin/org/fossify/filemanager/activities/SaveAsActivity.kt:38:49 'getParcelableExtra(String!): T?' is deprecated. Deprecated in Java\nw: file:///build/repo/app/src/main/kotlin/org/fossify/filemanager/adapters/DecompressItemsAdapter.kt:69:63 Parameter 'layoutPosition' is never used, could be renamed to _\nw: file:///build/repo/app/src/main/kotlin/org/fossify/filemanager/adapters/DecompressItemsAdapter.kt:81:21 Condition 'itemIcon != null' is always 'true'\nw: file:///build/repo/app/src/main/kotlin/org/fossify/filemanager/adapters/DecompressItemsAdapter.kt:136:34 'getDrawable(Int): Drawable!' is deprecated. Deprecated in Java\nw: file:///build/repo/app/src/main/kotlin/org/fossify/filemanager/adapters/ItemsAdapter.kt:175:85 Parameter 'layoutPosition' is never used, could be renamed to _\nw: file:///build/repo/app/src/main/kotlin/org/fossify/filemanager/adapters/ItemsAdapter.kt:280:38 'getDrawable(Int): Drawable!' is deprecated. Deprecated in Java\nw: file:///build/repo/app/src/main/kotlin/org/fossify/filemanager/adapters/ItemsAdapter.kt:317:22 'into(Int, Int): FutureTarget<TranscodeType!>!' is deprecated. Deprecated in Java\nw: file:///build/repo/app/src/main/kotlin/org/fossify/filemanager/adapters/ItemsAdapter.kt:694:42 Unsafe use of a nullable receiver of type Array<(out) File!>?\nw: file:///build/repo/app/src/main/kotlin/org/fossify/filemanager/adapters/ItemsAdapter.kt:780:108 Unchecked cast: List<ListItem> to kotlin.collections.ArrayList<FileDirItem> /* = java.util.ArrayList<FileDirItem> */\nw: file:///build/repo/app/src/main/kotlin/org/fossify/filemanager/adapters/ItemsAdapter.kt:786:42 Unchecked cast: Any to kotlin.collections.ArrayList<ListItem> /* = java.util.ArrayList<ListItem> */\nw: file:///build/repo/app/src/main/kotlin/org/fossify/filemanager/adapters/ItemsAdapter.kt:911:17 Conditional branch result of type Drawable! is implicitly cast to Any!\nw: file:///build/repo/app/src/main/kotlin/org/fossify/filemanager/adapters/ItemsAdapter.kt:913:17 Conditional branch result of type String is implicitly cast to Any!\nw: file:///build/repo/app/src/main/kotlin/org/fossify/filemanager/adapters/ItemsAdapter.kt:916:13 Conditional branch result of type String is implicitly cast to Any!\nw: file:///build/repo/app/src/main/kotlin/org/fossify/filemanager/adapters/ItemsAdapter.kt:931:34 'getDrawable(Int): Drawable!' is deprecated. Deprecated in Java\nw: file:///build/repo/app/src/main/kotlin/org/fossify/filemanager/adapters/ManageFavoritesAdapter.kt:55:59 Parameter 'layoutPosition' is never used, could be renamed to _\nw: file:///build/repo/app/src/main/kotlin/org/fossify/filemanager/dialogs/ChangeSortingDialog.kt:27:47 Parameter 'dialog' is never used, could be renamed to _\nw: file:///build/repo/app/src/main/kotlin/org/fossify/filemanager/dialogs/ChangeSortingDialog.kt:27:55 Parameter 'which' is never used, could be renamed to _\nw: file:///build/repo/app/src/main/kotlin/org/fossify/filemanager/dialogs/ChangeSortingDialog.kt:39:68 Parameter 'group' is never used, could be renamed to _\nw: file:///build/repo/app/src/main/kotlin/org/fossify/filemanager/dialogs/ChangeViewTypeDialog.kt:38:47 Parameter 'dialog' is never used, could be renamed to _\nw: file:///build/repo/app/src/main/kotlin/org/fossify/filemanager/dialogs/ChangeViewTypeDialog.kt:38:55 Parameter 'which' is never used, could be renamed to _\nw: file:///build/repo/app/src/main/kotlin/org/fossify/filemanager/dialogs/ManageVisibleTabsDialog.kt:38:47 Parameter 'dialog' is never used, could be renamed to _\nw: file:///build/repo/app/src/main/kotlin/org/fossify/filemanager/dialogs/ManageVisibleTabsDialog.kt:38:55 Parameter 'which' is never used, could be renamed to _\nw: file:///build/repo/app/src/main/kotlin/org/fossify/filemanager/extensions/Activity.kt:76:47 Parameter 'success' is never used, could be renamed to _\nw: file:///build/repo/app/src/main/kotlin/org/fossify/filemanager/extensions/Activity.kt:76:56 Parameter 'useAndroid30Way' is never used, could be renamed to _\nw: file:///build/repo/app/src/main/kotlin/org/fossify/filemanager/extensions/Activity.kt:87:22 'setter for systemUiVisibility: Int' is deprecated. Deprecated in Java\nw: file:///build/repo/app/src/main/kotlin/org/fossify/filemanager/extensions/Activity.kt:87:48 'SYSTEM_UI_FLAG_LAYOUT_STABLE: Int' is deprecated. Deprecated in Java\nw: file:///build/repo/app/src/main/kotlin/org/fossify/filemanager/extensions/Activity.kt:88:14 'SYSTEM_UI_FLAG_LAYOUT_HIDE_NAVIGATION: Int' is deprecated. Deprecated in Java\nw: file:///build/repo/app/src/main/kotlin/org/fossify/filemanager/extensions/Activity.kt:89:14 'SYSTEM_UI_FLAG_LAYOUT_FULLSCREEN: Int' is deprecated. Deprecated in Java\nw: file:///build/repo/app/src/main/kotlin/org/fossify/filemanager/extensions/Activity.kt:97:22 'setter for systemUiVisibility: Int' is deprecated. Deprecated in Java\nw: file:///build/repo/app/src/main/kotlin/org/fossify/filemanager/extensions/Activity.kt:97:48 'SYSTEM_UI_FLAG_LAYOUT_STABLE: Int' is deprecated. Deprecated in Java\nw: file:///build/repo/app/src/main/kotlin/org/fossify/filemanager/extensions/Activity.kt:98:14 'SYSTEM_UI_FLAG_LAYOUT_HIDE_NAVIGATION: Int' is deprecated. Deprecated in Java\nw: file:///build/repo/app/src/main/kotlin/org/fossify/filemanager/extensions/Activity.kt:99:14 'SYSTEM_UI_FLAG_HIDE_NAVIGATION: Int' is deprecated. Deprecated in Java\nw: file:///build/repo/app/src/main/kotlin/org/fossify/filemanager/extensions/Activity.kt:100:14 'SYSTEM_UI_FLAG_LAYOUT_FULLSCREEN: Int' is deprecated. Deprecated in Java\nw: file:///build/repo/app/src/main/kotlin/org/fossify/filemanager/extensions/Activity.kt:101:14 'SYSTEM_UI_FLAG_LOW_PROFILE: Int' is deprecated. Deprecated in Java\nw: file:///build/repo/app/src/main/kotlin/org/fossify/filemanager/extensions/Activity.kt:102:14 'SYSTEM_UI_FLAG_FULLSCREEN: Int' is deprecated. Deprecated in Java\nw: file:///build/repo/app/src/main/kotlin/org/fossify/filemanager/extensions/Activity.kt:103:14 'SYSTEM_UI_FLAG_IMMERSIVE: Int' is deprecated. Deprecated in Java\nw: file:///build/repo/app/src/main/kotlin/org/fossify/filemanager/fragments/StorageFragment.kt:123:42 'getColor(Int): Int' is deprecated. Deprecated in Java\nw: file:///build/repo/app/src/main/kotlin/org/fossify/filemanager/fragments/StorageFragment.kt:124:44 'getColor(Int): Int' is deprecated. Deprecated in Java\nw: file:///build/repo/app/src/main/kotlin/org/fossify/filemanager/fragments/StorageFragment.kt:125:48 'getColor(Int): Int' is deprecated. Deprecated in Java\nw: file:///build/repo/app/src/main/kotlin/org/fossify/filemanager/fragments/StorageFragment.kt:126:45 'getColor(Int): Int' is deprecated. Deprecated in Java\nw: file:///build/repo/app/src/main/kotlin/org/fossify/filemanager/fragments/StorageFragment.kt:127:43 'getColor(Int): Int' is deprecated. Deprecated in Java\nw: file:///build/repo/app/src/main/kotlin/org/fossify/filemanager/fragments/StorageFragment.kt:128:43 'getColor(Int): Int' is deprecated. Deprecated in Java\nw: file:///build/repo/app/src/main/kotlin/org/fossify/filemanager/fragments/StorageFragment.kt:370:25 Variable 'start' is never used\n\n> Task :app:compileFossReleaseKotlin\nw: file:///build/repo/app/src/main/kotlin/org/fossify/filemanager/activities/DecompressActivity.kt:86:19 'onBackPressed(): Unit' is deprecated. Deprecated in Java\nw: file:///build/repo/app/src/main/kotlin/org/fossify/filemanager/activities/MainActivity.kt:152:19 'onBackPressed(): Unit' is deprecated. Deprecated in Java\nw: file:///build/repo/app/src/main/kotlin/org/fossify/filemanager/activities/MainActivity.kt:157:17 'constructor Handler()' is deprecated. Deprecated in Java\nw: file:///build/repo/app/src/main/kotlin/org/fossify/filemanager/activities/MainActivity.kt:334:29 'startActivityForResult(Intent, Int): Unit' is deprecated. Deprecated in Java\nw: file:///build/repo/app/src/main/kotlin/org/fossify/filemanager/activities/MainActivity.kt:339:29 'startActivityForResult(Intent, Int): Unit' is deprecated. Deprecated in Java\nw: file:///build/repo/app/src/main/kotlin/org/fossify/filemanager/activities/MainActivity.kt:506:23 Type mismatch: inferred type is String? but String was expected\nw: file:///build/repo/app/src/main/kotlin/org/fossify/filemanager/activities/MimeTypesActivity.kt:245:24 'setOnActionExpandListener(MenuItem!, MenuItemCompat.OnActionExpandListener!): MenuItem!' is deprecated. Deprecated in Java\nw: file:///build/repo/app/src/main/kotlin/org/fossify/filemanager/activities/MimeTypesActivity.kt:245:90 'OnActionExpandListener' is deprecated. Deprecated in Java\nw: file:///build/repo/app/src/main/kotlin/org/fossify/filemanager/activities/ReadTextActivity.kt:71:46 'get(String!): Any?' is deprecated. Deprecated in Java\nw: file:///build/repo/app/src/main/kotlin/org/fossify/filemanager/activities/ReadTextActivity.kt:124:31 'onBackPressed(): Unit' is deprecated. Deprecated in Java\nw: file:///build/repo/app/src/main/kotlin/org/fossify/filemanager/activities/ReadTextActivity.kt:129:27 'onBackPressed(): Unit' is deprecated. Deprecated in Java\nw: file:///build/repo/app/src/main/kotlin/org/fossify/filemanager/activities/ReadTextActivity.kt:176:21 'startActivityForResult(Intent, Int): Unit' is deprecated. Deprecated in Java\nw: file:///build/repo/app/src/main/kotlin/org/fossify/filemanager/activities/ReadTextActivity.kt:206:23 'onBackPressed(): Unit' is deprecated. Deprecated in Java\nw: file:///build/repo/app/src/main/kotlin/org/fossify/filemanager/activities/SaveAsActivity.kt:38:49 'getParcelableExtra(String!): T?' is deprecated. Deprecated in Java\nw: file:///build/repo/app/src/main/kotlin/org/fossify/filemanager/adapters/DecompressItemsAdapter.kt:69:63 Parameter 'layoutPosition' is never used, could be renamed to _\nw: file:///build/repo/app/src/main/kotlin/org/fossify/filemanager/adapters/DecompressItemsAdapter.kt:81:21 Condition 'itemIcon != null' is always 'true'\nw: file:///build/repo/app/src/main/kotlin/org/fossify/filemanager/adapters/DecompressItemsAdapter.kt:136:34 'getDrawable(Int): Drawable!' is deprecated. Deprecated in Java\nw: file:///build/repo/app/src/main/kotlin/org/fossify/filemanager/adapters/ItemsAdapter.kt:175:85 Parameter 'layoutPosition' is never used, could be renamed to _\nw: file:///build/repo/app/src/main/kotlin/org/fossify/filemanager/adapters/ItemsAdapter.kt:280:38 'getDrawable(Int): Drawable!' is deprecated. Deprecated in Java\nw: file:///build/repo/app/src/main/kotlin/org/fossify/filemanager/adapters/ItemsAdapter.kt:317:22 'into(Int, Int): FutureTarget<TranscodeType!>!' is deprecated. Deprecated in Java\nw: file:///build/repo/app/src/main/kotlin/org/fossify/filemanager/adapters/ItemsAdapter.kt:694:42 Unsafe use of a nullable receiver of type Array<(out) File!>?\nw: file:///build/repo/app/src/main/kotlin/org/fossify/filemanager/adapters/ItemsAdapter.kt:780:108 Unchecked cast: List<ListItem> to kotlin.collections.ArrayList<FileDirItem> /* = java.util.ArrayList<FileDirItem> */\nw: file:///build/repo/app/src/main/kotlin/org/fossify/filemanager/adapters/ItemsAdapter.kt:786:42 Unchecked cast: Any to kotlin.collections.ArrayList<ListItem> /* = java.util.ArrayList<ListItem> */\nw: file:///build/repo/app/src/main/kotlin/org/fossify/filemanager/adapters/ItemsAdapter.kt:911:17 Conditional branch result of type Drawable! is implicitly cast to Any!\nw: file:///build/repo/app/src/main/kotlin/org/fossify/filemanager/adapters/ItemsAdapter.kt:913:17 Conditional branch result of type String is implicitly cast to Any!\nw: file:///build/repo/app/src/main/kotlin/org/fossify/filemanager/adapters/ItemsAdapter.kt:916:13 Conditional branch result of type String is implicitly cast to Any!\nw: file:///build/repo/app/src/main/kotlin/org/fossify/filemanager/adapters/ItemsAdapter.kt:931:34 'getDrawable(Int): Drawable!' is deprecated. Deprecated in Java\nw: file:///build/repo/app/src/main/kotlin/org/fossify/filemanager/adapters/ManageFavoritesAdapter.kt:55:59 Parameter 'layoutPosition' is never used, could be renamed to _\nw: file:///build/repo/app/src/main/kotlin/org/fossify/filemanager/dialogs/ChangeSortingDialog.kt:27:47 Parameter 'dialog' is never used, could be renamed to _\nw: file:///build/repo/app/src/main/kotlin/org/fossify/filemanager/dialogs/ChangeSortingDialog.kt:27:55 Parameter 'which' is never used, could be renamed to _\nw: file:///build/repo/app/src/main/kotlin/org/fossify/filemanager/dialogs/ChangeSortingDialog.kt:39:68 Parameter 'group' is never used, could be renamed to _\nw: file:///build/repo/app/src/main/kotlin/org/fossify/filemanager/dialogs/ChangeViewTypeDialog.kt:38:47 Parameter 'dialog' is never used, could be renamed to _\nw: file:///build/repo/app/src/main/kotlin/org/fossify/filemanager/dialogs/ChangeViewTypeDialog.kt:38:55 Parameter 'which' is never used, could be renamed to _\nw: file:///build/repo/app/src/main/kotlin/org/fossify/filemanager/dialogs/ManageVisibleTabsDialog.kt:38:47 Parameter 'dialog' is never used, could be renamed to _\nw: file:///build/repo/app/src/main/kotlin/org/fossify/filemanager/dialogs/ManageVisibleTabsDialog.kt:38:55 Parameter 'which' is never used, could be renamed to _\nw: file:///build/repo/app/src/main/kotlin/org/fossify/filemanager/extensions/Activity.kt:76:47 Parameter 'success' is never used, could be renamed to _\nw: file:///build/repo/app/src/main/kotlin/org/fossify/filemanager/extensions/Activity.kt:76:56 Parameter 'useAndroid30Way' is never used, could be renamed to _\nw: file:///build/repo/app/src/main/kotlin/org/fossify/filemanager/extensions/Activity.kt:87:22 'setter for systemUiVisibility: Int' is deprecated. Deprecated in Java\nw: file:///build/repo/app/src/main/kotlin/org/fossify/filemanager/extensions/Activity.kt:87:48 'SYSTEM_UI_FLAG_LAYOUT_STABLE: Int' is deprecated. Deprecated in Java\nw: file:///build/repo/app/src/main/kotlin/org/fossify/filemanager/extensions/Activity.kt:88:14 'SYSTEM_UI_FLAG_LAYOUT_HIDE_NAVIGATION: Int' is deprecated. Deprecated in Java\nw: file:///build/repo/app/src/main/kotlin/org/fossify/filemanager/extensions/Activity.kt:89:14 'SYSTEM_UI_FLAG_LAYOUT_FULLSCREEN: Int' is deprecated. Deprecated in Java\nw: file:///build/repo/app/src/main/kotlin/org/fossify/filemanager/extensions/Activity.kt:97:22 'setter for systemUiVisibility: Int' is deprecated. Deprecated in Java\nw: file:///build/repo/app/src/main/kotlin/org/fossify/filemanager/extensions/Activity.kt:97:48 'SYSTEM_UI_FLAG_LAYOUT_STABLE: Int' is deprecated. Deprecated in Java\nw: file:///build/repo/app/src/main/kotlin/org/fossify/filemanager/extensions/Activity.kt:98:14 'SYSTEM_UI_FLAG_LAYOUT_HIDE_NAVIGATION: Int' is deprecated. Deprecated in Java\nw: file:///build/repo/app/src/main/kotlin/org/fossify/filemanager/extensions/Activity.kt:99:14 'SYSTEM_UI_FLAG_HIDE_NAVIGATION: Int' is deprecated. Deprecated in Java\nw: file:///build/repo/app/src/main/kotlin/org/fossify/filemanager/extensions/Activity.kt:100:14 'SYSTEM_UI_FLAG_LAYOUT_FULLSCREEN: Int' is deprecated. Deprecated in Java\nw: file:///build/repo/app/src/main/kotlin/org/fossify/filemanager/extensions/Activity.kt:101:14 'SYSTEM_UI_FLAG_LOW_PROFILE: Int' is deprecated. Deprecated in Java\nw: file:///build/repo/app/src/main/kotlin/org/fossify/filemanager/extensions/Activity.kt:102:14 'SYSTEM_UI_FLAG_FULLSCREEN: Int' is deprecated. Deprecated in Java\nw: file:///build/repo/app/src/main/kotlin/org/fossify/filemanager/extensions/Activity.kt:103:14 'SYSTEM_UI_FLAG_IMMERSIVE: Int' is deprecated. Deprecated in Java\nw: file:///build/repo/app/src/main/kotlin/org/fossify/filemanager/fragments/StorageFragment.kt:123:42 'getColor(Int): Int' is deprecated. Deprecated in Java\nw: file:///build/repo/app/src/main/kotlin/org/fossify/filemanager/fragments/StorageFragment.kt:124:44 'getColor(Int): Int' is deprecated. Deprecated in Java\nw: file:///build/repo/app/src/main/kotlin/org/fossify/filemanager/fragments/StorageFragment.kt:125:48 'getColor(Int): Int' is deprecated. Deprecated in Java\nw: file:///build/repo/app/src/main/kotlin/org/fossify/filemanager/fragments/StorageFragment.kt:126:45 'getColor(Int): Int' is deprecated. Deprecated in Java\nw: file:///build/repo/app/src/main/kotlin/org/fossify/filemanager/fragments/StorageFragment.kt:127:43 'getColor(Int): Int' is deprecated. Deprecated in Java\nw: file:///build/repo/app/src/main/kotlin/org/fossify/filemanager/fragments/StorageFragment.kt:128:43 'getColor(Int): Int' is deprecated. Deprecated in Java\nw: file:///build/repo/app/src/main/kotlin/org/fossify/filemanager/fragments/StorageFragment.kt:370:25 Variable 'start' is never used\n\n> Task :app:compilePrepaidReleaseJavaWithJavac\n> Task :app:compileCoreReleaseJavaWithJavac\n> Task :app:mergeCoreReleaseGeneratedProguardFiles\n> Task :app:processCoreReleaseJavaRes\n> Task :app:expandCoreReleaseArtProfileWildcards\n> Task :app:compileFossReleaseJavaWithJavac\n> Task :app:mergeFossReleaseGeneratedProguardFiles\n> Task :app:processFossReleaseJavaRes\n> Task :app:expandPrepaidReleaseArtProfileWildcards\n> Task :app:mergePrepaidReleaseGeneratedProguardFiles\n> Task :app:processPrepaidReleaseJavaRes\n> Task :app:expandFossReleaseArtProfileWildcards\n> Task :app:mergeCoreReleaseJavaResource\n> Task :app:mergeFossReleaseJavaResource\n> Task :app:mergePrepaidReleaseJavaResource\n\n> Task :app:minifyCoreReleaseWithR8\nWARNING: /build/repo/app/build/intermediates/merged_java_res/coreRelease/mergeCoreReleaseJavaResource/base.jar: R8: Unexpected reference to missing service class: META-INF/services/org.jetbrains.kotlin.compiler.plugin.CommandLineProcessor.\nWARNING: /build/repo/app/build/intermediates/merged_java_res/coreRelease/mergeCoreReleaseJavaResource/base.jar: R8: Unexpected reference to missing service class: META-INF/services/org.jetbrains.kotlin.compiler.plugin.ComponentRegistrar.\nWARNING: /build/repo/app/build/intermediates/merged_java_res/coreRelease/mergeCoreReleaseJavaResource/base.jar: R8: Unexpected reference to missing service class: META-INF/services/org.jetbrains.kotlin.diagnostics.rendering.DefaultErrorMessages$Extension.\n\n> Task :app:compileCoreReleaseArtProfile\n> Task :app:packageCoreRelease\n> Task :app:createCoreReleaseApkListingFileRedirect\n> Task :app:assembleCoreRelease\n\n> Task :app:minifyFossReleaseWithR8\nWARNING: /build/repo/app/build/intermediates/merged_java_res/fossRelease/mergeFossReleaseJavaResource/base.jar: R8: Unexpected reference to missing service class: META-INF/services/org.jetbrains.kotlin.compiler.plugin.CommandLineProcessor.\nWARNING: /build/repo/app/build/intermediates/merged_java_res/fossRelease/mergeFossReleaseJavaResource/base.jar: R8: Unexpected reference to missing service class: META-INF/services/org.jetbrains.kotlin.compiler.plugin.ComponentRegistrar.\nWARNING: /build/repo/app/build/intermediates/merged_java_res/fossRelease/mergeFossReleaseJavaResource/base.jar: R8: Unexpected reference to missing service class: META-INF/services/org.jetbrains.kotlin.diagnostics.rendering.DefaultErrorMessages$Extension.\n\n> Task :app:compileFossReleaseArtProfile\n> Task :app:packageFossRelease\n> Task :app:createFossReleaseApkListingFileRedirect\n> Task :app:assembleFossRelease\n\n> Task :app:minifyPrepaidReleaseWithR8\nWARNING: /build/repo/app/build/intermediates/merged_java_res/prepaidRelease/mergePrepaidReleaseJavaResource/base.jar: R8: Unexpected reference to missing service class: META-INF/services/org.jetbrains.kotlin.compiler.plugin.CommandLineProcessor.\nWARNING: /build/repo/app/build/intermediates/merged_java_res/prepaidRelease/mergePrepaidReleaseJavaResource/base.jar: R8: Unexpected reference to missing service class: META-INF/services/org.jetbrains.kotlin.compiler.plugin.ComponentRegistrar.\nWARNING: /build/repo/app/build/intermediates/merged_java_res/prepaidRelease/mergePrepaidReleaseJavaResource/base.jar: R8: Unexpected reference to missing service class: META-INF/services/org.jetbrains.kotlin.diagnostics.rendering.DefaultErrorMessages$Extension.\n\n> Task :app:compilePrepaidReleaseArtProfile\n> Task :app:packagePrepaidRelease\n> Task :app:createPrepaidReleaseApkListingFileRedirect\n> Task :app:assemblePrepaidRelease\n> Task :app:assembleRelease\n\nBUILD SUCCESSFUL in 6m 37s\n107 actionable tasks: 107 executed\n+ mv app/build/outputs/apk/foss/release/file-manager-1-foss-release-unsigned.apk /outputs/unsigned.apk\n",
        "upstream_signed_apk_sha256": "4959e64475f9687ef022a2ea7a7235bb787be2f95ad25e07da3ba3eb14918d1b",
        "built_unsigned_apk_sha256": "c83203d057c04d75541d393603a0ac50acf9299b802074f29700759ab5e3f154",
        "signature_copied_apk_sha256": "4959e64475f9687ef022a2ea7a7235bb787be2f95ad25e07da3ba3eb14918d1b"
      }
    ]
  },
  "version_codes": {
    "1": [
      "1.0.0"
    ]
  },
  "sha256": {
    "4959e64475f9687ef022a2ea7a7235bb787be2f95ad25e07da3ba3eb14918d1b": [
      "1.0.0"
    ]
  }
}
